link,category,title,abstract,keywords,ccs_concepts,author_names,affiliations,author_countries
https://iclr.cc/virtual/2023/poster/11145,Privacy & Data Governance,On the Trade-Off between Actionable Explanations and the Right to be Forgotten,"As machine learning (ML) models are increasingly being deployed in high-stakes applications, policymakers have suggested tighter data protection regulations (e.g., GDPR, CCPA). One key principle is the “right to be forgotten” which gives users the right to have their data deleted. Another key principle is the right to an actionable explanation, also known as algorithmic recourse, allowing users to reverse unfavorable decisions. To date, it is unknown whether these two principles can be operationalized simultaneously. Therefore, we introduce and study the problem of recourse invalidation in the context of data deletion requests. More specifically, we theoretically and empirically analyze the behavior of popular state-of-the-art algorithms and demonstrate that the recourses generated by these algorithms are likely to be invalidated if a small number of data deletion requests (e.g., 1 or 2) warrant updates of the predictive model. For the setting of differentiable models, we suggest a framework to identify a minimal subset of critical training points which, when removed, maximize the fraction of invalidated recourses.Using our framework, we empirically show that the removal of as little as 2 data instances from the training set can invalidate up to 95 percent of all recourses output by popular state-of-the-art algorithms. Thus, our work raises fundamental questions about the compatibility ofthe right to an actionable explanation'' in the context of theright to be forgotten'', while also providing constructive insights on the determining factors of recourse robustness.","['Social Aspects of Machine Learning', 'transparency', 'Counterfactual Explanations', 'Algorihtmic Recourse', 'interpretability', 'explainability']",[],"['Martin Pawelczyk', 'Tobias Leemann', 'Asia Biega', 'Gjergji Kasneci']","['Harvard University', 'Technische Universität München', 'Max Planck Institute for Security and Privacy', 'Technische Universität München']",[]
https://iclr.cc/virtual/2023/poster/10982,Privacy & Data Governance,Synthetic Data Generation of Many-to-Many Datasets via Random Graph Generation,"Synthetic data generation (SDG) has become a popular approach to release private datasets.In SDG, a generative model is fitted on the private real data, and samples drawn from the model are released as the protected synthetic data.While real-world datasets usually consist of multiple tables with potential \emph{many-to-many} relationships (i.e.~\emph{many-to-many datasets}), recent research in SDG mostly focuses on modeling tables \emph{independently} or only considers generating datasets with special cases of many-to-many relationships such as \emph{one-to-many}.In this paper, we first study challenges of building faithful generative models for many-to-many datasets, identifying limitations of existing methods.We then present a novel factorization for many-to-many generative models,  which leads to a scalable generation framework by combining recent results from random graph theory and representation learning.Finally, we extend the framework to establish the notion of $(\epsilon,\delta)$-differential privacy.Through a real-world dataset, we demonstrate that our method can generate synthetic datasets while preserving information within and across tables better than its closest competitor.","['Generative models', 'differential privacy', 'random graph generation', 'synthetic data generation']",[],"['Kai Xu', 'Georgi Ganev', 'Emile Joubert', 'Rees Davison', 'Olivier Van Acker', 'Luke Robinson']","['Amazon', 'University College London, University of London', 'University of Cape Town', 'University of Oxford', 'Birkbeck College, University of London', 'Hazy']",[]
https://iclr.cc/virtual/2023/poster/11012,Privacy & Data Governance,Federated Learning from Small Datasets,"Federated learning allows multiple parties to collaboratively train a joint model without having to share any local data. It enables applications of machine learning in settings where data is inherently distributed and undisclosable, such as in the medical domain. Joint training is usually achieved by aggregating local models. When local datasets are small, locally trained models can vary greatly from a globally good model. Bad local models can arbitrarily deteriorate the aggregate model quality, causing federating learning to fail in these settings. We propose a novel approach that avoids this problem by interleaving model aggregation and permutation steps. During a permutation step we redistribute local models across clients through the server, while preserving data privacy, to allow each local model to train on a daisy chain of local datasets. This enables successful training in data-sparse domains. Combined with model aggregation, this approach enables effective learning even if the local datasets are extremely small, while retaining the privacy benefits of federated learning.","['Deep Learning and representational learning', 'small datasets', 'Distributed', 'daisy chain', 'sparse data', 'federated learning']",[],"['Michael Kamp', 'Jonas Fischer', 'Jilles Vreeken']","['Institute for AI in Medicine IKIM', 'Harvard TH Chan School of Public Health', 'CISPA Helmholtz Center for Information Security']",[]
https://iclr.cc/virtual/2023/poster/11368,Privacy & Data Governance,Federated Nearest Neighbor Machine Translation,"To protect user privacy and meet legal regulations, federated learning (FL) is attracting significant attention. Training neural machine translation (NMT) models with traditional FL algorithm (e.g., FedAvg) typically relies on multi-round model-based interactions. However, it is impractical and inefficient for machine translation tasks due to the vast communication overheads and heavy synchronization. In this paper, we propose a novel federated nearest neighbor (FedNN) machine translation framework that, instead of multi-round model-based interactions, leverages one-round memorization-based interaction to share knowledge across different clients to build low-overhead privacy-preserving systems. The whole approach equips the public NMT model trained on large-scale accessible data with a $k$-nearest-neighbor ($k$NN) classifier and integrates the external datastore constructed by private text data in all clients to form the final FL model.  A two-phase datastore encryption strategy is introduced to achieve privacy-preserving during this process.  Extensive experiments show that FedNN significantly reduces computational and communication costs compared with FedAvg, while maintaining promising performance in different FL settings.","['Applications', 'Memorization Augmentation', 'machine translation', 'federated learning']",[],"['Yichao Du', 'Zhirui Zhang', 'Bingzhe Wu', 'Lemao Liu', 'Tong Xu', 'Enhong Chen']","['University of Science and Technology of China', 'Tencent AI Lab', 'Peking University', 'Tencent AI Lab', 'University of Science and Technology of China', 'University of Science and Technology of China']",[]
https://iclr.cc/virtual/2023/poster/11519,Privacy & Data Governance,Efficient Model Updates for Approximate Unlearning of Graph-Structured Data,"With the adoption of recent laws ensuring the ``right to be forgotten'', the problem of machine unlearning has become of significant importance. This is particularly the case for graph-structured data, and learning tools specialized for such data, including graph neural networks (GNNs). This work introduces the first known approach for \emph{approximate graph unlearning} with provable theoretical guarantees. The challenges in addressing the problem are two-fold. First, there exist multiple different types of unlearning requests that need to be considered, including node feature, edge and node unlearning. Second, to establish provable performance guarantees, one needs to carefully evaluate the process of feature mixing during propagation. We focus on analyzing Simple Graph Convolutions (SGC) and their generalized PageRank (GPR) extensions, thereby laying the theoretical foundations for unlearning GNNs. Empirical evaluations of six benchmark datasets demonstrate excellent performance/complexity/privacy trade-offs of our approach compared to complete retraining and general methods that do not leverage graph information. For example, unlearning $200$ out of $1208$ training nodes of the Cora dataset only leads to a $0.1\%$ loss in test accuracy, but offers a $4$-fold speed-up compared to complete retraining with a $(\epsilon,\delta)=(1,10^{-4})$ ``privacy cost''. We also exhibit a $12\%$ increase in test accuracy for the same dataset when compared to unlearning methods that do not leverage graph information, with comparable time complexity and the same privacy guarantee.","['Social Aspects of Machine Learning', 'machine unlearning', 'graph unlearning', 'privacy']",[],"['Eli Chien', 'Chao Pan', 'Olgica Milenkovic']","['Georgia Institute of Technology', 'University of Illinois, Urbana Champaign', 'University of Illinois, Urbana Champaign']",[]
https://iclr.cc/virtual/2023/poster/12111,Privacy & Data Governance,Disparate Impact in Differential Privacy from Gradient Misalignment,"As machine learning becomes more widespread throughout society, aspects including data privacy and fairness must be carefully considered, and are crucial for deployment in highly regulated industries. Unfortunately, the application of privacy enhancing technologies can worsen unfair tendencies in models. In particular, one of the most widely used techniques for private model training, differentially private stochastic gradient descent (DPSGD), frequently intensifies disparate impact on groups within data. In this work we study the fine-grained causes of unfairness in DPSGD and identify gradient misalignment due to inequitable gradient clipping as the most significant source. This observation leads us to a new method for reducing unfairness by preventing gradient misalignment in DPSGD.","['Social Aspects of Machine Learning', 'differential privacy', 'privacy', 'fairness']",[],"['Maria S. Esipova', 'Atiyeh Ashari Ghomi', 'Yaqiao Luo', 'Jesse C. Cresswell']","['University of Waterloo', 'Department of Computer Science, University of Toronto', 'Department of Computer Science, University of Toronto', 'Layer 6 AI']",[]
https://iclr.cc/virtual/2023/poster/11554,Privacy & Data Governance,Turning the Curse of Heterogeneity in Federated Learning into a Blessing for Out-of-Distribution Detection,"Deep neural networks have witnessed huge successes in many challenging prediction tasks and yet they often suffer from out-of-distribution (OoD) samples, misclassifying them with high confidence. Recent advances show promising OoD detection performance for centralized training, and however, OoD detection in federated learning (FL) is largely overlooked, even though many security sensitive applications such as autonomous driving and voice recognition authorization are commonly trained using FL for data privacy concerns. The main challenge that prevents previous state-of-the-art OoD detection methods from being incorporated to FL is that they require large amount of real OoD samples. However, in real-world scenarios, such large-scale OoD training data can be costly or even infeasible to obtain, especially for resource-limited local devices. On the other hand, a notorious challenge in FL is data heterogeneity where each client collects non-identically and independently distributed (non-iid) data. We propose to take advantage of such heterogeneity and turn the curse into a blessing that facilitates OoD detection in FL. The key is that for each client, non-iid data from other clients (unseen external classes) can serve as an alternative to real OoD samples. Specifically, we propose a novel Federated Out-of-Distribution Synthesizer (FOSTER), which learns a class-conditional generator to synthesize virtual external-class OoD samples, and maintains data confidentiality and communication efficiency required by FL. Experimental results show that our method outperforms the state-of-the-art by 2.49%, 2.88%, 1.42% AUROC, and 0.01%, 0.89%, 1.74% ID accuracy, on CIFAR-10, CIFAR-100, and STL10, respectively.","['Deep Learning and representational learning', 'out-of-distribution detection', 'Heterogeneity', 'federated learning']",[],"['Shuyang Yu', 'Junyuan Hong', 'Haotao Wang', 'Zhangyang Wang', 'Jiayu Zhou']","['Michigan State University', 'University of Texas at Austin', 'University of Texas, Austin', 'University of Texas at Austin', 'Michigan State University']",[]
https://iclr.cc/virtual/2023/poster/10724,Privacy & Data Governance,Asynchronous Distributed Bilevel Optimization,"Bilevel optimization plays an essential role in many machine learning tasks, ranging from hyperparameter optimization to meta-learning. Existing studies on bilevel optimization, however, focus on either centralized or synchronous distributed setting. The centralized bilevel optimization approaches require collecting massive amount of data to a single server, which inevitably incur significant communication expenses and may give rise to data privacy risks. Synchronous distributed bilevel optimization algorithms, on the other hand, often face the straggler problem and will immediately stop working if a few workers fail to respond. As a remedy, we propose Asynchronous Distributed Bilevel Optimization (ADBO) algorithm. The proposed ADBO can tackle bilevel optimization problems with both nonconvex upper-level and lower-level objective functions, and its convergence is theoretically guaranteed. Furthermore, it is revealed through theoretic analysis that the iteration complexity of ADBO to obtain the $\epsilon$-stationary point is upper bounded by $\mathcal{O}(\frac{1}{{{\epsilon ^2}}})$. Thorough empirical studies on public datasets have been conducted to elucidate the effectiveness and efficiency of the proposed ADBO.",['Optimization'],[],"['Yang Jiao', 'Tiancheng Wu', 'Dongjin Song', 'Chengtao Jian']","['Tongji University', 'Tongji University', 'University of Connecticut', 'Tongji University']",[]
https://iclr.cc/virtual/2023/poster/11725,Privacy & Data Governance,Progressive Voronoi Diagram Subdivision Enables Accurate Data-free Class-Incremental Learning,"Data-free Class-incremental Learning (CIL) is a challenging problem because rehearsing data from previous phases is strictly prohibited, causing catastrophic forgetting of Deep Neural Networks (DNNs). In this paper, we present \emph{iVoro}, a novel framework derived from computational geometry. We found Voronoi Diagram (VD), a classical model for space subdivision, is especially powerful for solving the CIL problem, because VD itself can be constructed favorably in an incremental manner -- the newly added sites (classes) will only affect the proximate classes, making the non-contiguous classes hardly forgettable. Furthermore, we bridge DNN and VD using Power Diagram Reduction, and show that the VD structure can be progressively refined along the phases using a divide-and-conquer algorithm. Moreover, our VD construction is not restricted to the deep feature space, but is also applicable to multiple intermediate feature spaces, promoting VD to be multilayer VD that efficiently captures multi-grained features from DNN. Importantly, \emph{iVoro} is also capable of handling uncertainty-aware test-time Voronoi cell assignment and has exhibited high correlations between geometric uncertainty and predictive accuracy (up to ${\sim}0.9$). Putting everything together, \emph{iVoro} achieves up to $25.26\%$, $37.09\%$, and $33.21\%$ improvements on CIFAR-100, TinyImageNet, and ImageNet-Subset, respectively, compared to the state-of-the-art non-exemplar CIL approaches. In conclusion, \emph{iVoro} enables highly accurate, privacy-preserving, and geometrically interpretable CIL that is particularly useful when cross-phase data sharing is forbidden, e.g. in medical applications.","['Deep Learning and representational learning', 'Voronoi Diagram', 'Computational Geometry']",[],"['Chunwei Ma', 'Zhanghexuan Ji', 'Ziyun Huang', 'Yan Shen', 'Mingchen Gao', 'Jinhui Xu']","['State University of New York, Buffalo', 'Johnson & Johnson MedTech LCI/WWDA', 'Pennsylvania State University, Erie', 'State University of New York, Buffalo', 'University at Buffalo, SUNY', 'State University of New York, Buffalo']",[]
https://iclr.cc/virtual/2023/poster/11920,Privacy & Data Governance,Private Federated Learning Without a Trusted Server: Optimal Algorithms for Convex Losses,"This paper studies federated learning (FL)—especially cross-silo FL—with data from people who do not trust the server or other silos. In this setting, each silo (e.g. hospital) has data from different people (e.g. patients) and must maintain the privacy of each person’s data (e.g. medical record), even if the server or other silos act as adversarial eavesdroppers. This requirement motivates the study of Inter-Silo Record-Level Differential Privacy (ISRL-DP), which requires silo $i$’s communications to satisfy record/item-level differential privacy (DP). ISRL-DP ensures that the data of each person (e.g. patient) in silo $i$ (e.g. hospital $i$) cannot be leaked. ISRL-DP is different from well-studied privacy notions. Central and user-level DP assume that people trust the server/other silos. On the other end of the spectrum, local DP assumes that people do not trust anyone at all (even their own silo). Sitting between central and local DP, ISRL-DP makes the realistic assumption (in cross-silo FL) that people trust their own silo, but not the server or other silos. In this work, we provide tight (up to logarithms) upper and lower bounds for ISRL-DP FL with convex/strongly convex loss functions and homogeneous (i.i.d.) silo data. Remarkably, we show that similar bounds are attainable for smooth losses with arbitrary heterogeneous silo data distributions, via an accelerated ISRL-DP algorithm. We also provide tight upper and lower bounds for ISRL-DP federated empirical risk minimization, and use acceleration to attain the optimal bounds in fewer rounds of communication than the state-of-the-art. Finally, with a secure “shuffler” to anonymize silo messages (but without a trusted server), our algorithm attains the optimal central DP rates under more practical trust assumptions. Numerical experiments show favorable privacy-accuracy tradeoffs for our algorithm in classification and regression tasks.","['Social Aspects of Machine Learning', 'private optimization', 'stochastic convex optimization', 'cross-silo federated learning', 'differential privacy', 'distributed optimization', 'federated learning']",[],"['Andrew Lowy', 'Meisam Razaviyayn']","['University of Southern California', 'University of Southern California']",[]
https://iclr.cc/virtual/2023/poster/11949,Privacy & Data Governance,Dataless Knowledge Fusion by Merging Weights of Language Models,"Fine-tuning pre-trained language models has become the prevalent paradigm for building downstream NLP models. Oftentimes fine-tuned models are readily available but their training data is not, due to data privacy or intellectual property concerns. This creates a barrier to fusing knowledge across individual models to yield a better single model. In this paper, we study the problem of merging individual models built on different training data sets to obtain a single model that performs well both across all data set domains and can generalize on out-of-domain data. We propose a data-less knowledge fusion method that merges models in their parameter space, guided by weights that minimize prediction differences between the merged model and the individual models. Over a battery of evaluation settings, we show that the proposed method significantly outperforms baselines such as Fisher-weighted averaging or model ensembling. Further, we find that our method is a promising alternative to multi-task learning that can preserve or sometimes improve over the individual models without access to the training data. Finally, model merging is more efficient than training a multi-task model, thus making it applicable to a wider set of scenarios.","['Applications', 'model merging', 'weight merging']",[],"['Xisen Jin', 'Xiang Ren', 'Daniel Preotiuc-Pietro', 'Pengxiang Cheng']","['University of Southern California', 'University of Southern California', 'Bloomberg', 'Bloomberg']",[]
https://iclr.cc/virtual/2023/poster/11384,Privacy & Data Governance,Distributed Differential Privacy in Multi-Armed Bandits,"We consider the standard $K$-armed bandit problem under a distributed trust model of differential privacy (DP), which enables to guarantee privacy without a trustworthy server.  Under this trust model, previous work largely focus on achieving privacy using a shuffle protocol, where a batch of users data are randomly permuted before sending to a central server. This protocol achieves ($\epsilon,\delta$) or approximate-DP guarantee by sacrificing an additive $O\!\left(\!\frac{K\log T\sqrt{\log(1/\delta)}}{\epsilon}\!\right)\!$ factor in $T$-step cumulative regret. In contrast, the optimal privacy cost to achieve a stronger ($\epsilon,0$) or pure-DP guarantee under the widely used central trust model is only $\Theta\!\left(\!\frac{K\log T}{\epsilon}\!\right)\!$, where, however, a trusted server is required. In this work, we aim to obtain a pure-DP guarantee under distributed trust model while sacrificing no more regret than that under central trust model. We achieve this by designing a generic bandit algorithm based on successive arm elimination, where privacy is guaranteed by corrupting rewards with an equivalent discrete Laplace noise ensured by a secure computation protocol. We also show that our algorithm, when instantiated with Skellam noise and the secure protocol, ensures \emph{R\'{e}nyi differential privacy} -- a stronger notion than approximate DP -- under distributed trust model with a privacy cost of $O\!\left(\!\frac{K\sqrt{\log T}}{\epsilon}\!\right)\!$. Finally, as a by-product of our techniques, we also recover the best-known regret bounds for bandits under central and local models while using only \emph{discrete privacy noise}, which can avoid the privacy leakage due to floating point arithmetic of continuous noise on finite computers.","['Reinforcement Learning', 'differential privacy', 'Multi-armed Bandits']",[],"['Sayak Ray Chowdhury', 'Xingyu Zhou']","['Microsoft', 'Wayne State University']",[]
https://iclr.cc/virtual/2023/poster/11870,Privacy & Data Governance,"FedSpeed: Larger Local Interval, Less Communication Round, and Higher Generalization Accuracy","Federated learning (FL) is an emerging distributed machine learning framework which jointly trains a global model via a large number of local devices with data privacy protections. Its performance suffers from the non-vanishing biases introduced by the local inconsistent optimal and the rugged client-drifts by the local over-fitting. In this paper, we propose a novel and practical method, FedSpeed, to alleviate the negative impacts posed by these problems.  Concretely, FedSpeed applies the prox-correction term on the current local updates to efficiently reduce the biases introduced by the prox-term, a necessary regularizer to maintain the strong local consistency. Furthermore, FedSpeed merges the vanilla stochastic gradient with a perturbation computed from an extra gradient ascent step in the neighborhood, thereby alleviating the issue of local over-fitting. Our theoretical analysis indicates that the convergence rate is related to both the communication rounds $T$ and local intervals $K$ with a tighter upper bound $\mathcal{O}(\frac{1}{T})$ if $K=\mathcal{O}(T)$.  Moreover, we conduct extensive experiments on the real-world dataset to demonstrate the efficiency of our proposed FedSpeed, which converges significantly faster and achieves the state-of-the-art (SOTA) performance on the general FL experimental settings than several baselines including FedAvg, FedProx, FedCM, FedAdam, SCAFFOLD, FedDyn, FedADMM, etc.","['Deep Learning and representational learning', 'federated learning']",[],"['Yan Sun', 'Li Shen', 'Tiansheng Huang', 'Liang Ding', 'Dacheng Tao']","['University of Sydney', 'JD Explore Academy', 'Georgia Institute of Technology', 'JD Explore Academy, JD.com Inc.', 'University of Sydney']",[]
