link,category,title,abstract,keywords,ccs_concepts,author_names,affiliations,author_countries
https://iclr.cc/virtual/2023/poster/11111,Security,MACTA: A Multi-agent Reinforcement Learning Approach for Cache Timing Attacks and Detection,"Security vulnerabilities in computer systems raise serious concerns as computers process an unprecedented amount of private and sensitive data today. Cache timing attacks (CTA) pose an important practical threat as they can effectively breach many protection mechanisms in today’s systems. However, the current detection techniques for cache timing attacks heavily rely on heuristics and expert knowledge, which can lead to brittleness and the inability to adapt to new attacks. To mitigate the CTA threat, we propose MACTA, a multi-agent reinforcement learning (MARL) approach that leverages population-based training to train both attackers and detectors. Following best practices, we develop a realistic simulated MARL environment, MA-AUTOCAT, which enables training and evaluation of cache-timing attackers and detectors. Our empirical results suggest that MACTA is an effective solution without any manual input from security experts. MACTA detectors can generalize to a heuristic attack not exposed in training with a 97.8% detection rate and reduce the attack bandwidth of adaptive attackers by 20% on average. In the meantime, MACTA attackers are qualitatively more effective than other attacks studied, and the average evasion rate of MACTA attackers against an unseen state-of-the-art detector can reach up to 99%. Furthermore, we found that agents equipped with a Transformer encoder can learn effective policies in situations when agents with multi-layer perceptron encoders do not in this environment, suggesting the potential of Transformer structures in CTA problems.","['Applications', 'multi-agent reinforcement learning', 'game theory', 'security']",[],"['Jiaxun Cui', 'Xiaomeng Yang', 'Mulong Luo', 'Geunbae Lee', 'Peter Stone', 'Hsien-Hsin S. Lee', 'Benjamin Lee', 'G. Edward Suh', 'Wenjie Xiong', 'Yuandong Tian']","['The University of Texas at Austin', 'Meta', 'Cornell University', 'Virginia Polytechnic Institute and State University', 'Sony AI', 'Intel', 'University of Pennsylvania, University of Pennsylvania', 'Meta AI', 'Virginia Polytechnic Institute and State University', 'Meta AI (FAIR)']",[]
https://iclr.cc/virtual/2023/poster/11720,Security,Spiking Convolutional Neural Networks for Text Classification,"Spiking neural networks (SNNs) offer a promising pathway to implement deep neural networks (DNNs) in a more energy-efficient manner since their neurons are sparsely activated and inferences are event-driven. However, there have been very few works that have demonstrated the efficacy of SNNs in language tasks partially because it is non-trivial to represent words in the forms of spikes and to deal with variable-length texts by SNNs. This work presents a ""conversion + fine-tuning'' two-step method for training SNN for text classification and proposes a simple but effective way to encode pre-trained word embeddings as spike trains. We show empirically that after further fine-tuning with surrogate gradients, the converted SNNs achieve comparable results to their DNN counterparts across multiple datasets for Both English and Chinese. We also demonstrate that such SNNs are more robust against adversarial attacks than DNNs.","['General Machine Learning', 'spiking neural networks', 'Training Method', 'text classification']",[],"['Changze Lv', 'Jianhan Xu']","['Fudan University', 'Fudan University']",[]
https://iclr.cc/virtual/2023/poster/11087,Security,Aligning Model and Macaque Inferior Temporal Cortex Representations Improves Model-to-Human Behavioral Alignment and Adversarial Robustness,"While some state-of-the-art artificial neural network systems in computer vision are strikingly accurate models of the corresponding primate visual processing, there are still many discrepancies between these models and the behavior of primates on object recognition tasks. Many current models suffer from extreme sensitivity to adversarial attacks and often do not align well with the image-by-image behavioral error patterns observed in humans. Previous research has provided strong evidence that primate object recognition behavior can be very accurately predicted by neural population activity in the inferior temporal (IT) cortex, a brain area in the late stages of the visual processing hierarchy. Therefore, here we directly test whether making the late stage representations of models more similar to that of macaque IT produces new models that exhibit more robust, primate-like behavior. We conducted chronic, large-scale multi-electrode recordings  across the IT cortex in six non-human primates (rhesus macaques). We then use these data to fine-tune (end-to-end) the model ""IT"" representations such that they are more aligned with the biological IT representations, while preserving accuracy on object recognition tasks. We generate a cohort of models with a range of IT similarity scores validated on held-out animals across two image sets with distinct statistics. Across a battery of optimization conditions, we observed a strong correlation between the models' IT-likeness and alignment with human behavior, as well as an increase in its adversarial robustness. We further assessed the limitations of this approach and find that the improvements in behavioral alignment and adversarial robustness generalize across different image statistics, but not to object categories outside of those covered in our IT training set. Taken together, our results demonstrate that building models that are more aligned with the primate brain leads to more robust and human-like behavior, and call for larger neural data-sets to further augment these gains.","['Deep Learning and representational learning', 'computer vision', 'Primate Vision', 'Inferior Temporal Cortex', 'Behavioral Alignment', 'adversarial robustness']",[],"['Joel Dapello', 'Kohitij Kar', 'Martin Schrimpf', 'Robert Baldwin Geary', 'Michael Ferguson', 'David Daniel Cox', 'James J. DiCarlo']","['Altos Labs', 'Massachusetts Institute of Technology', 'EPFL - EPF Lausanne', 'Harvard University', 'Massachusetts Institute of Technology', 'International Business Machines', 'Massachusetts Institute of Technology']",[]
https://iclr.cc/virtual/2023/poster/11370,Security,ROCO: A General Framework for Evaluating Robustness of Combinatorial Optimization Solvers on Graphs,"Solving combinatorial optimization (CO) on graphs has been attracting increasing interests from the machine learning community whereby data-driven approaches were recently devised to go beyond traditional manually-designated algorithms. In this paper, we study the robustness of a combinatorial solver as a blackbox regardless it is classic or learning-based though the latter can often be more interesting to the ML community. Specifically, we develop a practically feasible robustness metric for general CO solvers. A no-worse optimal cost guarantee is developed as such the optimal solutions are not required to achieve for solvers, and we tackle the non-differentiable challenge in input instance disturbance by resorting to black-box adversarial attack methods. Extensive experiments are conducted on 14 unique combinations of solvers and CO problems, and we demonstrate that the performance of state-of-the-art solvers like Gurobi can degenerate by over 20% under the given time limit bound on the hard instances discovered by our robustness metric, raising concerns about the robustness of combinatorial optimization solvers.","['Optimization', 'reinforcement learning', 'robustness', 'graph neural networks', 'combinatorial optimization']",[],"['Han Lu', 'Zenan Li', 'Runzhong Wang', 'Qibing Ren', 'Xijun Li', 'Mingxuan Yuan', 'Jia Zeng', 'Xiaokang Yang', 'Junchi Yan']","['Shanghai Jiao Tong University', 'Shanghai Jiao Tong University', 'Massachusetts Institute of Technology', 'Shanghai Jiaotong University', 'Huawei Technologies Ltd.', 'Huawei Technologies Ltd.', ""Huawei Noah's Ark Lab"", 'Shanghai Jiao Tong University, China', 'Shanghai Jiao Tong University']",[]
https://iclr.cc/virtual/2023/poster/11767,Security,Certified Defences Against Adversarial Patch Attacks on Semantic Segmentation,"Adversarial patch attacks are an emerging security threat for real world deep learning applications. We present Demasked Smoothing, the first approach (up to our knowledge) to certify the robustness of semantic segmentation models against this threat model. Previous work on certifiably defending against patch attacks has mostly focused on image classification task and often required changes in the model architecture and additional training which is undesirable and computationally expensive. In Demasked Smoothing, any segmentation model can be applied without particular training, fine-tuning, or restriction of the architecture. Using different masking strategies, Demasked Smoothing can be applied both for certified detection and certified recovery. In extensive experiments we show that Demasked Smoothing can on average certify 63% of the pixel predictions for a 1% patch in the detection task and 46% against a 0.5% patch for the recovery task on the ADE20K dataset.","['Social Aspects of Machine Learning', 'adversarial patch attacks', 'certified defences', 'adversarial robustness']",[],"['Maksym Yatsura', 'Kaspar Sakmann', 'N. Grace Hua', 'Matthias Hein', 'Jan Hendrik Metzen']","['Robert Bosch GmbH, Bosch', 'Robert Bosch GmbH, Bosch', 'Robert Bosch GmbH, Bosch', 'University of Tübingen', 'Bosch Center Artificial Intelligence']",[]
https://iclr.cc/virtual/2023/poster/11886,Security,Revisiting Graph Adversarial Attack and Defense From a Data Distribution Perspective,"Recent studies have shown that structural perturbations are significantly effective in degrading the accuracy of Graph Neural Networks (GNNs) in the semi-supervised node classification (SSNC) task. However, why the gradient-based methods are so destructive is rarely explored. In this work, we discover an interesting phenomenon: the adversarial edges are not uniformly distributed on the graph. Nearly all perturbations are generated around the training nodes in poisoning attack. Combined with this phenomenon, we provide an explanation for the effectiveness of the gradient-based attack method from a data distribution perspective and revisit both poisoning attack and evasion attack in SSNC. From this new perspective, we empirically and theoretically discuss some other attack tendencies. Based on the analysis, we provide nine practical tips on both attack and defense and meanwhile leverage them to improve existing attack and defense methods. Moreover, we design a fast attack method and a self-training defense method, which outperform the state-of-the-art methods and can effectively scale to large graphs like ogbn-arxiv. We conduct extensive experiments on four benchmark datasets to verify our claims.","['Social Aspects of Machine Learning', 'Data Distribution', 'robustness', 'Graph Adversarial Attack']",[],"['Kuan Li', 'Yang Liu', 'Xiang Ao', 'Qing He']","['Hong Kong University of Science and Technology', 'Institute of Computing Technology, Chinese Academy of Sciences', 'Institute of Computing Technology, Chinese Academy of Sciences', 'Institute of Computing Technology, CAS']",[]
https://iclr.cc/virtual/2023/poster/11836,Security,SYNC: SAFETY-AWARE NEURAL CONTROL FOR STABILIZING STOCHASTIC DELAY-DIFFERENTIAL EQUATIONS,"Stabilization of the systems described by \textit{stochastic delay}-differential equations (SDDEs) under preset conditions is a challenging task in the control community. Here, to achieve this task, we leverage neural networks to learn control policies using the information of the controlled systems in some prescribed regions.  Specifically, two learned control policies, i.e., the neural deterministic controller (NDC) and the neural stochastic controller (NSC), work effectively in the learning procedures that rely on, respectively, the well-known LaSalle-type theorem and the newly-established theorem for guaranteeing the stochastic stability in SDDEs. We theoretically investigate the performance of the proposed controllers in terms of convergence time and energy cost.  More practically and significantly, we improve our learned control policies through considering the situation where the controlled trajectories only evolve in some specific safety set. {\color{black}  The practical validity of such control policies restricted in safety set is attributed to the theory that we further develop for safety and stability guarantees in SDDEs using the stochastic control barrier function and the spatial discretization}. We call this control as SYNC (\textbf{S}afet\textbf{Y}-aware \textbf{N}eural \textbf{C}ontrol).   The efficacy of all the articulated control policies, including the SYNC, is demonstrated systematically by using representative control problems.","['Theory', 'Stochastic delay-differential equations', 'safety guarantee', 'stochastic stabilization', 'neural networks']",[],"['Jingdong Zhang', 'Qunxi Zhu', 'Wei Yang', 'Wei Lin']","['Fudan University', 'Fudan University', 'Fudan University', 'Fudan University']",[]
https://iclr.cc/virtual/2023/poster/11957,Security,Robust Fair Clustering: A Novel Fairness Attack and Defense Framework,"Clustering algorithms are widely used in many societal resource allocation applications, such as loan approvals and candidate recruitment, among others, and hence, biased or unfair model outputs can adversely impact individuals that rely on these applications. To this end, many $\textit{fair}$ clustering approaches have been recently proposed to counteract this issue. Due to the potential for significant harm, it is essential to ensure that fair clustering algorithms provide consistently fair outputs even under adversarial influence. However, fair clustering algorithms have not been studied from an adversarial attack perspective. In contrast to previous research, we seek to bridge this gap and conduct a robustness analysis against fair clustering by proposing a novel $\textit{black-box fairness attack}$. Through comprehensive experiments, we find that state-of-the-art models are highly susceptible to our attack as it can reduce their fairness performance significantly. Finally, we propose Consensus Fair Clustering (CFC), the first $\textit{robust fair clustering}$ approach that transforms consensus clustering into a fair graph partitioning problem, and iteratively learns to generate fair cluster outputs. Experimentally, we observe that CFC is highly robust to the proposed attack and is thus a truly robust fair clustering alternative.","['Unsupervised and Self-supervised learning', 'consensus clustering', 'Fairness Attack', 'Data Clustering', 'Fairness Defense']",[],"['Anshuman Chhabra', 'Peizhao Li', 'Prasant Mohapatra', 'Hongfu Liu']","['University of California, Davis', 'Brandeis University', 'University of South Florida', 'Brandeis University']",[]
https://iclr.cc/virtual/2023/poster/11925,Security,On the Robustness of Safe Reinforcement Learning under Observational Perturbations,"Safe reinforcement learning (RL) trains a policy to maximize the task reward while satisfying safety constraints. While prior works focus on the performance optimality, we find that the optimal solutions of many safe RL problems are not robust and safe against carefully designed observational perturbations. We formally analyze the unique properties of designing effective observational adversarial attackers in the safe RL setting.  We show that baseline adversarial attack techniques for standard RL tasks are not always effective for safe RL and propose two new approaches - one maximizes the cost and the other maximizes the reward.  One interesting and counter-intuitive finding is that the maximum reward attack is strong, as it can both induce unsafe behaviors and make the attack stealthy by maintaining the reward. We further propose a robust training framework for safe RL and evaluate it via comprehensive experiments. This paper provides a pioneer work to investigate the safety and robustness of RL under observational attacks for future safe RL studies. Code is available at: \url{https://github.com/liuzuxin/safe-rl-robustness}","['Reinforcement Learning', 'deep reinforcement learning', 'state robust reinforcement learning', 'safe reinforcement learning']",[],"['Zuxin Liu', 'Zijian Guo', 'Zhepeng Cen', 'Huan Zhang', 'Jie Tan', 'Bo Li', 'Ding Zhao']","['Carnegie Mellon University', 'Boston University, Boston University', 'CMU, Carnegie Mellon University', 'University of Illinois at Urbana-Champaign', 'Google', 'University of Illinois, Urbana Champaign', 'Carnegie Mellon University']",[]
https://iclr.cc/virtual/2023/poster/11520,Security,A Unified Algebraic Perspective on Lipschitz Neural Networks,"Important research efforts have focused on the design and training of neural networks with a controlled Lipschitz constant. The goal is to increase and sometimes guarantee the robustness against adversarial attacks. Recent promising techniques draw inspirations from different backgrounds to design 1-Lipschitz neural networks, just to name a few: convex potential layers derive from the discretization of continuous dynamical systems, Almost-Orthogonal-Layer proposes a tailored method for matrix rescaling. However, it is today important to consider the recent and promising contributions in the field under a common theoretical lens to better design new and improved layers. This paper introduces a novel algebraic perspective unifying various types of 1-Lipschitz neural networks, including the ones previously mentioned, along with methods based on orthogonality and spectral methods. Interestingly, we show that many existing techniques can be derived and generalized via finding analytical solutions of a common semidefinite programming (SDP) condition.  We also prove that AOL biases the scaled weight to the ones which are close to the set of orthogonal matrices in a certain mathematical manner. Moreover, our algebraic condition, combined with the Gershgorin circle theorem, readily leads to new and diverse parameterizations for 1-Lipschitz network layers. Our approach, called SDP-based Lipschitz Layers (SLL), allows us to design non-trivial yet efficient generalization of convex potential layers.  Finally, the comprehensive set of experiments on image classification shows that SLLs outperform previous approaches on certified robust accuracy. Code is available at https://github.com/araujoalexandre/Lipschitz-SLL-Networks.","['Deep Learning and representational learning', 'Lipschitz neural networks', 'deep learning', 'robustness']",[],"['Alexandre Araujo', 'Aaron J Havens', 'Blaise Delattre', 'Alexandre Allauzen', 'Bin Hu']","['New York University', 'University of Illinois, Urbana Champaign', ', Université Paris-Dauphine (Paris IX)', 'Ecole supérieure de physique et chimie', 'University of Illinois, Urbana Champaign']",[]
https://iclr.cc/virtual/2023/poster/10789,Security,TextShield: Beyond Successfully Detecting Adversarial Sentences in text classification,"Adversarial attack serves as a major challenge for neural network models in NLP, which precludes the model's deployment in safety-critical applications. A recent line of work, detection-based defense, aims to distinguish adversarial sentences from benign ones. However, {the core limitation of previous detection methods is being incapable of giving correct predictions on adversarial sentences unlike defense methods from other paradigms.} To solve this issue, this paper proposes TextShield: (1) we discover a link between text attack and saliency information, and then we propose a saliency-based detector, which can effectively detect whether an input sentence is adversarial or not. (2) We design a saliency-based corrector, which converts the detected adversary sentences to benign ones. By combining the saliency-based detector and corrector, TextShield extends the detection-only paradigm to a detection-correction paradigm, thus filling the gap in the existing detection-based defense. Comprehensive experiments show that (a) TextShield consistently achieves higher or comparable performance than state-of-the-art defense methods across various attacks on different benchmarks. (b) our saliency-based detector outperforms existing detectors for detecting adversarial sentences.","['Applications', 'adversarial defense', 'adversarial attack', 'natural language processing', 'text classification']",[],"['Lingfeng Shen', 'Ze Zhang', 'Haiyun Jiang', 'Ying Chen']","['Johns Hopkins University', 'Fudan University', 'Tencent AI Lab', 'China Agricultural University']",[]
https://iclr.cc/virtual/2023/poster/11971,Security,Combating Exacerbated Heterogeneity for Robust Models in Federated Learning,"Privacy and security concerns in real-world applications have led to the development of adversarially robust federated models. However, the straightforward combination between adversarial training and federated learning in one framework can lead to the undesired robustness deterioration. We discover that the attribution behind this phenomenon is that the generated adversarial data could exacerbate the data heterogeneity among local clients, making the wrapped federated learning perform poorly. To deal with this problem, we propose a novel framework called Slack Federated Adversarial Training (SFAT), assigning the client-wise slack during aggregation to combat the intensified heterogeneity. Theoretically, we analyze the convergence of the proposed method to properly relax the objective when combining federated learning and adversarial training. Experimentally, we verify the rationality and effectiveness of SFAT on various benchmarked and real-world datasets with different adversarial training and federated optimization methods. The code is publicly available at: https://github.com/ZFancy/SFAT.",['Deep Learning and representational learning'],[],"['Jianing Zhu', 'Jiangchao Yao', 'Tongliang Liu', 'Quanming Yao', 'Jianliang Xu', 'Bo Han']","['Hong Kong Baptist University', 'Shanghai Jiaotong University', 'University of Sydney', 'Department of Electronic Engineering, Tsinghua University', 'Hong Kong Baptist University', 'HKBU']",[]
https://iclr.cc/virtual/2023/poster/11621,Security,Language Modelling with Pixels,"Language models are defined over a finite set of inputs, which creates a vocabulary bottleneck when we attempt to scale the number of supported languages. Tackling this bottleneck results in a trade-off between what can be represented in the embedding matrix and computational issues in the output layer. This paper introduces PIXEL, the Pixel-based Encoder of Language, which suffers from neither of these issues. PIXEL is a pretrained language model that renders text as images, making it possible to transfer representations across languages based on orthographic similarity or the co-activation of pixels. PIXEL is trained to reconstruct the pixels of masked patches instead of predicting a distribution over tokens. We pretrain the 86M parameter PIXEL model on the same English data as BERT and evaluate on syntactic and semantic tasks in typologically diverse languages, including various non-Latin scripts. We find that PIXEL substantially outperforms BERT on syntactic and semantic processing tasks on scripts that are not found in the pretraining data, but PIXEL is slightly weaker than BERT when working with Latin scripts. Furthermore, we find that PIXEL is more robust than BERT to orthographic attacks and linguistic code-switching, further confirming the benefits of modelling language with pixels.","['Applications', 'masked autoencoder', 'representation learning', 'transformers', 'nlp', 'language model']",[],"['Phillip Rust', 'Jonas F. Lotz', 'Emanuele Bugliarello', 'Elizabeth Salesky', 'Miryam de Lhoneux', 'Desmond Elliott']","['University of Copenhagen', 'University of Copenhagen', 'Google', 'Johns Hopkins University', 'KU Leuven', '']",[]
