link,category,title,abstract,keywords,ccs_concepts,author_names,affiliations,author_countries
https://iclr.cc/virtual/2023/poster/11197,Transparency & Explainability,Understanding Neural Coding on Latent Manifolds by Sharing Features and Dividing Ensembles,"Systems neuroscience relies on two complementary views of neural data, characterized by single neuron tuning curves and analysis of population activity. These two perspectives combine elegantly in neural latent variable models that constrain the relationship between latent variables and neural activity, modeled by simple tuning curve functions. This has recently been demonstrated using Gaussian processes, with applications to realistic and topologically relevant latent manifolds. Those and previous models, however, missed crucial shared coding properties of neural populations. We propose $\textit{feature sharing}$ across neural tuning curves which significantly improves performance and helps optimization. We also propose a solution to the $\textit{ensemble detection}$ problem, where different groups of neurons, i.e., ensembles, can be modulated by different latent manifolds. Achieved through a soft clustering of neurons during training, this allows for the separation of mixed neural populations in an unsupervised manner. These innovations lead to more interpretable models of neural population activity that train well and perform better even on mixtures of complex latent manifolds. Finally, we apply our method on a recently published grid cell dataset, and recover distinct ensembles, infer toroidal latents and predict neural tuning curves in a single integrated modeling framework.","['Neuroscience and Cognitive Science', 'Latent Variable Models', 'grid cells', 'neural activity', 'neural ensemble detection', 'neuroscience', 'tuning curves']",[],"['Martin Bjerke', 'Kristopher T Jensen', 'Claudia Battistin', 'Benjamin Adric Dunn']","['Norwegian University of Science and Technology', 'University College London, University of London', 'Norwegian Institute of Technology', 'Norwegian Institute of Technology']",[]
https://iclr.cc/virtual/2023/poster/11085,Transparency & Explainability,A probabilistic framework for task-aligned intra- and inter-area neural manifold estimation,"Latent manifolds provide a compact characterization of neural population activity and of shared co-variability across brain areas. Nonetheless, existing statistical tools for extracting neural manifolds face limitations in terms of interpretability of latents with respect to task variables, and can be hard to apply to datasets with no trial repeats. Here we propose a novel probabilistic framework that allows for interpretable partitioning of population variability within and across areas in the context of naturalistic behavior. Our approach for task aligned manifold estimation (TAME-GP) explicitly partitions variability into private and shared sources which can themselves be subdivided in task-relevant and task irrelevant components, uses a realistic Poisson noise model, and introduces temporal smoothing of latent trajectories in the form of a Gaussian Process prior. This TAME-GP graphical model allows for robust estimation of task-relevant variability in local population responses, and of shared co-variability between brain areas. We demonstrate the efficiency of our estimator on within model and biologically motivated simulated data. We also apply it to several datasets of neural population recordings during behavior. Overall, our results demonstrate the capacity of TAME-GP to capture meaningful intra- and inter-area neural variability with single trial resolution.","['Neuroscience and Cognitive Science', 'dimensionality reduction', 'inter-area interactions', 'neuroscience', 'Probabilistic Methods']",[],"['Edoardo Balzani', 'Jean-Paul G Noel', 'Pedro Herrero-Vidal', 'Dora Angelaki', 'Cristina Savin']","['New York University', 'New York University', 'New York University', 'New York University', 'New York University']",[]
https://iclr.cc/virtual/2023/poster/11054,Transparency & Explainability,Bayes-MIL: A New Probabilistic Perspective on Attention-based Multiple Instance Learning for Whole Slide Images,"Multiple instance learning (MIL) is a popular weakly-supervised learning model on the whole slide image (WSI) for AI-assisted pathology diagnosis. The recent advance in attention-based MIL allows the model to find its region-of-interest (ROI) for interpretation by learning the attention weights for image patches of WSI slides. However, we empirically find that the interpretability of some related methods is either untrustworthy as the principle of MIL is violated or unsatisfactory as the high-attention regions are not consistent with experts' annotations. In this paper, we propose Bayes-MIL to address the problem from a probabilistic perspective. The induced patch-level uncertainty is proposed as a new measure of MIL interpretability, which outperforms previous methods in matching doctors annotations. We design a slide-dependent patch regularizer (SDPR) for the attention, imposing constraints derived from the MIL assumption, on the attention distribution. SDPR explicitly constrains the model to generate correct attention values. The spatial information is further encoded by an approximate convolutional conditional random field (CRF), for better interpretability. Experimental results show Bayes-MIL outperforms the related methods in patch-level and slide-level metrics and provides much better interpretable ROI on several large-scale WSI datasets.","['Applications', 'Multiple instance learning', 'histopathology', 'medical imaging', 'bayesian neural network']",[],"['Yufei CUI', 'Ziquan Liu', 'Xiangyu Liu', 'Xue Liu', 'Tei-Wei Kuo', 'Chun Jason Xue', 'Antoni B. Chan']","[', McGill University', 'Queen Mary, University of London', 'SUN YAT-SEN UNIVERSITY', 'McGill University', 'National Taiwan University', 'Mohamed bin Zayed University of Artificial Intelligence', 'City University of Hong Kong']",[]
https://iclr.cc/virtual/2023/poster/10994,Transparency & Explainability,Causal Reasoning in the Presence of Latent Confounders via Neural ADMG Learning,"Latent confounding has been a long-standing obstacle for causal reasoning from observational data. One popular approach is to model the data using acyclic directed mixed graphs (ADMGs), which describe ancestral relations between variables using directed and bidirected edges. However, existing methods using ADMGs are based on either linear functional assumptions or a discrete search that is complicated to use and lacks computational tractability for large datasets. In this work, we further extend the existing body of work and develop a novel gradient-based approach to learning an ADMG with nonlinear functional relations from observational data. We first show that the presence of latent confounding is identifiable under the assumptions of bow-free ADMGs with nonlinear additive noise models. With this insight, we propose a novel neural causal model based on autoregressive flows. This not only enables us to model complex causal relationships behind the data, but also estimate their functional relationships (hence treatment effects) simultaneously. We further validate our approach via experiments on both synthetic and real-world datasets, and demonstrate the competitive performance against relevant baselines.","['Probabilistic Methods', 'causal inference', 'causality', 'variational inference', 'structural equation model', 'causal discovery', 'latent confounders']",[],"['Matthew Ashman', 'Chao Ma', 'Agrin Hilmkil', 'Joel Jennings', 'Cheng Zhang']","['University of Cambridge', 'Microsoft', 'Chalmers University', 'Google Deepmind', 'Microsoft']",[]
https://iclr.cc/virtual/2023/poster/10915,Transparency & Explainability,Interpretable Geometric Deep Learning via Learnable Randomness Injection,"Point cloud data is ubiquitous in scientific fields. Recently, geometric deep learning (GDL) has been widely applied to solve prediction tasks with such data. However, GDL models are often complicated and hardly interpretable, which poses concerns to scientists who are to deploy these models in scientific analysis and experiments. This work proposes a general mechanism, learnable randomness injection (LRI), which allows building inherently interpretable models based on general GDL backbones. LRI-induced models, once trained, can detect the points in the point cloud data that carry information indicative of the prediction label. We also propose four datasets from real scientific applications that cover the domains of high-energy physics and biochemistry to evaluate the LRI mechanism. Compared with previous post-hoc interpretation methods, the points detected by LRI align much better and stabler with the ground-truth patterns that have actual scientific meanings. LRI is grounded by the information bottleneck principle, and thus LRI-induced models are also more robust to distribution shifts between training and test scenarios. Our code and datasets are available at https://github.com/Graph-COM/LRI.","['Machine Learning for Sciences', 'geometric deep learning', 'Interpretation', 'graph neural networks']",[],"['Siqi Miao', 'Yunan Luo', 'Mia Liu', 'Pan Li']","['Georgia Institute of Technology', 'Georgia Institute of Technology', 'Purdue University', 'Georgia Institute of Technology']",[]
https://iclr.cc/virtual/2023/poster/12144,Transparency & Explainability,What shapes the loss landscape of self supervised learning?,"Prevention of complete and dimensional collapse of representations has recently become a design principle for self-supervised learning (SSL). However, questions remain in our theoretical understanding: When do those collapses occur? What are the mechanisms and causes? We answer these questions by deriving and thoroughly analyzing an analytically tractable theory of SSL loss landscapes. In this theory, we identify the causes of the dimensional collapse and study the effect of normalization and bias. Finally, we leverage the interpretability afforded by the analytical theory to understand how dimensional collapse can be beneficial and what affects the robustness of SSL against data imbalance.","['Deep Learning and representational learning', 'collapse', 'self-supervised learning', 'loss landscape']",[],"['Liu Ziyin', 'Ekdeep Singh Lubana', 'Masahito Ueda', 'Hidenori Tanaka']","['The University of Tokyo', 'Center for Brain Science, Harvard University', 'The University of Tokyo', 'Harvard University, Harvard University']",[]
https://iclr.cc/virtual/2023/poster/11804,Transparency & Explainability,Causality Compensated Attention for Contextual Biased Visual Recognition,"Visual attention does not always capture the essential object representation desired for robust predictions. Attention modules tend to underline not only the target object but also the common co-occurring context that the module thinks helpful in the training. The problem is rooted in the confounding effect of the context leading to incorrect causalities between objects and predictions, which is further exacerbated by visual attention. In this paper, to learn causal object features robust for contextual bias, we propose a novel attention module named Interventional Dual Attention (IDA) for visual recognition. Specifically, IDA adopts two attention layers with multiple sampling intervention, which compensates the attention against the confounder context. Note that our method is model-agnostic and thus can be implemented on various backbones. Extensive experiments show our model obtains significant improvements in classification and detection with lower computation. In particular, we achieve the state-of-the-art results in multi-label classification on MS-COCO and PASCAL-VOC.","['Deep Learning and representational learning', 'object recognition', 'causal inference', 'Interventional Dual Attention', 'Confounding Context', 'attention mechanism']",[],"['Ruyang Liu', 'Jingjia Huang', 'Thomas H. Li', 'Ge Li']","['Peking University', 'ByteDance Inc.', 'AIIT, Peking University', 'Peking University Shenzhen Graduate School']",[]
https://iclr.cc/virtual/2023/poster/11158,Transparency & Explainability,A View From Somewhere: Human-Centric Face Representations,"Few datasets contain self-identified demographic information, inferring demographic information risks introducing additional biases, and collecting and storing data on sensitive attributes can carry legal risks. Besides, categorical demographic labels do not necessarily capture all the relevant dimensions of human diversity. We propose to implicitly learn a set of continuous face-varying dimensions, without ever asking an annotator to explicitly categorize a person. We uncover the dimensions by learning on A View From Somewhere (AVFS) dataset of 638,180 human judgments of face similarity. We demonstrate the utility of our learned embedding space for predicting face similarity judgments, collecting continuous face attribute values, attribute classification, and comparative dataset diversity auditing. Moreover, using a novel conditional framework, we show that an annotator's demographics influences the \emph{importance} they place on different attributes when judging similarity, underscoring the \emph{need} for diverse annotator groups to avoid biases. Data and code are available at \url{https://github.com/SonyAI/aviewfrom_somewhere}.","['Social Aspects of Machine Learning', 'annotator bias', 'computer vision', 'faces', 'diversity', 'similarity', 'cognitive', 'mental representations']",[],"['Jerone Andrews', 'Przemyslaw Joniak']","['Sony AI', 'The University of Tokyo']",[]
https://iclr.cc/virtual/2023/poster/11400,Transparency & Explainability,Weakly Supervised Explainable Phrasal Reasoning with Neural Fuzzy Logic,"Natural language inference (NLI) aims to determine the logical relationship between two sentences, such as Entailment, Contradiction, and Neutral. In recent years, deep learning models have become a prevailing approach to NLI, but they lack interpretability and explainability. In this work, we address the explainability of NLI by weakly supervised logical reasoning, and propose an Explainable Phrasal Reasoning (EPR) approach. Our model first detects phrases as the semantic unit and aligns corresponding phrases in the two sentences. Then, the model predicts the NLI label for the aligned phrases, and induces the sentence label by fuzzy logic formulas. Our EPR is almost everywhere differentiable and thus the system can be trained end to end. In this way, we are able to provide explicit explanations of phrasal logical relationships in a weakly supervised manner. We further show that such reasoning results help textual explanation generation.","['Applications', 'natural language inference', 'Explainability and Interpretability', 'Neural Fuzzy Logic', 'Weakly Supervised Reasoning']",[],"['Zijun Wu', 'Zi Xuan Zhang', 'Atharva Naik', 'Zhijian Mei', 'Mauajama Firdaus', 'Lili Mou']","['University of Alberta', 'University of Alberta', 'CMU, Carnegie Mellon University', 'University of Alberta', 'University of Alberta', 'University of Alberta']",[]
https://iclr.cc/virtual/2023/poster/10889,Transparency & Explainability,Binding Language Models in Symbolic Languages,"Though end-to-end neural approaches have recently been dominating NLP tasks in both performance and ease-of-use, they lack interpretability and robustness. We propose Binder, a training-free neural-symbolic framework that maps the task input to a program, which (1) allows binding a unified API of language model (LM) functionalities to a programming language (e.g., SQL, Python) to extend its grammar coverage and thus tackle more diverse questions, (2) adopts an LM as both the program parser and the underlying model called by the API during execution, and (3) requires only a few in-context exemplar annotations. Specifically, we employ GPT-3 Codex as the LM. In the parsing stage, with only a few in-context exemplars, Codex is able to identify the part of the task input that cannot be answerable by the original programming language, correctly generate API calls to prompt Codex to solve the unanswerable part, and identify where to place the API calls while being compatible with the original grammar. In the execution stage, Codex can perform versatile functionalities (e.g., commonsense QA, information extraction) given proper prompts in the API calls. Binder achieves state-of-the-art results on WikiTableQuestions and TabFact datasets, with explicit output programs that benefit human debugging. Note that previous best systems are all finetuned on tens of thousands of task-specific samples, while Binder only uses dozens of annotations as in-context exemplars without any training. Our code is available at anonymized.","['Applications', 'large language model', 'code generation', 'neural symbolic', 'semantic parsing']",[],"['Zhoujun Cheng', 'Tianbao Xie', 'Peng Shi', 'Chengzu Li', 'Rahul Nadkarni', 'Yushi Hu', 'Caiming Xiong', 'Dragomir Radev', 'Mari Ostendorf', 'Luke Zettlemoyer', 'Noah A. Smith', 'Tao Yu']","['Shanghai Jiaotong University', 'the University of Hong Kong, University of Hong Kong', 'University of Waterloo', 'University of Cambridge', 'Department of Computer Science & Engineering, University of Washington', 'University of Washington', 'Salesforce Research', 'Yale University', 'University of Washington', 'University of Washington', 'University of Washington', 'The University of Hong Kong']",[]
https://iclr.cc/virtual/2023/poster/10814,Transparency & Explainability,GEASS: Neural causal feature selection for high-dimensional biological data,"Identifying nonlinear causal relationships in high-dimensional biological data is an important task. However, current neural network based causality detection approaches for such data suffer from poor interpretability and cannot scale well to the high dimensional regime. Here we present GEASS (Granger fEAture Selection of Spatiotemporal data), which identifies sparse Granger causality mechanisms of high dimensional spatiotemporal data by a single neural network. GEASS maximizes sparsity-regularized modified transfer entropy with a theoretical guarantee of recovering features with spatial/temporal Granger causal relationships. The sparsity regularization is achieved by a novel combinatorial stochastic gate layer to select sparse non-overlapping feature subsets. We demonstrate the efficacy of GEASS in several synthetic datasets and real biological data from single-cell RNA sequencing and spatial transcriptomics.","['Machine Learning for Sciences', 'feature selection', 'Granger causality', 'neural networks', 'spatial transcriptomics', 'single-cell genomics']",[],"['Mingze Dong', 'Yuval Kluger']","['Yale University', 'Yale University']",[]
https://iclr.cc/virtual/2023/poster/12201,Transparency & Explainability,ChiroDiff: Modelling chirographic data with Diffusion Models,"Generative modelling over continuous-time geometric constructs, a.k.a $chirographic\ data$ such as handwriting, sketches, drawings etc., have been accomplished through autoregressive distributions. Such strictly-ordered discrete factorization however falls short of capturing key properties of chirographic data -- it fails to build holistic understanding of the temporal concept due to one-way visibility (causality). Consequently, temporal data has been modelled as discrete token sequences of fixed sampling rate instead of capturing the true underlying concept. In this paper, we introduce a powerful model-class namely Denoising\ Diffusion\ Probabilistic\ Models or DDPMs for chirographic data that specifically addresses these flaws. Our model named ""ChiroDiff"", being non-autoregressive, learns to capture holistic concepts and therefore remains resilient to higher temporal sampling rate up to a good extent. Moreover, we show that many important downstream utilities (e.g. conditional sampling, creative mixing) can be flexibly implemented using ChiroDiff. We further show some unique use-cases like stochastic vectorization, de-noising/healing, abstraction are also possible with this model-class. We perform quantitative and qualitative evaluation of our framework on relevant datasets and found it to be better or on par with competing approaches.","['Generative models', 'generative model', 'chirographic data', 'diffusion model', 'Continuous-time']",[],"['Ayan Das', 'Yongxin Yang', 'Timothy Hospedales', 'Tao Xiang', 'Yi-Zhe Song']","['University of Surrey', 'Queen Mary University of London', 'University of Edinburgh', 'University of Surrey', 'University of Surrey']",[]
https://iclr.cc/virtual/2023/poster/12143,Transparency & Explainability,Interpretability with full complexity by constraining feature information,"Interpretability is a pressing issue for machine learning. Common approaches to interpretable machine learning constrain interactions between features of the input, sacrificing model complexity in order to render more comprehensible the effects of those features on the model's output. We approach interpretability from a new angle: constrain the information about the features without restricting the complexity of the model. We use the Distributed Information Bottleneck to optimally compress each feature so as to maximally preserve information about the output. The learned information allocation, by feature and by feature value, provides rich opportunities for interpretation, particularly in problems with many features and complex feature interactions. The central object of analysis is not a single trained model, but rather a spectrum of models serving as approximations that leverage variable amounts of information about the inputs. Information is allocated to features by their relevance to the output, thereby solving the problem of feature selection by constructing a learned continuum of feature inclusion-to-exclusion. The optimal compression of each feature---at every stage of approximation---allows fine-grained inspection of the distinctions among feature values that are most impactful for prediction. We develop a framework for extracting insight from the spectrum of approximate models and demonstrate its utility on a range of tabular datasets.",['Social Aspects of Machine Learning'],[],"['Kieran A. Murphy', 'Danielle Bassett']","['University of Pennsylvania', 'University of Pennsylvania']",[]
https://iclr.cc/virtual/2023/poster/10718,Transparency & Explainability,Concept-level Debugging of Part-Prototype Networks,"Part-prototype Networks (ProtoPNets) are concept-based classifiers designed to achieve the same performance as black-box models without compromising transparency. ProtoPNets compute predictions based on similarity to class-specific part-prototypes learned to recognize parts of training examples, making it easy to faithfully determine what examples are responsible for any target prediction and why. However, like other models, they are prone to picking up confounders and shortcuts from the data, thus suffering from compromised prediction accuracy and limited generalization. We propose ProtoPDebug, an effective concept-level debugger for ProtoPNets in which a human supervisor, guided by the model’s explanations, supplies feedback in the form of what part-prototypes must be forgotten or kept, and the model is fine-tuned to align with this supervision. Our experimental evaluation shows that ProtoPDebug outperforms state-of-the-art debuggers for a fraction of the annotation cost. An online experiment with laypeople confirms the simplicity of the feedback requested to the users and the effectiveness of the collected feedback for learning confounder-free part-prototypes. ProtoPDebug is a promising tool for trustworthy interactive learning in critical applications, as suggested by a preliminary evaluation on a medical decision making task.","['Social Aspects of Machine Learning', 'debugging', 'part-prototype networks', 'concept-based models', 'self-explainable networks', 'explainability']",[],"['Stefano Teso', 'Katya Tentori', 'Fausto Giunchiglia', 'Andrea Passerini']","['University of Trento', 'University of Trento', 'University of Trento', 'University of Trento']",[]
