link,category,title,abstract,keywords,ccs_concepts,author_names,author_affiliations,author_countries
https://dl.acm.org/doi/10.5555/3524938.3525696,Transparency & Explainability,Attentive Group Equivariant Convolutional Networks,"Although group convolutional networks are able to learn powerful representations based on symmetry patterns, they lack explicit means to learn meaningful relationships among them (e.g., relative positions and poses). In this paper, we present attentive group equivariant convolutions, a generalization of the group convolution, in which attention is applied during the course of convolution to accentuate meaningful symmetry combinations and suppress non-plausible, misleading ones. We indicate that prior work on visual attention can be described as special cases of our proposed framework and show empirically that our attentive group equivariant convolutional networks consistently outperform conventional group convolutional networks on benchmark image datasets. Simultaneously, we provide interpretability to the learned concepts through the visualization of equivariant attention maps.",[],[],"['David W. Romero', 'Erik J. Bekkers', 'Jakub M. Tomczak', 'Mark Hoogendoorn']","['Vrije Universiteit Amsterdam', 'University of Amsterdam, Th', 'Vrije Universiteit Amsterdam', 'Vrije Universiteit Amsterdam']","[None, 'Netherlands', None, None]"
https://dl.acm.org/doi/10.5555/3491440.3491780,Transparency & Explainability,Scalable Exact Inference in Multi-Output Gaussian Processes,"Multi-output Gaussian processes (MOGPs) leverage the flexibility and interpretability of GPs while capturing structure across outputs, which is desirable, for example, in spatio-temporal modelling. The key problem with MOGPs is their computational scaling $O(n^3 p^3)$, which is cubic in the number of both inputs $n$ (e.g., time points or locations) and outputs $p$. For this reason, a popular class of MOGPs assumes that the data live around a low-dimensional linear subspace, reducing the complexity to $O(n^3 m^3)$. However, this cost is still cubic in the dimensionality of the subspace $m$, which is still prohibitively expensive for many applications. We propose the use of a sufficient statistic of the data to accelerate inference and learning in MOGPs with orthogonal bases. The method achieves linear scaling in $m$ in practice, allowing these models to scale to large $m$ without sacrificing significant expressivity or requiring approximation. This advance opens up a wide range of real-world tasks and can be combined with existing GP approximations in a plug-and-play way. We demonstrate the efficacy of the method on various synthetic and real-world data sets.",[],[],"['Shibo Li', 'Wei Xing', 'Robert M. Kirby', 'Shandian Zhe']","['School of Computing, University of Utah', 'Scientific Computing and Imaging Institute, University of Utah', 'School of Computing, University of Utah and Scientific Computing and Imaging Institute', 'School of Computing, University of Utah']","[None, None, None, None]"
https://dl.acm.org/doi/10.5555/3524938.3525365,Transparency & Explainability,Fast Deterministic CUR Matrix Decomposition with Accuracy Assurance,"The deterministic CUR matrix decomposition is a low-rank approximation method to analyze a data matrix. It has attracted considerable attention due to its high interpretability, which results from the fact that the decomposed matrices consist of subsets of the original columns and rows of the data matrix. The subset is obtained by optimizing an objective function with sparsity-inducing norms via coordinate descent. However, the existing algorithms for optimization incur high computation costs. This is because coordinate descent iteratively updates all the parameters in the objective until convergence. This paper proposes a fast deterministic CUR matrix decomposition. Our algorithm safely skips unnecessary updates by efficiently evaluating the optimality conditions for the parameters to be zeros. In addition, we preferentially update the parameters that must be nonzeros. Theoretically, our approach guarantees the same result as the original approach. Experiments demonstrate that our algorithm speeds up the deterministic CUR while achieving the same accuracy.",[],[],"['Yasutoshi Ida', 'Sekitoshi Kanai', 'Yasuhiro Fujiwara', 'Tomoharu Iwata', 'Koh Takeuchi', 'Hisashi Kashima']","['NTT Software Innovation Center, Tokyo,  and Department of Intelligence Science and Technology, Kyoto University, Kyoto', 'NTT Software Innovation Center, Tokyo', 'NTT Communication Science Laboratories, Kyoto', 'NTT Communication Science Laboratories, Kyoto', 'Department of Intelligence Science and Technology, Kyoto University, Kyoto,  and RIKEN Center for Advanced Intelligence Project, Tokyo', 'Department of Intelligence Science and Technology, Kyoto University, Kyoto,  and RIKEN Center for Advanced Intelligence Project, Tokyo']","['Japan', 'Japan', 'Japan', 'Japan', 'Japan', 'Japan']"
https://dl.acm.org/doi/10.5555/3524938.3525174,Transparency & Explainability,Enhancing Simple Models by Exploiting What They Already Know,"There has been recent interest in improving performance of simple models for multiple reasons such as interpretability, robust learning from small data, deployment in memory constrained settings as well as environmental considerations. In this paper, we propose a novel method SRatio that can utilize information from high performing complex models (viz. deep neural networks, boosted trees, random forests) to reweight a training dataset for a potentially low performing simple model of much lower complexity such as a decision tree or a shallow network enhancing its performance. Our method also leverages the per sample hardness estimate of the simple model which is not the case with the prior works which primarily consider the complex model's confidences/predictions and is thus conceptually novel. Moreover, we generalize and formalize the concept of attaching probes to intermediate layers of a neural network to other commonly used classifiers and incorporate this into our method. The benefit of these contributions is witnessed in the experiments where on 6 UCI datasets and CIFAR-10 we outperform competitors in a majority (16 out of 27) of the cases and tie for best performance in the remaining cases. In fact, in a couple of cases, we even approach the complex model's performance. We also conduct further experiments to validate assertions and intuitively understand why our method works. Theoretically, we motivate our approach by showing that the weighted loss minimized by simple models using our weighting upper bounds the loss of the complex model.",[],[],"['Amit Dhurandhar', 'Karthikeyan Shanmugam', 'Ronny Luss']","['IBM Research, Yorktown Heights, NY', 'IBM Research, Yorktown Heights, NY', 'IBM Research, Yorktown Heights, NY']","[None, None, None]"
https://dl.acm.org/doi/10.5555/3524938.3525642,Transparency & Explainability,Performative Prediction,"When predictions support decisions they may influence the outcome they aim to predict. We call such predictions performative; the prediction influences the target. Performativity is a well-studied phenomenon in policy-making that has so far been neglected in supervised learning. When ignored, performativity surfaces as undesirable distribution shift, routinely addressed with retraining. We develop a risk minimization framework for performative prediction bringing together concepts from statistics, game theory, and causality. A conceptual novelty is an equilibrium notion we call performative stability. Performative stability implies that the predictions are calibrated not against past outcomes, but against the future outcomes that manifest from acting on the prediction. Our main results are necessary and sufficient conditions for the convergence of retraining to a performatively stable point of nearly minimal loss. In full generality, performative prediction strictly subsumes the setting known as strategic classification. We thus also give the first sufficient conditions for retraining to overcome strategic feedback effects.",[],[],"['Juan C. Perdomo', 'Tijana Zrnic', 'Celestine Mendler-Dünner', 'Moritz Hardt']","['University of California, Berkeley', 'University of California, Berkeley', 'University of California, Berkeley', 'University of California, Berkeley']","[None, None, None, None]"
https://dl.acm.org/doi/10.5555/3524938.3525064,Fairness & Bias,Data preprocessing to mitigate bias: A maximum entropy based approach,"Data containing human or social attributes may over- or under-represent groups with respect to salient social attributes such as gender or race, which can lead to biases in downstream applications. This paper presents an algorithmic framework that can be used as a data preprocessing method towards mitigating such bias. Unlike prior work, it can efficiently learn distributions over large domains, controllably adjust the representation rates of protected groups and achieve target fairness metrics such as statistical parity, yet remains close to the empirical distribution induced by the given dataset. Our approach leverages the principle of maximum entropy – amongst all distributions satisfying a given set of constraints, we should choose the one closest in KL-divergence to a given prior. While maximum entropy distributions can succinctly encode distributions over large domains, they can be difficult to compute. Our main contribution is an instantiation of this framework for our set of constraints and priors, which encode our bias mitigation goals, and that runs in time polynomial in the dimension of the data. Empirically, we observe that samples from the learned distribution have desired representation rates and statistical rates, and when used for training a classifier incurs only a slight loss in accuracy while maintaining fairness properties.",[],[],"['L. Elisa Celis', 'Vijay Keswani', 'Nisheeth K. Vishnoi']","['Department of Statistics and Data Science, Yale University', 'Department of Statistics and Data Science, Yale University', 'Department of Computer Science, Yale University']","[None, None, None]"
https://dl.acm.org/doi/10.5555/3524938.3525596,Fairness & Bias,Two Simple Ways to Learn Individual Fairness Metrics from Data,"Individual fairness is an intuitive definition of algorithmic fairness that addresses some of the drawbacks of group fairness. Despite its benefits, it depends on a task specific fair metric that encodes our intuition of what is fair and unfair for the ML task at hand, and the lack of a widely accepted fair metric for many ML tasks is the main barrier to broader adoption of individual fairness. In this paper, we present two simple ways to learn fair metrics from a variety of data types. We show empirically that fair training with the learned metrics leads to improved fairness on three machine learning tasks susceptible to gender and racial biases. We also provide theoretical guarantees on the statistical performance of both approaches.",[],[],"['Debarghya Mukherjee', 'Mikhail Yurochkin', 'Moulinath Banerjee', 'Yuekai Sun']","['Department of Statistics, University of Michigan', 'IBM Research, MIT-IBM Watson AI Lab.', 'Department of Statistics, University of Michigan', 'Department of Statistics, University of Michigan']","[None, None, None, None]"
https://dl.acm.org/doi/10.5555/3524938.3525708,Fairness & Bias,Bounding the fairness and accuracy of classifiers from population statistics,"We consider the study of a classification model whose properties are impossible to estimate using a validation set, either due to the absence of such a set or because access to the classifier, even as a black-box, is impossible. Instead, only aggregate statistics on the rate of positive predictions in each of several sub-populations are available, as well as the true rates of positive labels in each of these sub-populations.  We show that these aggregate statistics can be used to lower-bound the discrepancy of a classifier, which is a measure that balances inaccuracy and unfairness. To this end, we define a new measure of unfairness, equal to the fraction of the population on which the classifier behaves differently, compared to its global, ideally fair behavior, as defined by the measure of equalized odds.  We propose an efficient and practical procedure for finding the best possible lower bound on the discrepancy of the classifier, given the aggregate statistics, and demonstrate in experiments the empirical tightness of this lower bound, as well as its possible uses on various types of problems, ranging from estimating the quality of voting polls to measuring the effectiveness of patient identification from internet search queries. The code and data are available at https://github.com/sivansabato/bfa.",[],[],"['Sivan Sabato', 'Elad Yom-Tov']","['Department of Computer Science, Ben-Gurion University of the Negev, Beer-Sheva,  and Microsoft Research, Herzelia', 'Microsoft Research, Herzelia']","['Israel', 'Israel']"
https://dl.acm.org/doi/10.5555/3524938.3525680,Fairness & Bias,AutoML-Zero: Evolving Machine Learning Algorithms From Scratch,"Machine learning research has advanced in multiple aspects, including model structures and learning methods. The effort to automate such research, known as AutoML, has also made significant progress. However, this progress has largely focused on the architecture of neural networks, where it has relied on sophisticated expert-designed layers as building blocks---or similarly restrictive search spaces. Our goal is to show that AutoML can go further: it is possible today to automatically discover complete machine learning algorithms just using basic mathematical operations as building blocks. We demonstrate this by introducing a novel framework that significantly reduces human bias through a generic search space. Despite the vastness of this space, evolutionary search can still discover two-layer neural networks trained by backpropagation. These simple neural networks can then be surpassed by evolving directly on tasks of interest, e.g. CIFAR-10 variants, where modern techniques emerge in the top algorithms, such as bilinear interactions, normalized gradients, and weight averaging. Moreover, evolution adapts algorithms to different task types: e.g., dropout-like techniques appear when little data is available. We believe these preliminary successes in discovering machine learning algorithms from scratch indicate a promising new direction for the field.",[],[],"['Esteban Real', 'Chen Liang', 'David R. So', 'Quoc V. Le']","['Google Brain/Google Research, Mountain View, CA', 'Google Brain/Google Research, Mountain View, CA', 'Google Brain/Google Research, Mountain View, CA', 'Google Brain/Google Research, Mountain View, CA']","[None, None, None, None]"
https://dl.acm.org/doi/10.5555/3524938.3525714,Fairness & Bias,Measuring Non-Expert Comprehension of Machine Learning Fairness Metrics,"Bias in machine learning has manifested injustice in several areas, such as medicine, hiring, and criminal justice. In response, computer scientists have developed myriad definitions of fairness to correct this bias in fielded algorithms. While some definitions are based on established legal and ethical norms, others are largely mathematical. It is unclear whether the general public agrees with these fairness definitions, and perhaps more importantly, whether they understand these definitions. We take initial steps toward bridging this gap between ML researchers and the public, by addressing the question: does a lay audience understand a basic definition of ML fairness? We develop a metric to measure comprehension of three such definitions--demographic parity, equal opportunity, and equalized odds. We evaluate this metric using an online survey, and investigate the relationship between comprehension and sentiment, demographics, and the definition itself.",[],[],"['Debjani Saha', 'Candice Schumann', 'Duncan C. McElfresh', 'John P. Dickerson', 'Michelle L. Mazurek', 'Michael Carl Tschantz']","['University of Maryland, College Park, MD', 'University of Maryland, College Park, MD', 'University of Maryland, College Park, MD', 'University of Maryland, College Park, MD', 'University of Maryland, College Park, MD', 'ICSI, Berkeley, CA']","[None, None, None, None, None, None]"
https://dl.acm.org/doi/10.5555/3524938.3525048,Fairness & Bias,A Pairwise Fair and Community-preserving Approach to k-Center Clustering,"Clustering is a foundational problem in machine learning with numerous applications. As machine learning increases in ubiquity as a backend for automated systems, concerns about fairness arise. Much of the current literature on fairness deals with discrimination against protected classes in supervised learning (group fairness). We define a different notion of fair clustering wherein the probability that two points (or a community of points) become separated is bounded by an increasing function of their pairwise distance (or community diameter). We capture the situation where data points represent people who gain some benefit from being clustered together. Unfairness arises when certain points are deterministically separated, either arbitrarily or by someone who intends to harm them as in the case of gerrymandering election districts. In response, we formally define two new types of fairness in the clustering setting, pairwise fairness and community preservation. To explore the practicality of our fairness goals, we devise an approach for extending existing $k$-center algorithms to satisfy these fairness constraints. Analysis of this approach proves that reasonable approximations can be achieved while maintaining fairness. In experiments, we compare the effectiveness of our approach to classical $k$-center algorithms/heuristics and explore the tradeoff between optimal clustering and fairness.",[],[],"['Brian Brubach', 'Darshan Chakrabarti', 'John P. Dickerson', 'Samir Khuller', 'Aravind Srinivasan', 'Leonidas Tsepenekas']","['Department of Computer Science, University of Maryland, College Park, Maryland and Computer Science Department, Wellesley College, Wellesley, MA', 'School of Computer Science, Carnegie Mellon University, Pittsburgh, PA', 'Department of Computer Science, University of Maryland, College Park, Maryland', 'Department of Computer Science, Northwestern University, Evanston, IL', 'Department of Computer Science, University of Maryland, College Park, Maryland', 'Department of Computer Science, University of Maryland, College Park, Maryland']","[None, None, None, None, None, None]"
https://dl.acm.org/doi/10.5555/3524938.3525549,Fairness & Bias,Individual Fairness for k-Clustering,"We give a local search based algorithm for $k$-median and $k$-means (and more generally for any $k$-clustering with $\ell_p$ norm cost function) from the perspective of individual fairness. More precisely, for a point $x$ in a point set $P$ of size $n$, let $r(x)$ be the minimum radius such that the ball of radius $r(x)$ centered at $x$ has at least $n/k$ points from $P$. Intuitively, if a set of $k$ random points are chosen from $P$ as centers, every point $x\in P$ expects to have a center within radius $r(x)$. An individually fair clustering provides such a guarantee for every point $x\in P$. This notion of fairness was introduced in [Jung et al., 2019] where they showed how to get an approximately feasible $k$-clustering with respect to this fairness condition. In this work, we show how to get an approximately \emph{optimal} such fair $k$-clustering. The $k$-median ($k$-means) cost of our solution is within a constant factor of the cost of an optimal fair $k$-clustering, and our solution approximately satisfies the fairness condition (also within a constant factor).",[],[],"['Sepideh Mahabadi', 'Ali Vakilian']","['TTIC, Chicago, Illinois', 'University of Wisconsin, Madison, Wisconsin']","[None, None]"
https://dl.acm.org/doi/10.5555/3524938.3525397,Fairness & Bias,Fair k-Centers via Maximum Matching,"The field of algorithms has seen a push for fairness, or the removal of inherent bias, in recent history. In data summarization, where a much smaller subset of a data set is chosen to represent the whole of the data, fairness can be introduced by guaranteeing each ""demographic group"" a specific portion of the representative subset. Specifically, this paper examines this fair variant of the k-centers problem, where a subset of the data with cardinality k is chosen to minimize distance to the rest of the data. Previous papers working on this problem presented both a 3-approximation algorithm with a super-linear runtime and a linear-time algorithm whose approximation factor is exponential in the number of demographic groups. This paper combines the best of each algorithm by presenting a linear-time algorithm with a guaranteed 3-approximation factor and provides empirical evidence of both the algorithm's runtime and effectiveness.",[],[],"['Matthew Jones', 'Huy Lê Nguyê˜n', 'Thy Nguyen']","['Khoury College of Computer Science, Northeastern University, Boston, Massachusetts', 'Khoury College of Computer Science, Northeastern University, Boston, Massachusetts', 'Khoury College of Computer Science, Northeastern University, Boston, Massachusetts']","[None, None, None]"
https://dl.acm.org/doi/10.5555/3524938.3525994,Fairness & Bias,Individual Calibration with Randomized Forecasting,"Machine learning applications often require calibrated predictions, e.g. a 90\% credible interval should contain the true outcome 90\% of the times. However, typical definitions of calibration only require this to hold on average, and offer no guarantees on predictions made on individual samples. Thus, predictions can be systematically over or under confident on certain subgroups, leading to issues of fairness and potential vulnerabilities. We show that calibration for individual samples is possible in the regression setup if and only if the predictions are randomized, i.e. outputting randomized credible intervals. Randomization removes systematic bias by trading off bias with variance. We design a training objective to enforce individual calibration and use it to train randomized regression functions. The resulting models are more calibrated for arbitrarily chosen subgroups of the data, and can achieve higher utility in decision making against adversaries that exploit miscalibrated predictions.",[],[],"['Shengjia Zhao', 'Tengyu Ma', 'Stefano Ermon']","['Computer Science Department, Stanford University', 'Computer Science Department, Stanford University', 'Computer Science Department, Stanford University']","[None, None, None]"
https://dl.acm.org/doi/10.5555/3524938.3525201,Fairness & Bias,Is There a Trade-Off Between Fairness and Accuracy? A Perspective Using Mismatched Hypothesis Testing,"A trade-off between accuracy and fairness is almost taken as a given in the existing literature on fairness in machine learning. Yet, it is not preordained that accuracy should decrease with increased fairness. Novel to this work, we examine fair classification through the lens of mismatched hypothesis testing: trying to find a classifier that distinguishes between two ideal distributions when given two mismatched distributions that are biased. Using Chernoff information, a tool in information theory, we theoretically demonstrate that, contrary to popular belief, there always exist ideal distributions such that optimal fairness and accuracy (with respect to the ideal distributions) are achieved simultaneously: there is no trade-off. Moreover, the same classifier yields the lack of a trade-off with respect to ideal distributions while yielding a trade-off when accuracy is measured with respect to the given (possibly biased) dataset. To complement our main result, we formulate an optimization to find ideal distributions and derive fundamental limits to explain why a trade-off exists on the given biased dataset. We also derive conditions under which active data collection can alleviate the fairness-accuracy trade-off in the real world. Our results lead us to contend that it is problematic to measure accuracy with respect to data that reflects bias, and instead, we should be considering accuracy with respect to ideal, unbiased data.",[],[],"['Sanghamitra Dutta', 'Dennis Wei', 'Hazar Yueksel', 'Pin-Yu Chen', 'Sijia Liu', 'Kush R. Varshney']","['IBM Research and Department of Electrical and Computer Engineering, Carnegie Mellon University', 'IBM Research', 'IBM Research', 'IBM Research', 'IBM Research', 'IBM Research']","[None, None, None, None, None, None]"
https://dl.acm.org/doi/10.5555/3524938.3525052,Fairness & Bias,DeBayes: a Bayesian Method for Debiasing Network Embeddings,"As machine learning algorithms are increasingly deployed for high-impact automated decision making, ethical and increasingly also legal standards demand that they treat all individuals fairly, without discrimination based on their age, gender, race or other sensitive traits. In recent years much progress has been made on ensuring fairness and reducing bias in standard machine learning settings. Yet, for network embedding, with applications in vulnerable domains ranging from social network analysis to recommender systems, current options remain limited both in number and performance. We thus propose DeBayes: a conceptually elegant Bayesian method that is capable of learning debiased embeddings by using a biased prior. Our experiments show that these representations can then be used to perform link prediction that is significantly more fair in terms of popular metrics such as demographic parity and equalized opportunity.",[],[],"['Maarten Buyl', 'Tijl De Bie']","['Department of Electronics and Information Systems, IDLab, Ghent University, Ghent', 'Department of Electronics and Information Systems, IDLab, Ghent University, Ghent']","['Belgium', 'Belgium']"
