link,category,title,abstract,keywords,ccs_concepts,author_names,author_affiliations,author_countries
https://openreview.net/forum?id=yozwqhIHXj,Transparency & Explainability,Image Translation as Diffusion Visual Programmers,"We introduce the novel Diffusion Visual Programmer (DVP), a neuro-symbolic image translation framework. Our proposed DVP seamlessly embeds a condition-flexible diffusion model within the GPT architecture, orchestrating a coherent sequence of visual programs ($i.e.$, computer vision models) for various pro-symbolic steps, which span RoI identification, style transfer, and position manipulation, facilitating transparent and controllable image translation processes. Extensive experiments demonstrate DVP’s remarkable performance, surpassing concurrent arts. This success can be attributed to several key features of DVP: First, DVP achieves condition-flexible translation via instance normalization, enabling the model to eliminate sensitivity caused by the manual guidance and optimally focus on textual descriptions for high-quality content generation. Second, the frame work enhances in-context reasoning by deciphering intricate high-dimensional concepts in feature spaces into more accessible low-dimensional symbols ($e.g.$, [Prompt], [RoI object]), allowing for localized, context-free editing while maintaining overall coherence. Last but not least, DVP improves systemic controllability and explainability by offering explicit symbolic representations at each programming stage, empowering users to intuitively interpret and modify results. Our research marks a substantial step towards harmonizing artificial image translation processes with cognitive intelligence, promising broader applications.",[],[],"['Cheng Han', 'James Chenhao Liang', 'Qifan Wang', 'MAJID RABBANI', 'Sohail Dianat', 'Raghuveer Rao', 'Ying Nian Wu', 'Dongfang Liu']","['Computer Science, University of Missouri - Kansas City', 'U. S. Naval Research Laboratory', 'Meta AI', 'EME, Rochester Institute of Technology', 'Electrical and Microelectronic Engineering, Rochester Institute of Technology', 'Intelligent Perception , DEVCOM Army Research Laboratory', 'Statistics, UCLA', 'Rochester Institute of Technology']","['United States', 'United States', '', 'United States', 'United States', 'United States', 'United States', 'United States']"
https://openreview.net/forum?id=xv8iGxENyI,Security,Threaten Spiking Neural Networks through Combining Rate and Temporal Information,"Spiking Neural Networks (SNNs) have received widespread attention in academic communities due to their superior spatio-temporal processing capabilities and energy-efficient characteristics. With further in-depth application in various fields, the vulnerability of SNNs under adversarial attack has become a focus of concern.  In this paper, we draw inspiration from two mainstream learning algorithms of SNNs and observe that SNN models reserve both rate and temporal information. To better understand the capabilities of these two types of information, we conduct a quantitative analysis separately for each. In addition, we note that the retention degree of temporal information is related to the parameters and input settings of spiking neurons. Building on these insights, we propose a hybrid adversarial attack based on rate and temporal information (HART), which allows for dynamic adjustment of the rate and temporal attributes. Experimental results demonstrate that compared to previous works, HART attack can achieve significant superiority under different attack scenarios, data types, network architecture, time-steps, and model hyper-parameters. These findings call for further exploration into how both types of information can be effectively utilized to enhance the reliability of SNNs. Code is available at [https://github.com/hzc1208/HART_Attack](https://github.com/hzc1208/HART_Attack).",[],[],"['Zecheng Hao', 'Tong Bu', 'Xinyu Shi', 'Zihan Huang', 'Zhaofei Yu', 'Tiejun Huang']","['School of Computer Science, Peking University', '', '', 'Peking University', 'Peking University', 'School of Computer Science, Peking University']","['United States', '', '', 'United States', 'United States', 'United States']"
https://openreview.net/forum?id=xUzWmFdglP,Privacy & Data Governance,Privacy Amplification for Matrix Mechanisms,"Privacy amplification exploits randomness in data selection to provide tighter differential privacy (DP) guarantees. This analysis is key to DP-SGD's success in machine learning (ML), but, is not readily applicable to the newer state-of-the-art (SOTA) algorithms. This is because these algorithms, known as DP-FTRL, use the matrix mechanism to add correlated noise instead of independent noise as in DP-SGD.  In this paper, we propose ""MMCC'' (matrix mechanism conditional composition), the first algorithm to analyze privacy amplification via sampling for any generic matrix mechanism. MMCC is nearly tight in that it approaches a lower bound as $\epsilon\to0$.  To analyze correlated outputs in MMCC, we prove that they can be analyzed as if they were independent, by conditioning them on prior outputs. Our ""conditional composition theorem'' has broad utility: we use it to show that the noise added to binary-tree-DP-FTRL can asymptotically match the noise added to DP-SGD with amplification. Our algorithm also has practical empirical utility. We show that amplification leads to significant improvement in the privacy/utility trade-offs for DP-FTRL style algorithms for standard benchmark tasks.",[],[],"['Christopher A. Choquette-Choo', 'Arun Ganesh', 'Thomas Steinke', 'Abhradeep Guha Thakurta']","['Google DeepMind', 'Google', 'Google DeepMind', 'Google']","['United States', 'United States', 'United States', 'United States']"
https://openreview.net/forum?id=vy42bYs1Wo,Security,Off-Policy Primal-Dual Safe Reinforcement Learning,"Primal-dual safe RL methods commonly perform iterations between the primal update of the policy and the dual update of the Lagrange Multiplier. Such a training paradigm is highly susceptible to the error in cumulative cost estimation since this estimation serves as the key bond connecting the primal and dual update processes. We show that this problem causes significant underestimation of cost when using off-policy methods, leading to the failure to satisfy the safety constraint. To address this issue, we propose conservative policy optimization, which learns a policy in a constraint-satisfying area by considering the uncertainty in cost estimation. This improves constraint satisfaction but also potentially hinders reward maximization. We then introduce local policy convexification to help eliminate such suboptimality by gradually reducing the estimation uncertainty. We provide theoretical interpretations of the joint coupling effect of these two ingredients and further verify them by extensive experiments. Results on benchmark tasks show that our method not only achieves an asymptotic performance comparable to state-of-the-art on-policy methods while using much fewer samples, but also significantly reduces constraint violation during training. Our code is available at https://github.com/ZifanWu/CAL.",[],[],"['Zifan Wu', 'Bo Tang', 'Qian Lin', 'Chao Yu', 'Shangqin Mao', 'Qianlong Xie', 'Xingxing Wang', 'Dong Wang']","['Kahlert School of Computing, University of Utah', 'Institute for Advanced Algorithms Research, Shanghai', 'Computer science, SUN YAT-SEN UNIVERSITY', 'Sun Yat-sen University', 'Meituan', '', 'meituan', 'Tsinghua University, Tsinghua University']","['United States', '', 'China', 'China', 'Brazil', '', 'Brazil', 'China']"
https://openreview.net/forum?id=vqIH0ObdqL,Transparency & Explainability,Can Large Language Models Infer Causation from Correlation?,"Causal inference is one of the hallmarks of human intelligence. While the field of CausalNLP has attracted much interest in the recent years, existing causal inference datasets in NLP primarily rely on discovering causality from empirical knowledge (e.g., commonsense knowledge). In this work, we propose the first benchmark dataset to test the pure causal inference skills of large language models (LLMs). Specifically, we formulate a novel task Corr2Cause, which takes a set of correlational statements and determines the causal relationship between the variables. We curate a large-scale dataset of more than 200K samples, on which we evaluate seventeen existing LLMs. Through our experiments, we identify a key shortcoming of LLMs in terms of their causal inference skills, and show that these models achieve almost close to random performance on the task. This shortcoming is somewhat mitigated when we try to re-purpose LLMs for this skill via finetuning, but we find that these models still fail to generalize – they can only perform causal inference in in-distribution settings when variable names and textual expressions used in the queries are similar to those in the training set, but fail in out-of-distribution settings generated by perturbing these queries. Corr2Cause is a challenging task for LLMs, and can be helpful in guiding future research on improving LLMs’ pure reasoning skills and generalizability. Our data is at https://huggingface.co/datasets/causalnlp/corr2cause. Our code is at https://github.com/causalNLP/corr2cause.",[],[],"['Zhijing Jin', 'Jiarui Liu', 'Zhiheng LYU', 'Spencer Poff', 'Mrinmaya Sachan', 'Rada Mihalcea', 'Mona T. Diab', 'Bernhard Schölkopf']","['', 'Carnegie Mellon University', 'University of Waterloo', 'Facebook', 'Swiss Federal Institute of Technology', 'University of Michigan', 'Language Technologies Institute, Carnegie Mellon University', '']","['', 'United States', 'Canada', 'Vietnam', 'India', 'Italy', 'United States', '']"
https://openreview.net/forum?id=vRyp2dhEQp,Security,Efficient Backdoor Attacks for Deep Neural Networks in Real-world Scenarios,"Recent deep neural networks (DNNs) have came to rely on vast amounts of training data, providing an opportunity for malicious attackers to exploit and contaminate the data to carry out backdoor attacks. However, existing backdoor attack methods make unrealistic assumptions, assuming that all training data comes from a single source and that attackers have full access to the training data. In this paper, we introduce a more realistic attack scenario where victims collect data from multiple sources, and attackers cannot access the complete training data. We refer to this scenario as $\textbf{data-constrained backdoor attacks}$. In such cases, previous attack methods suffer from severe efficiency degradation due to the $\textbf{entanglement}$ between benign and poisoning features during the backdoor injection process. To tackle this problem, we introduce three CLIP-based technologies from two distinct streams: $\textit{Clean Feature Suppression}$ and $\textit{Poisoning Feature Augmentation}$. The results demonstrate remarkable improvements, with some settings achieving over $\textbf{100}$% improvement compared to existing attacks in data-constrained scenarios.",[],[],"['Ziqiang Li', 'Hong Sun', 'Pengfei Xia', 'Heng Li', 'Beihao Xia', 'Yi Wu', 'Bin Li']","['Nanjing University of Information Science and Technology', 'University of Science and Technology of China', 'University of Science and Technology of China', 'Huazhong University of Science and Technology', 'EIC, Huazhong University of Science and Technology', 'University of Science and Technology of China', 'School of Information Science and Technology, University of Science and Technology of China']","['China', 'China', 'China', 'China', 'China', 'China', 'China']"
https://openreview.net/forum?id=vLJcd43U7a,Transparency & Explainability,SYMBOL: Generating Flexible Black-Box Optimizers through Symbolic Equation Learning,"Recent Meta-learning for Black-Box Optimization (MetaBBO) methods harness neural networks to meta-learn configurations of traditional black-box optimizers. Despite their success, they are inevitably restricted by the limitations of predefined hand-crafted optimizers. In this paper, we present SYMBOL, a novel framework that promotes the automated discovery of black-box optimizers through symbolic equation learning. Specifically, we propose a Symbolic Equation Generator (SEG) that allows closed-form optimization rules to be dynamically generated for specific tasks and optimization steps. Within SYMBOL, we then develop three distinct strategies based on reinforcement learning, so as to meta-learn the SEG efficiently. Extensive experiments reveal that the optimizers generated by SYMBOL not only surpass the state-of-the-art BBO and MetaBBO baselines, but also exhibit exceptional zero-shot generalization abilities across entirely unseen tasks with different problem dimensions, population sizes, and optimization horizons. Furthermore, we conduct in-depth analyses of our SYMBOL framework and the optimization rules that it generates, underscoring its desirable flexibility and interpretability.",[],[],"['Jiacheng Chen', 'Zeyuan Ma', 'Hongshu Guo', 'Yining Ma', 'Jie Zhang', 'Yue-Jiao Gong']","['South China University of Technology', 'South China University of Technology', 'South China University of Technology', 'Massachusetts Institute of Technology', 'Nanyang Technological University', 'Computer Science, South China University of Technology']","['China', 'China', 'China', 'China', 'China', 'China']"
https://openreview.net/forum?id=vE1e1mLJ0U,Fairness & Bias,The Expressive Leaky Memory Neuron: an Efficient and Expressive Phenomenological Neuron Model Can Solve Long-Horizon Tasks.,"Biological cortical neurons are remarkably sophisticated computational devices, temporally integrating their vast synaptic input over an intricate dendritic tree, subject to complex, nonlinearly interacting internal biological processes.  A recent study proposed to characterize this complexity by fitting accurate surrogate models to replicate the input-output relationship of a detailed biophysical cortical pyramidal neuron model and discovered it needed temporal convolutional networks (TCN) with millions of parameters.  Requiring these many parameters, however, could stem from a misalignment between the inductive biases of the TCN and cortical neuron's computations. In light of this, and to explore the computational implications of leaky memory units and nonlinear dendritic processing, we introduce the Expressive Leaky Memory (ELM) neuron model, a biologically inspired phenomenological model of a cortical neuron. Remarkably, by exploiting such slowly decaying memory-like hidden states and two-layered nonlinear integration of synaptic input, our ELM neuron can accurately match the aforementioned input-output relationship with under ten thousand trainable parameters. To further assess the computational ramifications of our neuron design, we evaluate it on various tasks with demanding temporal structures, including the Long Range Arena (LRA) datasets, as well as a novel neuromorphic dataset based on the Spiking Heidelberg Digits dataset (SHD-Adding). Leveraging a larger number of memory units with sufficiently long timescales, and correspondingly sophisticated synaptic integration, the ELM neuron displays substantial long-range processing capabilities, reliably outperforming the classic Transformer or Chrono-LSTM architectures on LRA, and even solving the Pathfinder-X task with over 70\% accuracy (16k context length). These findings raise further questions about the computational sophistication of individual cortical neurons and their role in extracting complex long-range temporal dependencies.",[],[],"['Aaron Spieler', 'Nasim Rahaman', 'Georg Martius', 'Bernhard Schölkopf', 'Anna Levina']","['Friedrich Miescher Institute', 'Max Planck Institute for Intelligent Systems, Max-Planck Institute', 'Eberhard-Karls-Universität Tübingen', '', 'Eberhard-Karls-Universität Tübingen']","['Brazil', 'Brazil', 'Germany', '', 'Germany']"
https://openreview.net/forum?id=v1VvCWJAL8,Transparency & Explainability,Towards Characterizing Domain Counterfactuals for Invertible Latent Causal Models,"Answering counterfactual queries has important applications such as explainability, robustness, and fairness but is challenging when the causal variables are unobserved and the observations are non-linear mixtures of these latent variables, such as pixels in images. One approach is to recover the latent Structural Causal Model (SCM), which may be infeasible in practice due to requiring strong assumptions, e.g., linearity of the causal mechanisms or perfect atomic interventions. Meanwhile, more practical ML-based approaches using naive domain translation models to generate counterfactual samples lack theoretical grounding and may construct invalid counterfactuals. In this work, we strive to strike a balance between practicality and theoretical guarantees by analyzing a specific type of causal query called *domain counterfactuals*, which hypothesizes what a sample would have looked like if it had been generated in a different domain (or environment). We show that recovering the latent SCM is unnecessary for estimating domain counterfactuals, thereby sidestepping some of the theoretic challenges. By assuming invertibility and sparsity of intervention, we prove domain counterfactual estimation error can be bounded by a data fit term and intervention sparsity term. Building upon our theoretical results, we develop a theoretically grounded practical algorithm that simplifies the modeling process to generative model estimation under autoregressive and shared parameter constraints that enforce intervention sparsity. Finally, we show an improvement in counterfactual estimation over baseline methods through extensive simulated and image-based experiments.",[],[],"['Zeyu Zhou', 'Ruqi Bai', 'Sean Kulinski', 'Murat Kocaoglu', 'David I. Inouye']","['Purdue University', 'Electrical and Computer Engineering, Purdue University', 'Purdue University', 'Purdue University', 'Purdue University']","['United States', 'United States', 'United States', 'United States', 'United States']"
https://openreview.net/forum?id=up6hr4hIQH,Transparency & Explainability,Towards Robust Fidelity for Evaluating Explainability of Graph Neural Networks,"Graph Neural Networks (GNNs) are neural models that leverage the dependency structure in graphical data via message passing among the graph nodes. GNNs have emerged as pivotal architectures in analyzing graph-structured data, and their expansive application in sensitive domains requires a comprehensive understanding of their decision-making processes --- necessitating a framework for GNN explainability. An explanation function for GNNs takes a pre-trained GNN along with a graph as input, to produce a `sufficient statistic' subgraph with respect to the graph label. A main challenge in studying GNN explainability is to provide fidelity measures that evaluate the performance of these explanation functions. This paper studies this foundational challenge, spotlighting the inherent limitations of prevailing fidelity metrics, including $Fid_+$, $Fid_-$, and $Fid_\Delta$. Specifically, a formal, information-theoretic definition of explainability is introduced and it is shown that existing metrics often fail to align with this definition across various statistical scenarios. The reason is due to potential distribution shifts when subgraphs are removed in computing these fidelity measures. Subsequently, a robust class of fidelity measures are introduced, and it is shown analytically that they are resilient to distribution shift issues and are applicable in a wide range of scenarios. Extensive empirical analysis on both synthetic and real datasets are provided to illustrate that the proposed metrics are more coherent with gold standard metrics.",[],[],"['Xu Zheng', 'Farhad Shirani', 'Tianchun Wang', 'Wei Cheng', 'Zhuomin Chen', 'Haifeng Chen', 'Hua Wei', 'Dongsheng Luo']","['', 'Florida International University', 'Pennsylvania State University', 'Data Science, NEC-Labs', '', 'NEC-Labs', 'Arizona State University', '']","['', 'United States', 'United States', 'United States', 'United States', '', 'United States', '']"
https://openreview.net/forum?id=Hf17y6u9BC,Transparency & Explainability,Towards Best Practices of Activation Patching in Language Models: Metrics and Methods,"Mechanistic interpretability seeks to understand the internal mechanisms of machine learning models, where localization—identifying the important model components—is a key step. Activation patching, also known as causal tracing or interchange intervention, is a standard technique for this task (Vig et al., 2020), but the literature contains many variants with little consensus on the choice of hyperparameters or methodology. In this work, we systematically examine the impact of methodological details in activation patching, including evaluation metrics and corruption methods. In several settings of localization and circuit discovery in language models, we find that varying these hyperparameters could lead to disparate interpretability results. Backed by empirical observations, we give conceptual arguments for why certain metrics or methods may be preferred. Finally, we provide recommendations for the best practices of activation patching going forwards.",[],[],"['Fred Zhang', 'Neel Nanda']","['Google DeepMind', 'Google DeepMind']","['United States', 'United States']"
https://openreview.net/forum?id=u7559ZMvwY,Security,Adversarial Training on Purification (AToP): Advancing Both Robustness and Generalization,"The deep neural networks are known to be vulnerable to well-designed adversarial attacks. The most successful defense technique based on adversarial training (AT) can achieve optimal robustness against particular attacks but cannot generalize well to unseen attacks. Another effective defense technique based on adversarial purification (AP) can enhance generalization but cannot achieve optimal robustness. Meanwhile, both methods share one common limitation on the degraded standard accuracy. To mitigate these issues, we propose a novel pipeline to acquire the robust purifier model, named Adversarial Training on Purification (AToP), which comprises two components: perturbation destruction by random transforms (RT) and purifier model fine-tuned (FT) by adversarial loss. RT is essential to avoid overlearning to known attacks, resulting in the robustness generalization to unseen attacks, and FT is essential for the improvement of robustness.  To evaluate our method in an efficient and scalable way, we conduct extensive experiments on CIFAR-10, CIFAR-100, and ImageNette to demonstrate that our method achieves optimal robustness and exhibits generalization ability against unseen attacks.",[],[],"['Guang Lin', 'Chao Li', 'Jianhai Zhang', 'Toshihisa Tanaka', 'Qibin Zhao']","['Tokyo University of Agriculture and Technology', 'RIKEN', 'College of Computer Science, Hangzhou Dianzi University', 'Tokyo University of Agriculture and Technology, Tokyo Institute of Technology', 'AIP, RIKEN']","['Japan', 'Japan', 'Japan', 'Japan', 'Japan']"
https://openreview.net/forum?id=u859gX7ADC,Transparency & Explainability,Augmenting Transformers with Recursively Composed Multi-grained Representations,"We present ReCAT, a recursive composition augmented Transformer that is able to explicitly model hierarchical syntactic structures of raw texts without relying on gold trees during both learning and inference.  Existing research along this line restricts data to follow a hierarchical tree structure and thus lacks inter-span communications. To overcome the problem, we propose a novel contextual inside-outside (CIO) layer that learns contextualized representations of spans through bottom-up and top-down passes, where a bottom-up pass forms representations of high-level spans by composing low-level spans, while a top-down pass combines information inside and outside a span. By stacking several CIO layers between the embedding layer and the attention layers in Transformer, the ReCAT model can perform both deep intra-span and deep inter-span interactions, and thus generate multi-grained representations fully contextualized with other spans. Moreover, the CIO layers can be jointly pre-trained with Transformers, making ReCAT enjoy scaling ability, strong performance, and interpretability at the same time. We conduct experiments on various sentence-level and span-level tasks. Evaluation results indicate that ReCAT can significantly outperform vanilla Transformer models on all span-level tasks and recursive models on natural language inference tasks. More interestingly, the hierarchical structures induced by ReCAT exhibit strong consistency with human-annotated syntactic trees, indicating good interpretability brought by the CIO layers.",[],[],"['Xiang Hu', 'Qingyang Zhu', 'Kewei Tu', 'Wei Wu']","['Alibaba Group', 'ShanghaiTech University', 'ShanghaiTech University', 'Ant Research']","['China', 'China', 'China', 'China']"
