link,category,title,abstract,keywords,ccs_concepts,author_names,author_affiliations,author_countries
https://openreview.net/forum?id=IEduRUO55F,Security,Eureka: Human-Level Reward Design via Coding Large Language Models,"Large Language Models (LLMs) have excelled as high-level semantic planners for sequential decision-making tasks. However, harnessing them to learn complex low-level manipulation tasks, such as dexterous pen spinning, remains an open problem. We bridge this fundamental gap and present Eureka, a human-level reward design algorithm powered by LLMs. Eureka exploits the remarkable zero-shot generation, code-writing, and in-context improvement capabilities of state-of-the-art LLMs, such as GPT-4, to perform evolutionary optimization over reward code. The resulting rewards can then be used to acquire complex skills via reinforcement learning. Without any task-specific prompting or pre-defined reward templates, Eureka generates reward functions that outperform expert human-engineered rewards. In a diverse suite of 29 open-source RL environments that include 10 distinct robot morphologies, Eureka outperforms human experts on 83% of the tasks, leading to an average normalized improvement of 52%. The generality of Eureka also enables a new gradient-free in-context learning approach to reinforcement learning from human feedback (RLHF), readily incorporating human inputs to improve the quality and the safety of the generated rewards without model updating. Finally, using Eureka rewards in a curriculum learning setting, we demonstrate for the first time, a simulated Shadow Hand capable of performing pen spinning tricks, adeptly manipulating a pen in circles at rapid speed.",[],[],"['Yecheng Jason Ma', 'William Liang', 'Guanzhi Wang', 'De-An Huang', 'Osbert Bastani', 'Dinesh Jayaraman', 'Yuke Zhu', 'Linxi Fan', 'Anima Anandkumar']","['', 'University of Pennsylvania', 'California Institute of Technology', 'NVIDIA', 'University of Pennsylvania', 'University of Pennsylvania, University of Pennsylvania', 'Computer Science Department, University of Texas, Austin', 'NVIDIA', 'Computer Science, California Institute of Technology']","['', 'United States', 'United States', 'United States', 'United States', 'United States', 'United States', 'United States', 'United States']"
https://openreview.net/forum?id=IGzaH538fz,Security,GNNCert: Deterministic Certification of Graph Neural Networks against Adversarial Perturbations,"Graph classification, which aims to predict a label for a graph, has many real-world applications such as malware detection, fraud detection, and healthcare. However, many studies show an attacker could carefully perturb the structure and/or node features in a graph such that a graph classifier misclassifies the perturbed graph. Such vulnerability impedes the deployment of graph classification in security/safety-critical applications. Existing empirical defenses lack formal robustness guarantees and could be broken by adaptive or unknown attacks. Existing provable defenses have the following limitations: 1)  they achieve sub-optimal robustness guarantees for graph structure perturbation, 2) they cannot provide robustness guarantees for arbitrarily node feature perturbations, 3) their robustness guarantees are probabilistic, meaning they could be incorrect with a non-zero probability, and 4) they incur large computation costs. We aim to address those limitations in this work. We propose GNNCert, a certified defense against both graph structure and node feature perturbations for graph classification. Our GNNCert provably predicts the same label for a graph when the number of perturbed edges and the number of nodes with perturbed features are bounded. Our results on 8 benchmark datasets show that GNNCert outperforms three state-of-the-art methods.",[],[],"['zaishuo xia', 'Han Yang', 'Binghui Wang', 'Jinyuan Jia']","['Microsoft', 'Sichuan University', 'Illinois Institute of Technology', 'College of IST, Pennsylvania State University']","['United States', 'United States', 'United States', 'United States']"
https://openreview.net/forum?id=RIuevDSK5V,Fairness & Bias,ConR: Contrastive Regularizer for Deep Imbalanced Regression,"Imbalanced distributions are ubiquitous in real-world data. They create constraints on Deep Neural Networks to represent the minority labels and avoid bias towards majority labels. The extensive body of imbalanced approaches address categorical label spaces but fail to effectively extend to regression problems where the label space is continuous. Local and global correlations among continuous labels provide valuable insights towards effectively modelling relationships in feature space. In this work, we propose ConR, a contrastive regularizer that models global and local label similarities in feature space and prevents the features of minority samples from being collapsed into their majority neighbours. ConR discerns the disagreements between the label space and feature space, and imposes a penalty on these disagreements. ConR minds the continuous nature of label space with two main strategies in a contrastive manner: incorrect proximities are penalized proportionate to the label similarities and the correct ones are encouraged to model local similarities. ConR consolidates essential considerations into a generic, easy-to-integrate, and efficient method that effectively addresses deep imbalanced regression. Moreover, ConR is orthogonal to existing approaches and smoothly extends to uni- and multi-dimensional label spaces. Our comprehensive experiments show that ConR significantly boosts the performance of all the state-of-the-art methods on four large-scale deep imbalanced regression benchmarks.",[],[],"['Mahsa Keramati', 'Lili Meng', 'R. David Evans']","['Simon Fraser University', 'University of British Columbia', '']","['Canada', 'Canada', '']"
https://openreview.net/forum?id=HT2dAhh4uV,Fairness & Bias,Learning to Compose: Improving Object Centric Learning by Injecting Compositionality,"Learning compositional representation is a key aspect of object-centric learning as it enables flexible systematic generalization and supports complex visual reasoning. However, most of the existing approaches rely on auto-encoding objective, while the compositionality is implicitly imposed by the architectural or algorithmic bias in the encoder. This misalignment between auto-encoding objective and learning compositionality often results in failure of capturing meaningful object representations. In this study, we propose a novel objective that explicitly encourages compositionality of the representations. Built upon the existing object-centric learning framework (e.g., slot attention), our method incorporates additional constraints that an arbitrary mixture of object representations from two images should be valid by maximizing the likelihood of the composite data. We demonstrate that incorporating our objective to the existing framework consistently improves the objective-centric learning and enhances the robustness to the architectural choices.",[],[],"['Whie Jung', 'Jaehoon Yoo', 'Sungjin Ahn', 'Seunghoon Hong']","['School of Computing, Korea Advanced Institute of Science and Technology', 'Korea Advanced Institute of Science & Technology', '', 'School of Computing, Korea Advanced Institute of Science and Technology']","['South Korea', 'South Korea', 'South Korea', 'South Korea']"
https://openreview.net/forum?id=YLJs4mKJCF,Fairness & Bias,Towards Poisoning Fair Representations,"Fair machine learning seeks to mitigate model prediction bias against certain demographic subgroups such as elder and female.  Recently, fair representation learning (FRL) trained by deep neural networks has demonstrated superior performance, whereby representations containing no demographic information are inferred from the data and then used as the input to classification or other downstream tasks.  Despite the development of FRL methods, their vulnerability under data poisoning attack, a popular protocol to benchmark model robustness under adversarial scenarios, is under-explored. Data poisoning attacks have been developed for classical fair machine learning methods which incorporate fairness constraints into shallow-model classifiers. Nonetheless, these attacks fall short in FRL due to notably different fairness goals and model architectures.  This work proposes the first data poisoning framework attacking FRL. We induce the model to output unfair representations that contain as much demographic information as possible by injecting carefully crafted poisoning samples into the training data. This attack entails a prohibitive bilevel optimization, wherefore an effective approximated solution is proposed. A theoretical analysis on the needed number of poisoning samples is derived and sheds light on defending against the attack. Experiments on benchmark fairness datasets and state-of-the-art fair representation learning models demonstrate the superiority of our attack.",[],[],"['Tianci Liu', 'Haoyu Wang', 'Feijie Wu', 'Hengtong Zhang', 'Pan Li', 'Lu Su', 'Jing Gao']","['ECE, Purdue University', 'State University of New York at Albany', 'Purdue University', 'Tencent AI Lab', 'Georgia Institute of Technology', 'Purdue University', 'Purdue University']","['United States', 'United States', 'United States', '', 'United States', 'United States', 'United States']"
https://openreview.net/forum?id=9WD9KwssyT,Fairness & Bias,Zipformer: A faster and better encoder for automatic speech recognition,"The Conformer has become the most popular encoder model for automatic speech recognition (ASR).  It adds convolution modules to a transformer to learn both local and global dependencies. In this work we describe a faster, more memory-efficient, and better-performing transformer, called Zipformer.  Modeling changes include: 1) a U-Net-like encoder structure where middle stacks operate at lower frame rates; 2) reorganized block structure with more modules, within which we re-use attention weights for efficiency; 3) a modified form of LayerNorm called BiasNorm allows us to retain some length information; 4)  new activation functions SwooshR and SwooshL work better than Swish.  We also propose a new optimizer, called ScaledAdam, which scales the update by each tensor's current scale to keep the relative change about the same, and also explictly learns the parameter scale. It achieves faster converge and better performance than Adam. Extensive experiments on LibriSpeech, Aishell-1, and WenetSpeech datasets demonstrate the effectiveness of our proposed Zipformer over other state-of-the-art ASR models. Our code is publicly available at https://github.com/k2-fsa/icefall.",[],[],"['Zengwei Yao', 'Liyong Guo', 'Xiaoyu Yang', 'Wei Kang', 'Fangjun Kuang', 'Yifan Yang', 'Zengrui Jin', 'Long Lin', 'Daniel Povey']","['Xiaomi Corporation', ""Northwest Polytechnical University Xi'an"", 'University of Cambridge', 'Xiaomi Corp.', 'Xiaomi', 'Computer Science and Engineering, Shanghai Jiaotong University', '', 'Xiaomi corp.', 'Johns Hopkins University']","['China', 'China', 'United Kingdom', 'China', 'China', 'China', 'China', 'China', 'United States']"
https://openreview.net/forum?id=SdeAPV1irk,Security,Incremental Randomized Smoothing Certification,"Randomized smoothing-based certification is an effective approach for obtaining robustness certificates of deep neural networks (DNNs) against adversarial attacks. This method constructs a smoothed DNN model and certifies its robustness through statistical sampling, but it is computationally expensive, especially when certifying with a large number of samples. Furthermore, when the smoothed model is modified (e.g., quantized or pruned), certification guarantees may not hold for the modified DNN, and recertifying from scratch can be prohibitively expensive.  We present the first approach for incremental robustness certification for randomized smoothing, IRS. We show how to reuse the certification guarantees for the original smoothed model to certify an approximated model with very few samples. IRS significantly reduces the computational cost of certifying modified DNNs while maintaining strong robustness guarantees. We experimentally demonstrate the effectiveness of our approach, showing up to 4.1x certification speedup over the certification that applies randomized smoothing of the approximate model from scratch.",[],[],"['Shubham Ugare', 'Tarun Suresh', 'Debangshu Banerjee', 'Gagandeep Singh', 'Sasa Misailovic']","['Computer Science, University of Illinois at Urbana-Champaign', 'Department of Computer Science', 'Computer Science, University of Illinois at Urbana-Champaign', 'University of Illinois, Urbana Champaign', 'School of Computing and Data Science, University of Illinois, Urbana Champaign']","['United States', '', 'United States', 'United States', 'United States']"
https://openreview.net/forum?id=uFbWHyTlPn,Fairness & Bias,Differentially Private SGD Without Clipping Bias: An Error-Feedback Approach,"Differentially Private Stochastic Gradient Descent with Gradient Clipping (DPSGD-GC) is a powerful tool for training deep learning models using sensitive data, providing both a solid theoretical privacy guarantee and high efficiency. However, existing research has shown that DPSGD-GC only converges when using large clipping thresholds that are dependent on problem-specific parameters that are often unknown in practice. Therefore, DPSGD-GC suffers from degraded performance due to the {\it constant}  bias introduced by the clipping. In our work, we propose a new error-feedback (EF) DP algorithm as an alternative to DPSGD-GC, which offers a diminishing utility bound without inducing a constant clipping bias. More importantly, it allows for an arbitrary choice of clipping threshold that is independent of the problem. We establish an algorithm-specific DP analysis for our proposed algorithm, providing privacy guarantees based on R{\'e}nyi DP. And we demonstrate that under mild conditions, our algorithm can achieve the same utility bound as DPSGD without gradient clipping. Our empirical results on standard datasets show that the proposed algorithm achieves higher accuracies than DPSGD while maintaining the same level of DP guarantee.",[],[],"['Xinwei Zhang', 'Zhiqi Bu', 'Steven Wu', 'Mingyi Hong']","['University of Southern California', 'Amazon', 'School of Computer Science, Carnegie Mellon University', 'AGI, Amazon']","['United States', 'Japan', 'United States', 'Japan']"
https://openreview.net/forum?id=A0HKeKl4Nl,Transparency & Explainability,Mechanistically analyzing the effects of fine-tuning on procedurally defined tasks,"Fine-tuning large pre-trained models has become the de facto strategy for developing both task-specific and general-purpose machine learning systems, including developing models that are safe to deploy. Despite its clear importance, there has been minimal work that explains how fine-tuning alters the underlying capabilities learned by a model during pretraining: does fine-tuning yield entirely novel capabilities or does it just modulate existing ones? We address this question empirically in synthetic, controlled settings where we can use mechanistic interpretability tools (e.g., network pruning and probing) to understand how the model's underlying capabilities are changing. We perform an extensive analysis of the effects of fine-tuning in these settings, and show that: (i) fine-tuning rarely alters the underlying model capabilities; (ii) a minimal transformation, which we call a `wrapper', is typically learned on top of the underlying model capabilities, creating the illusion that they have been modified; and (iii) further fine-tuning on a task where such ``wrapped capabilities'' are relevant leads to sample-efficient revival of the capability, i.e., the model begins reusing these capabilities after only a few gradient steps. This indicates that practitioners can unintentionally remove a model's safety wrapper merely by fine-tuning it on a, e.g., superficially unrelated, downstream task. We additionally perform analysis on language models trained on the TinyStories dataset to support our claims in a more realistic setup.",[],[],"['Samyak Jain', 'Robert Kirk', 'Ekdeep Singh Lubana', 'Robert P. Dick', 'Hidenori Tanaka', 'Tim Rocktäschel', 'Edward Grefenstette', 'David Krueger']","['Research, Microsoft', 'UK AI Safety Institute', 'Center for Brain Science, Harvard University, Harvard University', 'Electrical Engineering and Computer Science, University of Michigan', 'Harvard University, Harvard University', 'Google DeepMind', 'Google DeepMind', 'Montreal Institute for Learning Algorithms, University of Montreal, Université de Montréal']","['United States', 'United Kingdom', 'United States', 'United States', 'United States', 'United States', 'United States', 'Canada']"
https://openreview.net/forum?id=pOoKI3ouv1,Transparency & Explainability,Robust agents learn causal world models,"It has long been hypothesised that causal reasoning plays a fundamental role in robust and general intelligence. However, it is not known if agents must learn causal models in order to generalise to new domains, or if other inductive biases are sufficient. We answer this question, showing that any agent capable of satisfying a regret bound for a large set of distributional shifts must have learned an approximate causal model of the data generating process, which converges to the true causal model for optimal agents. We discuss the implications of this result for several research areas including transfer learning and causal inference.",[],[],"['Jonathan Richens', 'Tom Everitt']","['DeepMind', 'DeepMind']","['United States', 'United States']"
https://openreview.net/forum?id=fDaLmkdSKU,Security,Near-Optimal Solutions of Constrained Learning Problems,"With the widespread adoption of machine learning systems, the need to curtail their behavior has become increasingly apparent. This is evidenced by recent advancements towards developing models that satisfy robustness, safety, and fairness requirements. These requirements can be imposed (with generalization guarantees) by formulating constrained learning problems that can then be tackled by dual ascent algorithms. Yet, though these algorithms converge in objective value, even in non-convex settings, they cannot guarantee that their outcome is feasible. Doing so requires randomizing over all iterates, which is impractical in virtually any modern applications. Still, final iterates have been observed to perform well in practice. In this work, we address this gap between theory and practice by characterizing the constraint violation of Lagrangian minimizers associated with optimal dual variables, despite lack of convexity. To do this, we leverage the fact that non-convex, finite-dimensional constrained learning problems can be seen as parametrizations of convex, functional problems. Our results show that rich parametrizations effectively mitigate the issue of feasibility in dual methods, shedding light on prior empirical successes of dual learning. We illustrate our findings in fair learning tasks.",[],[],"['Juan Elenter', 'Luiz F. O. Chamon', 'Alejandro Ribeiro']","['University of Pennsylvania', 'Applied Mathematics, École Polytechnique', 'University of Pennsylvania']","['United States', 'United States', 'United States']"
https://openreview.net/forum?id=ixP76Y33y1,Security,The Effect of Intrinsic Dataset Properties on Generalization: Unraveling Learning Differences Between Natural and Medical Images,"This paper investigates discrepancies in how neural networks learn from different imaging domains, which are commonly overlooked when adopting computer vision techniques from the domain of natural images to other specialized domains such as medical images. Recent works have found that the generalization error of a trained network typically increases with the intrinsic dimension ($d_{data}$) of its training set. Yet, the steepness of this relationship varies significantly between medical (radiological) and natural imaging domains, with no existing theoretical explanation. We address this gap in knowledge by establishing and empirically validating a generalization scaling law with respect to $d_{data}$, and propose that the substantial scaling discrepancy between the two considered domains may be at least partially attributed to the higher intrinsic ``label sharpness'' ($K_\mathcal{F}$) of medical imaging datasets, a metric which we propose. Next, we demonstrate an additional benefit of measuring the label sharpness of a training set: it is negatively correlated with the trained model's adversarial robustness, which notably leads to models for medical images having a substantially higher vulnerability to adversarial attack. Finally, we extend our $d_{data}$ formalism to the related metric of learned representation intrinsic dimension ($d_{repr}$), derive a generalization scaling law with respect to $d_{repr}$, and show that $d_{data}$ serves as an upper bound for $d_{repr}$. Our theoretical results are supported by thorough experiments with six models and eleven natural and medical imaging datasets over a range of training set sizes. Our findings offer insights into the influence of intrinsic dataset properties on generalization, representation learning, and robustness in deep neural networks. *Code link: https://github.com/mazurowski-lab/intrinsic-properties*",[],[],"['Nicholas Konz', 'Maciej A Mazurowski']","['Duke University', 'Radiology/Biostatistics&Bioinformatics, Duke University']","['United States', 'United States']"
https://openreview.net/forum?id=i2Phucne30,Fairness & Bias,On Bias-Variance Alignment in Deep Models,"Classical wisdom in machine learning holds that the generalization error can be decomposed into bias and variance, and these two terms exhibit a \emph{trade-off}. However, in this paper, we show that for an ensemble of deep learning based classification models, bias and variance are \emph{aligned} at a sample level, where squared bias is approximately \emph{equal} to variance for correctly classified sample points. We present empirical evidence confirming this phenomenon in a variety of deep learning models and datasets. Moreover, we study this phenomenon from two theoretical perspectives: calibration and neural collapse. We first show theoretically that under the assumption that the models are well calibrated, we can observe the bias-variance alignment. Second, starting from the picture provided by the neural collapse theory, we show an approximate correlation between bias and variance.",[],[],"['Lin Chen', 'Michal Lukasik', 'Wittawat Jitkrittum', 'Chong You', 'Sanjiv Kumar']","['', 'Google Research', 'Google Research', 'Google', 'Google']","['', 'United States', 'United States', 'United States', 'United States']"
https://openreview.net/forum?id=GEcwtMk1uA,Security,Identifying the Risks of LM Agents with an LM-Emulated Sandbox,"Recent advances in Language Model (LM) agents and tool use, exemplified by applications like ChatGPT Plugins, enable a rich set of capabilities but also amplify potential risks—such as leaking private data or causing financial losses. Identifying these risks is labor-intensive, necessitating implementing the tools, setting up the environment for each test scenario manually, and finding risky cases. As tools and agents become more complex, the high cost of testing these agents will make it increasingly difficult to find high-stakes, long-tail risks. To address these challenges, we introduce ToolEmu: a framework that uses an LM to emulate tool execution and enables scalable testing of LM agents against a diverse range of tools and scenarios. Alongside the emulator, we develop an LM-based automatic safety evaluator that examines agent failures and quantifies associated risks. We test both the tool emulator and evaluator through human evaluation and find that 68.8% of failures identified with ToolEmu would be valid real-world agent failures. Using our curated initial benchmark consisting of 36 high-stakes toolkits and 144 test cases, we provide a quantitative risk analysis of current LM agents and identify numerous failures with potentially severe outcomes. Notably, even the safest LM agent exhibits such failures 23.9% of the time according to our evaluator, underscoring the need to develop safer LM agents for real-world deployment.",[],[],"['Yangjun Ruan', 'Honghua Dong', 'Andrew Wang', 'Silviu Pitis', 'Yongchao Zhou', 'Jimmy Ba', 'Yann Dubois', 'Chris J. Maddison', 'Tatsunori Hashimoto']","['Computer Science, Stanford University', 'Department of Computer Science, University of Toronto', 'University of Toronto', 'University of Toronto', 'University of Toronto', 'Department of Computer Science, University of Toronto', 'OpenAI', 'Department of Computer Science, University of Toronto', 'Stanford University']","['Canada', 'Canada', 'Canada', 'Canada', 'Canada', 'Canada', 'Canada', 'Canada', 'Canada']"
