link,category,title,abstract,keywords,ccs_concepts,author_names,author_affiliations,author_countries
https://openreview.net/forum?id=VLFhbOCz5D,Privacy & Data Governance,"Tangent Transformers for Composition,Privacy and Removal","We introduce Tangent Attention Fine-Tuning (TAFT), a method for fine-tuning linearized transformers obtained by computing a First-order Taylor Expansion around a pre-trained initialization. We show that the Jacobian-Vector Product resulting from linearization can be computed efficiently in a single forward pass, reducing training and inference cost to the same order of magnitude as its original non-linear counterpart, while using the same number of parameters. Furthermore, we show that, when applied to various downstream visual classification tasks, the resulting Tangent Transformer fine-tuned with TAFT can perform comparably with fine-tuning the original non-linear network. Since Tangent Transformers are linear with respect to the new set of weights, and the resulting fine-tuning loss is convex, we show that TAFT enjoys several advantages compared to non-linear fine-tuning when it comes to model composition, parallel training, machine unlearning, and differential privacy. Our code is available at: https://github.com/tianyu139/tangent-model-composition",[],[],"['Tian Yu Liu', 'Aditya Golatkar', 'Stefano Soatto']","['', 'Amazon', 'Amazon Web Services']","['', 'United States', 'United States']"
https://openreview.net/forum?id=MO5PiKHELW,Transparency & Explainability,"Sudden Drops in the Loss: Syntax Acquisition, Phase Transitions, and Simplicity Bias in MLMs","Most interpretability research in NLP focuses on understanding the behavior and features of a fully trained model. However, certain insights into model behavior may only be accessible by observing the trajectory of the training process. We present a case study of syntax acquisition in masked language models (MLMs) that demonstrates how analyzing the evolution of interpretable artifacts throughout training deepens our understanding of emergent behavior. In particular, we study Syntactic Attention Structure (SAS), a naturally emerging property of MLMs wherein specific Transformer heads tend to focus on specific syntactic relations. We identify a brief window in pretraining when models abruptly acquire SAS, concurrent with a steep drop in loss. This breakthrough precipitates the subsequent acquisition of linguistic capabilities. We then examine the causal role of SAS by manipulating SAS during training, and demonstrate that SAS is necessary for the development of grammatical capabilities. We further find that SAS competes with other beneficial traits during training, and that briefly suppressing SAS improves model quality. These findings offer an interpretation of a real-world example of both simplicity bias and breakthrough training dynamics.",[],[],"['Angelica Chen', 'Ravid Shwartz-Ziv', 'Kyunghyun Cho', 'Matthew L Leavitt', 'Naomi Saphra']","['Center for Data Science, New York University', 'New York University', 'Genentech', 'Facebook', 'Harvard University']","['United States', 'United States', '', 'United States', 'United States']"
https://openreview.net/forum?id=9ROuKblmi7,Privacy & Data Governance,NECO: NEural Collapse Based Out-of-distribution detection,"Detecting out-of-distribution (OOD) data is a critical challenge in machine learning due to model overconfidence, often without awareness of their epistemological limits. We hypothesize that ""neural collapse"", a phenomenon affecting in-distribution data for models trained beyond loss convergence, also influences OOD data. To benefit from this interplay, we introduce NECO, a novel post-hoc method for OOD detection, which leverages the geometric properties of “neural collapse” and of principal component spaces to identify OOD data. Our extensive experiments demonstrate that NECO achieves state-of-the-art results on both small and large-scale OOD detection tasks while exhibiting strong generalization capabilities across different network architectures. Furthermore, we provide a theoretical explanation for the effectiveness of our method in OOD detection. We plan to release the code after the anonymity period.",[],[],"['Mouïn Ben Ammar', 'Nacim Belkhir', 'Sebastian Popescu', 'Antoine Manzanera', 'Gianni Franchi']","['ENSTA Paris', 'Safran', 'Find&Order', ""Unité d'Informatique et d'Ingénierie des Systèmes, Ecole Nationale Supérieure de Techniques Avancées"", 'ENSTA Paris']","['United States', '', '', 'United States', 'United States']"
https://openreview.net/forum?id=ycv2z8TYur,Fairness & Bias,EmerNeRF: Emergent Spatial-Temporal Scene Decomposition via Self-Supervision,"We present EmerNeRF, a simple yet powerful approach for learning spatial-temporal representations of dynamic driving scenes. Grounded in neural fields, EmerNeRF simultaneously captures scene geometry, appearance, motion, and semantics via self-bootstrapping. EmerNeRF hinges upon two core components: First, it stratifies scenes into static and dynamic fields. This decomposition emerges purely from self-supervision, enabling our model to learn from general, in-the-wild data sources. Second, EmerNeRF parameterizes an induced flow field from the dynamic field and uses this flow field to further aggregate multi-frame features, amplifying the rendering precision of dynamic objects. Coupling these three fields (static, dynamic, and flow) enables EmerNeRF to represent highly-dynamic scenes self-sufficiently, without relying on ground truth object annotations or pre-trained models for dynamic object segmentation or optical flow estimation. Our method achieves state-of-the-art performance in sensor simulation, significantly outperforming previous methods when reconstructing static (+2.93 PSNR) and dynamic (+3.70 PSNR) scenes. In addition, to bolster EmerNeRF's semantic generalization, we lift 2D visual foundation model features into 4D space-time and address a general positional bias in modern Transformers, significantly boosting 3D perception performance (e.g., 37.50% relative improvement in occupancy prediction accuracy on average). Finally, we construct a diverse and challenging 120-sequence dataset to benchmark neural fields under extreme and highly-dynamic settings. See the project page for code, data, and request pre-trained models: https://emernerf.github.io",[],[],"['Jiawei Yang', 'Boris Ivanovic', 'Or Litany', 'Xinshuo Weng', 'Seung Wook Kim', 'Boyi Li', 'Tong Che', 'Danfei Xu', 'Sanja Fidler', 'Marco Pavone', 'Yue Wang']","['Computer Science, University of Southern California', 'NVIDIA Research, NVIDIA', 'Computer Science, Technion - Israel Institute of Technology, Technion', 'NVIDIA', 'NVIDIA', 'NVIDIA Research', 'NVIDIA', 'School of Interactive Computing, Georgia Institute of Technology', 'Department of Computer Science, University of Toronto', 'NVIDIA', 'Computer Science, University of Southern California']","['United States', 'United States', 'Israel', 'United States', 'United States', 'United States', 'United States', 'United States', 'Canada', 'United States', 'United States']"
https://openreview.net/forum?id=ShQrnAsbPI,Fairness & Bias,Accurate Forgetting for Heterogeneous Federated Continual Learning,"Recent years have witnessed a burgeoning interest in federated learning (FL). However, the contexts in which clients engage in sequential learning remain under- explored. Bridging FL and continual learning (CL) gives rise to a challenging practical problem: federated continual learning (FCL). Existing research in FCL primarily focuses on mitigating the catastrophic forgetting issue of continual learning while collaborating with other clients. We argue that forgetting phenomena are not invariably detrimental. In this paper, we consider a more practical and challenging FCL setting characterized by potentially unrelated or even antagonistic data/tasks across different clients. In the FL scenario, statistical heterogeneity and data noise among clients may exhibit spurious correlations which result in biased feature learning. While existing CL strategies focus on the complete utilization of previous knowledge, we found that forgetting biased information was beneficial in our study. Therefore, we propose a new concept accurate forgetting (AF) and develop a novel generative-replay method AF-FCL that selectively utilizes previous knowledge in federated networks. We employ a probabilistic framework based on a normalizing flow model to quantify the credibility of previous knowledge. Comprehensive experiments affirm the superiority of our method over baselines.",[],[],"['Abudukelimu Wuerkaixi', 'Sen Cui', 'Jingfeng Zhang', 'Kunda Yan', 'Bo Han', 'Gang Niu', 'Lei Fang', 'Changshui Zhang', 'Masashi Sugiyama']","['Department of Automation, Tsinghua University, Beijing', 'Automation, Tsinghua University, Tsinghua University', 'AIP, RIKEN', 'Auto, Tsinghua University, Tsinghua University', 'Department of Computer Science, HKBU', 'RIKEN', 'Tsinghua University, Tsinghua University', 'Tsinghua University, Tsinghua University', 'Center for Advanced Intelligence Project, RIKEN']","['China', 'China', 'China', 'China', 'China', 'China', 'China', 'China', 'China']"
https://openreview.net/forum?id=lsvlvWB9vz,Fairness & Bias,EControl: Fast Distributed Optimization with Compression and Error Control,"Modern distributed training relies heavily on communication compression to reduce the communication overhead. In this work, we study algorithms employing a popular class of contractive compressors in order to reduce communication overhead. However, the naive implementation often leads to unstable convergence or even exponential divergence due to the compression bias. Error Compensation (EC) is an extremely popular mechanism to mitigate the aforementioned issues during the training of models enhanced by contractive compression operators. Compared to the effectiveness of EC in the data homogeneous regime, the understanding of the practicality and theoretical foundations of EC in the data heterogeneous regime is limited. Existing convergence analyses typically rely on strong assumptions such as bounded gradients, bounded data heterogeneity, or large batch accesses, which are often infeasible in modern Machine Learning Applications. We resolve the majority of current issues by proposing EControl, a novel mechanism that can regulate error compensation by controlling the strength of the feedback signal. We prove fast convergence for EControl in standard strongly convex, general convex, and nonconvex settings without any additional assumptions on the problem or data heterogeneity. We conduct extensive numerical evaluations to illustrate the efficacy of our method and support our theoretical findings.",[],[],"['Yuan Gao', 'Rustem Islamov', 'Sebastian U Stich']","['CISPA, saarland university, saarland informatics campus', 'Department of Mathematics and Informatics, University of Basel', 'CISPA Helmholtz Center for Information Security']","['Germany', 'Germany', 'Germany']"
https://openreview.net/forum?id=7erlRDoaV8,Security,Can Sensitive Information Be Deleted From LLMs? Objectives for Defending Against Extraction Attacks,"Pretrained language models sometimes possess knowledge that we do not wish them to, including memorized personal information and knowledge that could be used to harm people. They can also output toxic or harmful text. To mitigate these safety and informational issues, we propose an attack-and-defense framework for studying the task of deleting sensitive information directly from model weights. We study direct edits to model weights because (1) this approach should guarantee that particular deleted information is never extracted by future prompt attacks, and (2) it should protect against whitebox attacks, which is necessary for making claims about safety/privacy in a setting where publicly available model weights could be used to elicit sensitive information. Our threat model assumes that an attack succeeds if the answer to a sensitive question is located among a set of B generated candidates, based on scenarios where the information would be insecure if the answer is among B candidates. Experimentally, we show that even state-of-the-art model editing methods such as ROME struggle to truly delete factual information from models like GPT-J, as our whitebox and blackbox attacks can recover “deleted” information from an edited model 38% of the time. These attacks leverage two key observations: (1) that traces of deleted information can be found in intermediate model hidden states, and (2) that applying an editing method for one question may not delete information across rephrased versions of the question. Finally, we provide new defense methods that protect against some extraction attacks, but we do not find a single universally effective defense method. Our results suggest that truly deleting sensitive information is a tractable but difficult problem, since even relatively low attack success rates have potentially severe implications for the deployment of language models in a world where individuals enjoy ownership of their personal data, a right to privacy, and safety from harmful model outputs.",[],[],"['Vaidehi Patil', 'Peter Hase', 'Mohit Bansal']","['Department of Computer Science, Department of Computer Science, University of North Carolina at Chapel Hill', '', 'University of North Carolina at Chapel Hill']","['United States', '', 'United States']"
https://openreview.net/forum?id=8EyRkd3Qj2,Privacy & Data Governance,CLAP: Collaborative Adaptation for Patchwork Learning,"In this paper, we investigate a new practical learning scenario, where the data distributed in different sources/clients are typically generated with various modalities. Existing research on learning from multi-source data mostly assume that each client owns the data of all modalities, which may largely limit its practicability. In light of the expensiveness and sparsity of multimodal data, we propose patchwork learning to jointly learn from fragmented multimodal data in distributed clients. Considering the concerns on data privacy, patchwork learning aims to impute incomplete multimodal data for diverse downstream tasks without accessing the raw data directly. Local clients could miss different modality combinations. Due to the statistical heterogeneity induced by non-i.i.d. data, the imputation is more challenging since the learned dependencies fail to adapt to the imputation of other clients. In this paper, we provide a novel imputation framework to tackle modality combination heterogeneity and statistical heterogeneity simultaneously, called ``collaborative adaptation''. In particular, for two observed modality combinations from two clients, we learn the transformations between their maximal intersection and other modalities by proposing a novel ELBO. We improve the worst-performing required transformations through a Pareto min-max optimization framework. In extensive experiments, we demonstrate the superiority of the proposed method compared to existing related methods on benchmark data sets and a real-world clinical data set.",[],[],"['Sen Cui', 'Abudukelimu Wuerkaixi', 'Weishen Pan', 'Jian Liang', 'Lei Fang', 'Changshui Zhang', 'Fei Wang']","['Automation, Tsinghua University, Tsinghua University', 'Department of Automation, Tsinghua University, Beijing', 'Weill Cornell Medicine, Cornell University', 'Kuaishou Technology', 'Tsinghua University, Tsinghua University', 'Tsinghua University, Tsinghua University', 'Population Health Sciences, Cornell University']","['China', 'China', 'China', 'China', 'China', 'China', 'China']"
https://openreview.net/forum?id=vEfmVS5ywF,Fairness & Bias,Learning in reverse causal strategic environments with ramifications on two sided markets,"Motivated by equilibrium models of labor markets, we develop a formulation of causal strategic classification in which strategic agents can directly manipulate their outcomes. As an application, we consider employers that seek to anticipate the strategic response of a labor force when developing a hiring policy. We show theoretically that employers with performatively optimal hiring policies improve employer reward, labor force skill level, and labor force equity (compared to employers that do not anticipate the strategic labor force response) in the classic Coate-Loury labor market model. Empirically, we show that these desirable properties of performative hiring policies do generalize to our own formulation of a general equilibrium labor market. On the other hand, we also observe that the benefits of performatively optimal hiring policies are brittle in some aspects. We demonstrate that in our formulation a performative employer both harms workers by reducing their aggregate welfare and fails to prevent discrimination when more sophisticated wage and cost structures are introduced.",[],[],"['Seamus Somerstep', 'Yuekai Sun', 'Yaacov Ritov']","['University of Michigan - Ann Arbor', 'University of Michigan', 'Statiscs, University of Michigan - Ann Arbor']","['United States', 'United States', 'United States']"
https://openreview.net/forum?id=EWTFMkTdkT,Fairness & Bias,Invariance-based Learning of Latent Dynamics,"We propose a new model class aimed at predicting dynamical trajectories from high-dimensional empirical data. This is done by combining variational autoencoders and (spatio-)temporal transformers within a  framework designed to enforce certain scientifically-motivated invariances. The models allow inference of system behavior at any continuous time and generalization well beyond the data distributions seen during training. Furthermore, the models do not require an explicit neural ODE formulation, making them efficient and highly scalable in practice. We study  behavior through simple theoretical analyses and  extensive empirical experiments. The latter investigate  the ability to predict the trajectories of complicated  systems based on finite data and show that the proposed approaches can outperform existing neural-dynamical models. We study also more general inductive bias in the context of transfer to data obtained under entirely novel system interventions. Overall, our results provide a new framework for efficiently learning complicated dynamics in a data-driven manner, with potential applications in a wide range of fields including physics, biology, and engineering.",[],[],"['Kai Lagemann', 'Christian Lagemann', 'Sach Mukherjee']","['DZNE', 'Rheinisch Westfälische Technische Hochschule Aachen', '']","['Germany', 'Germany', '']"
https://openreview.net/forum?id=XEFWBxi075,Fairness & Bias,GRANDE: Gradient-Based Decision Tree Ensembles for Tabular Data,"Despite the success of deep learning for text and image data, tree-based ensemble models are still state-of-the-art for machine learning with heterogeneous tabular data. However, there is a significant need for tabular-specific gradient-based methods due to their high flexibility. In this paper, we propose $\text{GRANDE}$, $\text{GRA}$die$\text{N}$t-Based $\text{D}$ecision Tree $\text{E}$nsembles, a novel approach for learning hard, axis-aligned decision tree ensembles using end-to-end gradient descent. GRANDE is based on a dense representation of tree ensembles, which affords to use backpropagation with a straight-through operator to jointly optimize all model parameters. Our method combines axis-aligned splits, which is a useful inductive bias for tabular data, with the flexibility of gradient-based optimization. Furthermore, we introduce an advanced instance-wise weighting that facilitates learning representations for both, simple and complex relations, within a single model. We conducted an extensive evaluation on a predefined benchmark with 19 classification datasets and demonstrate that our method outperforms existing gradient-boosting and deep learning frameworks on most datasets. The method is available under: https://github.com/s-marton/GRANDE",[],[],"['Sascha Marton', 'Stefan Lüdtke', 'Christian Bartelt', 'Heiner Stuckenschmidt']","['Technische Universität Clausthal', '', 'Institute for Software and Systems Engineering, Technische Universität Clausthal', 'University of Mannheim']","['Germany', '', 'Germany', 'Germany']"
https://openreview.net/forum?id=oZtt0pRnOl,Privacy & Data Governance,Privacy-Preserving In-Context Learning with Differentially Private Few-Shot Generation,"We study the problem of in-context learning (ICL) with large language models (LLMs) on private datasets.  This scenario poses privacy risks, as LLMs may leak or regurgitate the private examples demonstrated in the prompt. We propose a novel algorithm that generates synthetic few-shot demonstrations from the private dataset with formal differential privacy (DP) guarantees, and show empirically that it can achieve effective ICL. We conduct extensive experiments on standard benchmarks and compare our algorithm with non-private ICL and zero-shot solutions.  Our results demonstrate that our algorithm can achieve competitive performance with strong privacy levels. These results open up new possibilities for ICL with privacy protection for a broad range of applications.",[],[],"['Xinyu Tang', 'Richard Shin', 'Huseyin A Inan', 'Andre Manoel', 'Fatemehsadat Mireshghallah', 'Zinan Lin', 'Sivakanth Gopi', 'Janardhan Kulkarni', 'Robert Sim']","['Apple', 'Google', 'Microsoft', 'Gretel.ai', 'University of Washington', 'Microsoft', 'Microsoft Research', 'Microsoft Research, Redmond', 'Microsoft']","['United States', 'United States', 'United States', 'United States', 'United States', 'United States', 'United States', 'United States', '']"
https://openreview.net/forum?id=cuAxSHcsSX,Privacy & Data Governance,On Differentially Private Federated Linear Contextual Bandits,"We consider cross-silo federated linear contextual bandit (LCB) problem under differential privacy, where multiple silos interact with their respective local users and communicate via a central server to realize collaboration without sacrificing each user's privacy. We identify three issues in the state-of-the-art~\citep{dubey2020differentially}: (i) failure of claimed privacy protection, (ii) incorrect regret bound due to noise miscalculation and (iii) ungrounded communication cost.  To resolve these issues, we take a two-step approach. First, we design an algorithmic framework consisting of a generic federated LCB algorithm and flexible privacy protocols. Then, leveraging the proposed framework, we study federated LCBs under two different privacy constraints. We first establish privacy and regret guarantees under silo-level local differential privacy, which fix the issues present in state-of-the-art algorithm. To further improve the regret performance, we next consider shuffle model of differential privacy, under which we show that our algorithm can achieve nearly ``optimal'' regret without a trusted server.  We accomplish this via two different schemes --  one relies on a new result on privacy amplification via shuffling for DP mechanisms and another one leverages the integration of a shuffle protocol for vector sum into the tree-based mechanism, both of which might be of independent interest. Finally, we support our theoretical results with numerical evaluations over contextual bandit instances generated from both synthetic and real-life data.",[],[],"['Xingyu Zhou', 'Sayak Ray Chowdhury']","['ECE, Wayne State University', 'Indian Institute of Technology, Kanpur']","['United States', 'India']"
https://openreview.net/forum?id=7wY67ZDQTE,Transparency & Explainability,Cauchy-Schwarz Divergence Information Bottleneck for Regression,"The information bottleneck (IB) approach is popular to improve the generalization, robustness and explainability of deep neural networks. Essentially, it aims to find a minimum sufficient representation $\mathbf{t}$ by striking a trade-off between a compression term $I(\mathbf{x};\mathbf{t})$ and a prediction term $I(y;\mathbf{t})$, where $I(\cdot;\cdot)$ refers to the mutual information (MI). MI is for the IB for the most part expressed in terms of the Kullback-Leibler (KL) divergence, which in the regression case corresponds to prediction based on mean squared error (MSE) loss with Gaussian assumption and compression approximated by variational inference.  In this paper, we study the IB principle for the regression problem and develop a new way to parameterize the IB with deep neural networks by exploiting favorable properties of the Cauchy-Schwarz (CS) divergence. By doing so, we move away from MSE-based regression and ease estimation by avoiding variational approximations or distributional assumptions. We investigate the improved generalization ability of our proposed CS-IB and demonstrate strong adversarial robustness guarantees. We demonstrate its superior performance on six real-world regression tasks over other popular deep IB approaches. We additionally observe that the solutions discovered by CS-IB always achieve the best trade-off between prediction accuracy and compression ratio in the information plane. The code is available at \url{https://github.com/SJYuCNEL/Cauchy-Schwarz-Information-Bottleneck}.",[],[],"['Shujian Yu', 'Xi Yu', 'Sigurd Løkse', 'Robert Jenssen', 'Jose C Principe']","['Vrije Universiteit Amsterdam', 'Computational Science Initiative, Brookhaven National Laboratory', 'NORCE Norwegian Research Centre', 'Dept. Physics and Technology, UiT The Arctic University of Norway', 'University of Florida']","['Netherlands', 'United States', '', 'Norway', 'United States']"
