link,category,title,abstract,keywords,ccs_concepts,author_names,author_affiliations,author_countries
https://openreview.net/forum?id=uNkKaD3MCs,Fairness & Bias,Learning with Mixture of Prototypes for Out-of-Distribution Detection,"Out-of-distribution (OOD) detection aims to detect testing samples far away from the in-distribution (ID) training data, which is crucial for the safe deployment of machine learning models in the real world. Distance-based OOD detection methods have emerged with enhanced deep representation learning. They identify unseen OOD samples by measuring their distances from ID class centroids or prototypes. However, existing approaches learn the representation relying on oversimplified data assumptions, e.g. modeling ID data of each class with one centroid class prototype or using loss functions not designed for OOD detection, which overlook the natural diversities within the data. Naively enforcing data samples of each class to be compact around only one prototype leads to inadequate modeling of realistic data and limited performance. To tackle these issues, we propose PrototypicAl Learning with a Mixture of prototypes (PALM) that models each class with multiple prototypes to capture the sample diversities, which learns more faithful and compact samples embeddings for enhanching OOD detection. Our method automatically identifies and dynamically updates prototypes, assigning each sample to a subset of prototypes via reciprocal neighbor soft assignment weights. To learn embeddings with multiple prototypes, PALM optimizes a maximum likelihood estimation (MLE) loss to encourage the sample embeddings to compact around the associated prototypes, as well as a contrastive loss on all prototypes to enhance intra-class compactness and inter-class discrimination at the prototype level. Compared to previous methods with prototypes, the proposed mixture prototype modeling of PALM promotes the representations of each ID class to be more compact and separable from others and the unseen OOD samples, resulting in more reliable OOD detection. Moreover, the automatic estimation of prototypes enables our approach to be extended to the challenging OOD detection task with unlabelled ID data. Extensive experiments demonstrate the superiority of PALM over previous methods, achieving state-of-the-art average AUROC performance of 93.82 on the challenging CIFAR-100 benchmark.",[],[],"['Haodong Lu', 'Dong Gong', 'Shuo Wang', 'Jason Xue', 'Lina Yao', 'Kristen Moore']","['', 'University of New South Wales', 'Shanghai Jiao Tong University', '', 'University of New South Wales', ""Data61, CSIRO's Data61""]","['', 'Australia', 'China', '', 'Australia', 'China']"
https://openreview.net/forum?id=RzY9qQHUXy,Fairness & Bias,Kill Two Birds with One Stone: Rethinking Data Augmentation for Deep Long-tailed Learning,"Real-world tasks are universally associated with training samples that exhibit a long-tailed class distribution, and traditional deep learning models are not suitable for fitting this distribution, thus resulting in a biased trained model. To surmount this dilemma, massive deep long-tailed learning studies have been proposed to achieve inter-class fairness models by designing sophisticated sampling strategies or improving existing model structures and loss functions. Habitually, these studies tend to apply data augmentation strategies to improve the generalization performance of their models. However, this augmentation strategy applied to balanced distributions may not be the best option for long-tailed distributions. For a profound understanding of data augmentation, we first theoretically analyze the gains of traditional augmentation strategies in long-tailed learning, and observe that augmentation methods cause the long-tailed distribution to be imbalanced again, resulting in an intertwined imbalance: inherent data-wise imbalance and extrinsic augmentation-wise imbalance, i.e., two 'birds' co-exist in long-tailed learning. Motivated by this observation, we propose an adaptive Dynamic Optional Data Augmentation (DODA) to address this intertwined imbalance, i.e., one 'stone' simultaneously 'kills' two 'birds', which allows each class to choose appropriate augmentation methods by maintaining a corresponding augmentation probability distribution for each class during training. Extensive experiments across mainstream long-tailed recognition benchmarks (e.g., CIFAR-100-LT, ImageNet-LT, and iNaturalist 2018) prove the effectiveness and flexibility of the DODA in overcoming the intertwined imbalance.",[],[],"['Binwu Wang', 'Pengkun Wang', 'Wei Xu', 'Xu Wang', 'Yudong Zhang', 'Kun Wang', 'Yang Wang']","['University of Science and Technology of China', 'University of Science and Technology of China', 'University of Science and Technology of China', 'Suzhou Institute for Advanced Research, University of Science and Technology of China', 'University of Science and Technology of China', 'Nanyang Technological University', 'University of Science and Technology of China']","['China', 'China', 'China', 'China', 'China', 'China', 'China']"
https://openreview.net/forum?id=XJ9vjEAqbx,Security,Adversarial Training Should Be Cast as a Non-Zero-Sum Game,"One prominent approach toward resolving the adversarial vulnerability of deep neural networks is the two-player zero-sum paradigm of adversarial training, in which predictors are trained against adversarially chosen perturbations of data. Despite the promise of this approach, algorithms based on this paradigm have not engendered sufficient levels of robustness and suffer from pathological behavior like robust overfitting. To understand this shortcoming, we first show that the commonly used surrogate-based relaxation used in adversarial training algorithms voids all guarantees on the robustness of trained classifiers.  The identification of this pitfall informs a novel non-zero-sum bilevel formulation of adversarial training, wherein each player optimizes a different objective function. Our formulation yields a simple algorithmic framework that matches and in some cases outperforms state-of-the-art attacks, attains comparable levels of robustness to standard adversarial training algorithms, and does not suffer from robust overfitting.",[],[],"['Alexander Robey', 'Fabian Latorre', 'George J. Pappas', 'Hamed Hassani', 'Volkan Cevher']","['Machine Learning, CMU, Carnegie Mellon University', 'Swiss Federal Institute of Technology Lausanne', 'Electrical and Systems Engineering, School of Engineering and Applied Science, University of Pennsylvania', 'University of Pennsylvania', 'EPFL - EPF Lausanne']","['United States', '', 'United States', 'United States', 'United States']"
https://openreview.net/forum?id=hOMVq57Ce0,Transparency & Explainability,Piecewise Linear Parametrization of Policies: Towards Interpretable Deep Reinforcement Learning,"Learning inherently interpretable policies is a central challenge in the path to developing autonomous agents that humans can trust. Linear policies can justify their decisions while interacting in a dynamic environment, but their reduced expressivity prevents them from solving hard tasks. Instead, we argue for the use of piecewise-linear policies. We carefully study to what extent they can retain the interpretable properties of linear policies while reaching competitive performance with neural baselines. In particular, we propose the HyperCombinator (HC), a piecewise-linear neural architecture expressing a policy with a controllably small number of sub-policies. Each sub-policy is linear with respect to interpretable features, shedding light on the decision process of the agent without requiring an additional explanation model. We evaluate HC policies in control and navigation experiments, visualize the improved interpretability of the agent and highlight its trade-off with performance. Moreover, we validate that the restricted model class that the HyperCombinator belongs to is compatible with the algorithmic constraints of various reinforcement learning algorithms.",[],[],"['Maxime Wabartha', 'Joelle Pineau']","['', 'Facebook']","['', 'United States']"
https://openreview.net/forum?id=rzBskAEmoc,Transparency & Explainability,CAMIL: Context-Aware Multiple Instance Learning for Cancer Detection and Subtyping in Whole Slide Images,"The visual examination of tissue biopsy sections is fundamental for cancer diagnosis, with pathologists analyzing sections at multiple magnifications to discern tumor cells and their subtypes. However, existing attention-based multiple instance learning (MIL) models used for analyzing Whole Slide Images (WSIs) in cancer diagnostics often overlook the contextual information of tumor and neighboring tiles, leading to misclassifications. To address this, we propose the Context-Aware Multiple Instance Learning (CAMIL) architecture. CAMIL incorporates neighbor-constrained attention to consider dependencies among tiles within a WSI and integrates contextual constraints as prior knowledge into the MIL model. We evaluated CAMIL on subtyping non-small cell lung cancer (TCGA-NSCLC) and detecting lymph node (CAMELYON16 and CAMELYON17) metastasis, achieving test AUCs of 97.5\%, 95.9\%, and 88.1\%, respectively, outperforming other state-of-the-art methods. Additionally, CAMIL enhances model interpretability by identifying regions of high diagnostic value. Our code is available at https://github.com/olgarithmics/ICLR_CAMIL.",[],[],"['Olga Fourkioti', 'Matt De Vries', 'Chris Bakal']","['The Institute of Cancer Research', 'Cancer Biology, Institute of Cancer Research', 'Cancer Biology, Institute of Cancer Research']","['United States', 'United States', 'United States']"
https://openreview.net/forum?id=AqN23oqraW,Fairness & Bias,KoLA: Carefully Benchmarking World Knowledge of Large Language Models,"The unprecedented performance of large language models (LLMs) necessitates improvements in evaluations. Rather than merely exploring the breadth of LLM abilities, we believe meticulous and thoughtful designs are essential to thorough, unbiased, and applicable evaluations. Given the importance of world knowledge to LLMs, we construct a Knowledge-oriented LLM Assessment benchmark (KoLA), in which we carefully design three crucial factors: (1) For ability modeling, we mimic human cognition to form a four-level taxonomy of knowledge-related abilities, covering 19 tasks. (2) For data, to ensure fair comparisons, we use both Wikipedia, a corpus prevalently pre-trained by LLMs, along with continuously collected emerging corpora, aiming to evaluate the capacity to handle unseen data and evolving knowledge. (3) For evaluation criteria, we adopt a contrastive system, including overall standard scores for better numerical comparability across tasks and models, and a unique self-contrast metric for automatically evaluating knowledge-creating ability. We evaluate 21 open-source and commercial LLMs and obtain some intriguing findings. The KoLA dataset will be updated every three months to provide timely references for developing LLMs and knowledge-related systems.",[],[],"['Jifan Yu', 'Xiaozhi Wang', 'Shangqing Tu', 'Shulin Cao', 'Daniel Zhang-Li', 'Xin Lv', 'Hao Peng', 'Zijun Yao', 'Xiaohan Zhang', 'Hanming Li', 'Chunyang Li', 'Zheyuan Zhang', 'Yushi Bai', 'Yantao Liu', 'Amy Xin', 'Kaifeng Yun', 'Linlu GONG', 'Nianyi Lin', 'Jianhui Chen', 'Zhili Wu', 'Yunjia Qi', 'Weikai Li', 'Yong Guan', 'Kaisheng Zeng', 'Ji Qi', 'Hailong Jin', 'Jinxin Liu', 'Yu Gu', 'Yuan Yao', 'Ning Ding', 'Lei Hou', 'Zhiyuan Liu', 'Xu Bin', 'Jie Tang', 'Juanzi Li']","['Institute of Education, Tsinghua University', 'Department of Computer Science and Technology, Tsinghua University', 'Department of Computer Science and Technology, Tsinghua University', 'Tsinghua University, Tsinghua University', 'Computer Science and Technology, Tsinghua University, Tsinghua University', 'Zhipu AI', 'Tsinghua University, Tsinghua University', 'Department of Computer Science and Technology, Tsinghua University', 'Beijing Knowledge Atlas Technology Co., Ltd.', 'Tsinghua University, Tsinghua University', 'Department of Computer Science and Engineering, Hong Kong University of Science and Technology', 'Department of Computer Science and Technology , Tsinghua University', 'Computer science and technology, Tsinghua University, Tsinghua University', 'University of the Chinese Academy of Sciences', 'DCST, Tsinghua University', 'Tsinghua University, Tsinghua University', 'Department of Computer Science and Technology,, Tsinghua University', 'Tsinghua University, Tsinghua University', 'Computer Science and Technology, Tsinghua University', ', Tsinghua University']","['China', 'China', 'China', 'China', 'China', 'China', 'China', 'China', 'China', 'China', 'China', 'China', 'China', 'China', 'China', 'China', 'China', 'China', 'China', 'China']"
https://openreview.net/forum?id=ARPrtuzAnQ,Fairness & Bias,On the hardness of learning under symmetries,"We study the problem of learning equivariant neural networks via gradient descent. The incorporation of known  symmetries (""equivariance"") into neural nets has empirically improved the performance of learning pipelines, in domains ranging from biology to computer vision. However, a rich yet separate line of learning theoretic research has demonstrated that actually learning shallow, fully-connected (i.e. non-symmetric) networks has exponential complexity in the correlational statistical query (CSQ) model, a framework encompassing gradient descent. In this work, we ask: are known problem symmetries sufficient to alleviate the fundamental hardness of learning neural nets with gradient descent? We answer this question in the negative. In particular, we give lower bounds for shallow graph neural networks, convolutional networks, invariant polynomials, and frame-averaged networks for permutation subgroups, which all scale either superpolynomially or exponentially in the relevant input dimension. Therefore, in spite of the significant inductive bias imparted via symmetry, actually learning the complete classes of functions represented by equivariant neural networks via gradient descent remains hard.",[],[],"['Bobak Kiani', 'Thien Le', 'Hannah Lawrence', 'Stefanie Jegelka', 'Melanie Weber']","['Massachusetts Institute of Technology', 'EECS, Massachusetts Institute of Technology', 'Massachusetts Institute of Technology', 'Computer Science, Technische Universität München', '']","['United States', 'United States', 'United States', 'United States', '']"
https://openreview.net/forum?id=jUWktnsplU,Fairness & Bias,Hybrid Distillation: Connecting Masked Autoencoders with Contrastive Learners,"As two prominent strategies for representation learning, Contrastive Learning (CL) and Masked Image Modeling (MIM) have witnessed significant progress. Previous studies have demonstrated the advantages of each approach in specific scenarios. CL, resembling supervised pre-training, excels at capturing longer-range global patterns and enhancing feature discrimination, while MIM is adept at introducing local and diverse attention across transformer layers. Considering the respective strengths, previous studies utilize feature distillation to inherit both discrimination and diversity. In this paper, we thoroughly examine previous feature distillation methods and observe that the increase in diversity mainly stems from asymmetric designs, which may in turn compromise the discrimination ability. To strike a balance between the two properties, we propose a simple yet effective strategy termed Hybrid Distill, which leverages both the CL and MIM teachers to jointly guide the student model. Hybrid Distill emulates the token relations of the MIM teacher at intermediate layers for diversity, while simultaneously distilling the final features of the CL teacher to enhance discrimination. A progressive redundant token masking strategy is employed to reduce the expenses associated with distillation and aid in preventing the model from converging to local optima. Experimental results demonstrate that Hybrid Distill achieves superior performance on various benchmark datasets.",[],[],"['Bowen Shi', 'XIAOPENG ZHANG', 'Yaoming Wang', 'Jin Li', 'Wenrui Dai', 'Junni Zou', 'Hongkai Xiong', 'Qi Tian']","['Shanghai Jiao Tong University', 'CBG, Huawei Technologies Ltd.', '', 'SEIEE, Shanghai Jiao Tong University', 'Department of Computer Science & Engineering, Shanghai Jiao Tong University', 'Department of Computer Science and Engineering, Shanghai Jiao Tong University', 'Shanghai Jiao Tong University', 'Huawei Technologies Ltd.']","['China', 'China', '', 'China', 'China', 'China', 'China', 'China']"
https://openreview.net/forum?id=8FHWkY0SwF,Fairness & Bias,Learning Personalized Causally Invariant Representations for Heterogeneous Federated Clients,"Personalized federated learning (PFL) has gained great success in tackling the scenarios where target datasets are heterogeneous across the local clients. However, the application of the existing PFL methods to real-world setting is hindered by the common assumption that the test data on each client is in-distribution (IND) with respect to its training data. Due to the bias of training dataset, the modern machine learning model prefers to rely on shortcut which can perform well on the training data but fail to generalize to the unseen test data that is out-of-distribution (OOD). This pervasive phenomenon is called shortcut learning and has attracted plentiful efforts in centralized situations. In PFL, the limited data diversity on federated clients makes mitigating shortcut and meanwhile preserving personalization knowledge rather difficult. In this paper, we analyse this challenging problem by formulating the structural causal models (SCMs) for heterogeneous federated clients. From the proposed SCMs, we derive two significant causal signatures which inspire a provable shortcut discovery and removal method under federated learning, namely FedSDR. Specifically, FedSDR is divided into two steps: 1) utilizing the available training data distributed among local clients to discover all the shortcut features in a collaborative manner. 2) developing the optimal personalized causally invariant predictor for each client by eliminating the discovered shortcut features. We provide theoretical analysis to prove that our method can draw complete shortcut features and produce the optimal personalized invariant predictor that can generalize to unseen OOD data on each client. The experimental results on diverse datasets validate the superiority of FedSDR over the state-of-the-art PFL methods on OOD generalization performance.",[],[],"['Xueyang Tang', 'Song Guo', 'Jie ZHANG', 'Jingcai Guo']","['The Hong Kong Polytechnic University', 'Department of Computer Science and Engineering, Hong Kong University of Science and Technology', 'Computer Science and Engineering, Hong Kong University of Science and Technology', 'Computing, The Hong Kong Polytechnic University']","['Hong Kong', 'Hong Kong', 'Hong Kong', 'Hong Kong']"
https://openreview.net/forum?id=l1U6sEgYkb,Security,DV-3DLane: End-to-end Multi-modal 3D Lane Detection with Dual-view Representation,"Accurate 3D lane estimation is crucial for ensuring safety in autonomous driving. However, prevailing monocular techniques suffer from depth loss and lighting variations, hampering accurate 3D lane detection. In contrast, LiDAR points offer geometric cues and enable precise localization. In this paper, we present DV-3DLane, a novel end-to-end **D**ual-**V**iew multi-modal **3D Lane** detection framework that synergizes the strengths of both images and LiDAR points. We propose to learn multi-modal features in dual-view spaces, *i.e.*, *perspective view* (PV) and *bird's-eye-view* (BEV), effectively leveraging the modal-specific information. To achieve this, we introduce three designs: 1) A bidirectional feature fusion strategy that integrates multi-modal features into each view space, exploiting their unique strengths. 2) A unified query generation approach that leverages lane-aware knowledge from both PV and BEV spaces to generate queries. 3) A 3D dual-view deformable attention mechanism, which aggregates discriminative features from both PV and BEV spaces into queries for accurate 3D lane detection. Extensive experiments on the public benchmark, OpenLane, demonstrate the efficacy and efficiency of DV-3DLane. It achieves state-of-the-art performance, with a remarkable 11.2 gain in F1 score and a substantial 53.5% reduction in errors. Code is available on [github](https://github.com/JMoonr/dv-3dlane).",[],[],"['Yueru Luo', 'Shuguang Cui', 'Zhen Li']","['The Chinese University of Hong Kong', 'School of Science and Engineering, The Chinese University of Hong Kong, Shenzhen', 'ECE, The Chinese University of Hong Kong, Shenzhen']","['Hong Kong', 'Hong Kong', 'Hong Kong']"
https://openreview.net/forum?id=DEJIDCmWOz,Security,On the Reliability of Watermarks for Large Language Models,"As LLMs become commonplace, machine-generated text has the potential to flood the internet with spam, social media bots, and valueless content. _Watermarking_ is a simple and effective strategy for mitigating such harms by enabling the detection and documentation of LLM-generated text. Yet a crucial question remains: How reliable is watermarking in realistic settings in the wild? There, watermarked text may be modified to suit a user's needs, or entirely rewritten to avoid detection. We study the robustness of watermarked text after it is re-written by humans, paraphrased by a non-watermarked LLM, or mixed into a longer hand-written document. We find that watermarks remain detectable even after human and machine paraphrasing. While these attacks dilute the strength of the watermark, paraphrases are statistically likely to leak n-grams or even longer fragments of the original text, resulting in high-confidence detections when enough tokens are observed.  For example, after strong human paraphrasing the watermark is detectable after observing 800 tokens on average, when setting a $1\mathrm{e}{-5}$ false positive rate. We also consider a range of new detection schemes that are sensitive to short spans of watermarked text embedded inside a large document, and we compare the robustness of watermarking to other kinds of detectors.",[],[],"['John Kirchenbauer', 'Jonas Geiping', 'Yuxin Wen', 'Manli Shu', 'Khalid Saifullah', 'Kezhi Kong', 'Kasun Fernando', 'Aniruddha Saha', 'Micah Goldblum', 'Tom Goldstein']","['University of Maryland, College Park', 'ELLIS Institute Tübingen', 'Department of Computer Science, University of Maryland, College Park', 'Salesforce Research', 'CS, University of Maryland, College Park', 'University of Maryland, College Park', 'Scuola Normale Superiore', 'University of Maryland, College Park', 'Electrical Engineering, Columbia University', 'Computer Science, University of Maryland, College Park']","['United States', 'United States', 'United States', 'United States', 'United States', 'United States', 'United States', 'United States', 'United States', 'United States']"
https://openreview.net/forum?id=6p8lpe4MNf,Security,A Semantic Invariant Robust Watermark for Large Language Models,"Watermark algorithms for large language models (LLMs) have achieved extremely high accuracy in detecting text generated by LLMs. Such algorithms typically involve adding extra watermark logits to the LLM's logits at each generation step. However, prior algorithms face a trade-off between attack robustness and security robustness. This is because the watermark logits for a token are determined by a certain number of preceding tokens; a small number leads to low security robustness, while a large number results in insufficient attack robustness. In this work, we propose a semantic invariant watermarking method for LLMs that provides both attack robustness and security robustness. The watermark logits in our work are determined by the semantics of all preceding tokens. Specifically, we utilize another embedding LLM to generate semantic embeddings for all preceding tokens, and then these semantic embeddings are transformed into the watermark logits through our trained watermark model. Subsequent analyses and experiments demonstrated the attack robustness of our method in semantically invariant settings: synonym substitution and text paraphrasing settings. Finally, we also show that our watermark possesses adequate security robustness.",[],[],"['Aiwei Liu', 'Leyi Pan', 'Xuming Hu', 'Shiao Meng', 'Lijie Wen']","['Tsinghua University', 'School of Software, Tsinghua University', 'AI Thrust, The Hong Kong University of Science and Technology (Guangzhou)', 'School of Software, Tsinghua University', 'School of Software, Tsinghua University']","['China', 'China', 'China', 'China', 'China']"
