link,category,title,abstract,keywords,ccs_concepts,author_names,author_affiliations,author_countries
https://arxiv.org/abs/2203.04286,Transparency & Explainability,Proximal PanNet: A Model-Based Deep Network for Pansharpening.,"Recently, deep learning techniques have been extensively studied for pansharpening, which aims to generate a high resolution multispectral (HRMS) image by fusing a low resolution multispectral (LRMS) image with a high resolution panchromatic (PAN) image. However, existing deep learning-based pansharpening methods directly learn the mapping from LRMS and PAN to HRMS. These network architectures always lack sufficient interpretability, which limits further performance improvements. To alleviate this issue, we propose a novel deep network for pansharpening by combining the model-based methodology with the deep learning method. Firstly, we build an observation model for pansharpening using the convolutional sparse coding (CSC) technique and design a proximal gradient algorithm to solve this model. Secondly, we unfold the iterative algorithm into a deep network, dubbed as Proximal PanNet, by learning the proximal operators using convolutional neural networks. Finally, all the learnable modules can be automatically learned in an end-to-end manner. Experimental results on some benchmark datasets show that our network performs better than other advanced methods both quantitatively and qualitatively.",[],[],"['Xiangyong Cao', 'Yang Chen', 'Wenfei Cao']","['', '', '']",[]
https://arxiv.org/abs/2110.15629,Transparency & Explainability,Attacking Video Recognition Models with Bullet-Screen Comments.,"Recent research has demonstrated that Deep Neural Networks (DNNs) are vulnerable to adversarial patches which introduce perceptible but localized changes to the input. Nevertheless, existing approaches have focused on generating adversarial patches on images, their counterparts in videos have been less explored. Compared with images, attacking videos is much more challenging as it needs to consider not only spatial cues but also temporal cues. To close this gap, we introduce a novel adversarial attack in this paper, the bullet-screen comment (BSC) attack, which attacks video recognition models with BSCs. Specifically, adversarial BSCs are generated with a Reinforcement Learning (RL) framework, where the environment is set as the target model and the agent plays the role of selecting the position and transparency of each BSC. By continuously querying the target models and receiving feedback, the agent gradually adjusts its selection strategies in order to achieve a high fooling rate with non-overlapping BSCs. As BSCs can be regarded as a kind of meaningful patch, adding it to a clean video will not affect people' s understanding of the video content, nor will arouse people' s suspicion. We conduct extensive experiments to verify the effectiveness of the proposed method. On both UCF-101 and HMDB-51 datasets, our BSC attack method can achieve about 90\% fooling rate when attacking three mainstream video recognition models, while only occluding \textless 8\% areas in the video. Our code is available at this https URL.",[],[],"['Kai Chen', 'Zhipeng Wei', 'Jingjing Chen', 'Zuxuan Wu', 'Yu-Gang Jiang']","['', '', '', '', '']",[]
https://arxiv.org/abs/2201.03210,Transparency & Explainability,Model-Based Image Signal Processors via Learnable Dictionaries.,"Digital cameras transform sensor RAW readings into RGB images by means of their Image Signal Processor (ISP). Computational photography tasks such as image denoising and colour constancy are commonly performed in the RAW domain, in part due to the inherent hardware design, but also due to the appealing simplicity of noise statistics that result from the direct sensor readings. Despite this, the availability of RAW images is limited in comparison with the abundance and diversity of available RGB data. Recent approaches have attempted to bridge this gap by estimating the RGB to RAW mapping: handcrafted model-based methods that are interpretable and controllable usually require manual parameter fine-tuning, while end-to-end learnable neural networks require large amounts of training data, at times with complex training procedures, and generally lack interpretability and parametric control. Towards addressing these existing limitations, we present a novel hybrid model-based and data-driven ISP that builds on canonical ISP operations and is both learnable and interpretable. Our proposed invertible model, capable of bidirectional mapping between RAW and RGB domains, employs end-to-end learning of rich parameter representations, i.e. dictionaries, that are free from direct parametric supervision and additionally enable simple and plausible data augmentation. We evidence the value of our data generation process by extensive experiments under both RAW image reconstruction and RAW image denoising tasks, obtaining state-of-the-art performance in both. Additionally, we show that our ISP can learn meaningful mappings from few data samples, and that denoising models trained with our dictionary-based data augmentation are competitive despite having only few or zero ground-truth labels.",[],[],"['Marcos V. Conde', 'Steven McDonagh', 'Matteo Maggioni', 'Aleš Leonardis', 'Eduardo Pérez-Pellitero']","['', '', '', '', '']",[]
https://arxiv.org/abs/2011.10698,Transparency & Explainability,Backdoor Attacks on the DNN Interpretation System.,"Interpretability is crucial to understand the inner workings of deep neural networks (DNNs) and many interpretation methods generate saliency maps that highlight parts of the input image that contribute the most to the prediction made by the DNN. In this paper we design a backdoor attack that alters the saliency map produced by the network for an input image only with injected trigger that is invisible to the naked eye while maintaining the prediction accuracy. The attack relies on injecting poisoned data with a trigger into the training data set. The saliency maps are incorporated in the penalty term of the objective function that is used to train a deep model and its influence on model training is conditioned upon the presence of a trigger. We design two types of attacks: targeted attack that enforces a specific modification of the saliency map and untargeted attack when the importance scores of the top pixels from the original saliency map are significantly reduced. We perform empirical evaluation of the proposed backdoor attacks on gradient-based and gradient-free interpretation methods for a variety of deep learning architectures. We show that our attacks constitute a serious security threat when deploying deep learning models developed by untrusty sources. Finally, in the Supplement we demonstrate that the proposed methodology can be used in an inverted setting, where the correct saliency map can be obtained only in the presence of a trigger (key), effectively making the interpretation system available only to selected users.",[],[],"['Shihong Fang', 'Anna Choromanska']","['', '']",[]
https://arxiv.org/abs/2112.04895,Transparency & Explainability,Latent Space Explanation by Intervention.,"The success of deep neural nets heavily relies on their ability to encode complex relations between their input and their output. While this property serves to fit the training data well, it also obscures the mechanism that drives prediction. This study aims to reveal hidden concepts by employing an intervention mechanism that shifts the predicted class based on discrete variational autoencoders. An explanatory model then visualizes the encoded information from any hidden layer and its corresponding intervened representation. By the assessment of differences between the original representation and the intervened representation, one can determine the concepts that can alter the class, hence providing interpretability. We demonstrate the effectiveness of our approach on CelebA, where we show various visualizations for bias in the data and suggest different interventions to reveal and change bias.",[],[],"['Itai Gat', 'Guy Lorberbom', 'Idan Schwartz', 'Tamir Hazan']","['', '', '', '']",[]
https://arxiv.org/abs/2312.16012,Transparency & Explainability,Learning the Dynamics of Visual Relational Reasoning via Reinforced Path Routing.,"Recently, neural module networks (NMNs) have yielded ongoing success in answering compositional visual questions, especially those involving multi-hop visual and logical reasoning. NMNs decompose the complex question into several sub-tasks using instance-modules from the reasoning paths of that question and then exploit intermediate supervisions to guide answer prediction, thereby improving inference interpretability. However, their performance may be hindered due to sketchy modeling of intermediate supervisions. For instance, (1) a prior assumption that each instance-module refers to only one grounded object yet overlooks other potentially associated grounded objects, impeding full cross-modal alignment learning; (2) IoU-based intermediate supervisions may introduce noise signals as the bounding box overlap issue might guide the model's focus towards irrelevant objects. To address these issues, a novel method, \textbf{\underline{D}}etection-based \textbf{\underline{I}}ntermediate \textbf{\underline{S}}upervision (DIS), is proposed, which adopts a generative detection framework to facilitate multiple grounding supervisions via sequence generation. As such, DIS offers more comprehensive and accurate intermediate supervisions, thereby boosting answer prediction performance. Furthermore, by considering intermediate results, DIS enhances the consistency in answering compositional questions and their sub-questions.Extensive experiments demonstrate the superiority of our proposed DIS, showcasing both improved accuracy and state-of-the-art reasoning consistency compared to prior approaches.",[],[],"['Yuhang Liu', 'Daowan Peng', 'Wei Wei', 'Yuanyuan Fu', 'Wenfeng Xie', 'Dangyang Chen']","['', '', '', '', '', '']",[]
https://arxiv.org/abs/2112.11547,Transparency & Explainability,"Decompose the Sounds and Pixels, Recompose the Events.","In this paper, we propose a framework centering around a novel architecture called the Event Decomposition Recomposition Network (EDRNet) to tackle the Audio-Visual Event (AVE) localization problem in the supervised and weakly supervised settings. AVEs in the real world exhibit common unravelling patterns (termed as Event Progress Checkpoints (EPC)), which humans can perceive through the cooperation of their auditory and visual senses. Unlike earlier methods which attempt to recognize entire event sequences, the EDRNet models EPCs and inter-EPC relationships using stacked temporal convolutions. Based on the postulation that EPC representations are theoretically consistent for an event category, we introduce the State Machine Based Video Fusion, a novel augmentation technique that blends source videos using different EPC template sequences. Additionally, we design a new loss function called the Land-Shore-Sea loss to compactify continuous foreground and background representations. Lastly, to alleviate the issue of confusing events during weak supervision, we propose a prediction stabilization method called Bag to Instance Label Correction. Experiments on the AVE dataset show that our collective framework outperforms the state-of-the-art by a sizable margin.",[],[],"['Varshanth R. Rao', 'Md Ibrahim Khalil', 'Haoda Li', 'Peng Dai', 'Juwei Lu']","['', '', '', '', '']",[]
https://arxiv.org/abs/2205.13296,Transparency & Explainability,Social Interpretable Tree for Pedestrian Trajectory Prediction.,"Understanding the multiple socially-acceptable future behaviors is an essential task for many vision applications. In this paper, we propose a tree-based method, termed as Social Interpretable Tree (SIT), to address this multi-modal prediction task, where a hand-crafted tree is built depending on the prior information of observed trajectory to model multiple future trajectories. Specifically, a path in the tree from the root to leaf represents an individual possible future trajectory. SIT employs a coarse-to-fine optimization strategy, in which the tree is first built by high-order velocity to balance the complexity and coverage of the tree and then optimized greedily to encourage multimodality. Finally, a teacher-forcing refining operation is used to predict the final fine trajectory. Compared with prior methods which leverage implicit latent variables to represent possible future trajectories, the path in the tree can explicitly explain the rough moving behaviors (e.g., go straight and then turn right), and thus provides better interpretability. Despite the hand-crafted tree, the experimental results on ETH-UCY and Stanford Drone datasets demonstrate that our method is capable of matching or exceeding the performance of state-of-the-art methods. Interestingly, the experiments show that the raw built tree without training outperforms many prior deep neural network based approaches. Meanwhile, our method presents sufficient flexibility in long-term prediction and different best-of-$K$ predictions.",[],[],"['Liushuai Shi', 'Le Wang', 'Chengjiang Long', 'Sanping Zhou', 'Fang Zheng', 'Nanning Zheng', 'Gang Hua']","['', '', '', '', '', '', '']",[]
https://arxiv.org/abs/2112.06197,Transparency & Explainability,Video as Conditional Graph Hierarchy for Multi-Granular Question Answering.,"Video question answering requires the models to understand and reason about both the complex video and language data to correctly derive the answers. Existing efforts have been focused on designing sophisticated cross-modal interactions to fuse the information from two modalities, while encoding the video and question holistically as frame and word sequences. Despite their success, these methods are essentially revolving around the sequential nature of video- and question-contents, providing little insight to the problem of question-answering and lacking interpretability as well. In this work, we argue that while video is presented in frame sequence, the visual elements (e.g., objects, actions, activities and events) are not sequential but rather hierarchical in semantic space. To align with the multi-granular essence of linguistic concepts in language queries, we propose to model video as a conditional graph hierarchy which weaves together visual facts of different granularity in a level-wise manner, with the guidance of corresponding textual cues. Despite the simplicity, our extensive experiments demonstrate the superiority of such conditional hierarchical graph architecture, with clear performance improvements over prior methods and also better generalization across different type of questions. Further analyses also demonstrate the model's reliability as it shows meaningful visual-textual evidences for the predicted answers.",[],[],"['Junbin Xiao', 'Angela Yao', 'Zhiyuan Liu', 'Yicong Li', 'Wei Ji', 'Tat-Seng Chua']","['', '', '', '', '', '']",[]
https://arxiv.org/abs/2112.14380,Transparency & Explainability,Cross-Domain Empirical Risk Minimization for Unbiased Long-Tailed Classification.,"We address the overlooked unbiasedness in existing long-tailed classification methods: we find that their overall improvement is mostly attributed to the biased preference of tail over head, as the test distribution is assumed to be balanced; however, when the test is as imbalanced as the long-tailed training data -- let the test respect Zipf's law of nature -- the tail bias is no longer beneficial overall because it hurts the head majorities. In this paper, we propose Cross-Domain Empirical Risk Minimization (xERM) for training an unbiased model to achieve strong performances on both test distributions, which empirically demonstrates that xERM fundamentally improves the classification by learning better feature representation rather than the head vs. tail game. Based on causality, we further theoretically explain why xERM achieves unbiasedness: the bias caused by the domain selection is removed by adjusting the empirical risks on the imbalanced domain and the balanced but unseen domain. Codes are available at this https URL.",[],[],"['Beier Zhu', 'Yulei Niu', 'Xian-Sheng Hua', 'Hanwang Zhang']","['', 'Machine Learning Department, Carnegie Mellon University', '', '']",[]
https://arxiv.org/abs/2203.11386,Transparency & Explainability,Optimizing Binary Decision Diagrams with MaxSAT for Classification.,"The growing interest in explainable artificial intelligence (XAI) for critical decision making motivates the need for interpretable machine learning (ML) models. In fact, due to their structure (especially with small sizes), these models are inherently understandable by humans. Recently, several exact methods for computing such models are proposed to overcome weaknesses of traditional heuristic methods by providing more compact models or better prediction quality. Despite their compressed representation of Boolean functions, Binary decision diagrams (BDDs) did not gain enough interest as other interpretable ML models. In this paper, we first propose SAT-based models for learning optimal BDDs (in terms of the number of features) that classify all input examples. Then, we lift the encoding to a MaxSAT model to learn optimal BDDs in limited depths, that maximize the number of examples correctly classified. Finally, we tackle the fragmentation problem by introducing a method to merge compatible subtrees for the BDDs found via the MaxSAT model. Our empirical study shows clear benefits of the proposed approach in terms of prediction quality and intrepretability (i.e., lighter size) compared to the state-of-the-art approaches.",[],[],"['Hao Hu', 'Marie-José Huguet', 'Mohamed Siala']","['Zhejiang Lab, Zhejiang University', '', 'Université Libre de Bruxelles']",[]
https://arxiv.org/abs/2108.11527,Transparency & Explainability,Subspace Differential Privacy.,"Many data applications have certain invariant constraints due to practical needs. Data curators who employ differential privacy need to respect such constraints on the sanitized data product as a primary utility requirement. Invariants challenge the formulation, implementation, and interpretation of privacy guarantees. We propose subspace differential privacy, to honestly characterize the dependence of the sanitized output on confidential aspects of the data. We discuss two design frameworks that convert well-known differentially private mechanisms, such as the Gaussian and the Laplace mechanisms, to subspace differentially private ones that respect the invariants specified by the curator. For linear queries, we discuss the design of near-optimal mechanisms that minimize the mean squared error. Subspace differentially private mechanisms rid the need for post-processing due to invariants, preserve transparency and statistical intelligibility of the output, and can be suitable for distributed implementation. We showcase the proposed mechanisms on the 2020 Census Disclosure Avoidance demonstration data, and a spatio-temporal dataset of mobile access point connections on a large university campus.",[],[],"['Jie Gao', 'Ruobin Gong', 'Fang-Yi Yu']","['', '', '']",[]
https://arxiv.org/abs/2209.00225,Transparency & Explainability,STDEN: Towards Physics-Guided Neural Networks for Traffic Flow Prediction.,"High-performance traffic flow prediction model designing, a core technology of Intelligent Transportation System, is a long-standing but still challenging task for industrial and academic communities. The lack of integration between physical principles and data-driven models is an important reason for limiting the development of this field. In the literature, physics-based methods can usually provide a clear interpretation of the dynamic process of traffic flow systems but are with limited accuracy, while data-driven methods, especially deep learning with black-box structures, can achieve improved performance but can not be fully trusted due to lack of a reasonable physical basis. To bridge the gap between purely data-driven and physics-driven approaches, we propose a physics-guided deep learning model named Spatio-Temporal Differential Equation Network (STDEN), which casts the physical mechanism of traffic flow dynamics into a deep neural network framework. Specifically, we assume the traffic flow on road networks is driven by a latent potential energy field (like water flows are driven by the gravity field), and model the spatio-temporal dynamic process of the potential energy field as a differential equation network. STDEN absorbs both the performance advantage of data-driven models and the interpretability of physics-based models, so is named a physics-guided prediction model. Experiments on three real-world traffic datasets in Beijing show that our model outperforms state-of-the-art baselines by a significant margin. A case study further verifies that STDEN can capture the mechanism of urban traffic and generate accurate predictions with physical meaning. The proposed framework of differential equation network modeling may also cast light on other similar applications.",[],[],"['Jiahao Ji', 'Jingyuan Wang', 'Zhe Jiang', 'Jiawei Jiang', 'Hu Zhang']","['', '', '', '', '']",[]
https://arxiv.org/abs/2112.08025,Transparency & Explainability,TLogic: Temporal Logical Rules for Explainable Link Forecasting on Temporal Knowledge Graphs.,"Conventional static knowledge graphs model entities in relational data as nodes, connected by edges of specific relation types. However, information and knowledge evolve continuously, and temporal dynamics emerge, which are expected to influence future situations. In temporal knowledge graphs, time information is integrated into the graph by equipping each edge with a timestamp or a time range. Embedding-based methods have been introduced for link prediction on temporal knowledge graphs, but they mostly lack explainability and comprehensible reasoning chains. Particularly, they are usually not designed to deal with link forecasting -- event prediction involving future timestamps. We address the task of link forecasting on temporal knowledge graphs and introduce TLogic, an explainable framework that is based on temporal logical rules extracted via temporal random walks. We compare TLogic with state-of-the-art baselines on three benchmark datasets and show better overall performance while our method also provides explanations that preserve time consistency. Furthermore, in contrast to most state-of-the-art embedding-based methods, TLogic works well in the inductive setting where already learned rules are transferred to related datasets with a common vocabulary.",[],[],"['Yushan Liu', 'Yunpu Ma', 'Marcel Hildebrandt', 'Mitchell Joblin', 'Volker Tresp']","['', '', '', '', '']",[]
https://arxiv.org/abs/1911.12199,Transparency & Explainability,FOCUS: Flexible Optimizable Counterfactual Explanations for Tree Ensembles.,"Model interpretability has become an important problem in machine learning (ML) due to the increased effect that algorithmic decisions have on humans. Counterfactual explanations can help users understand not only why ML models make certain decisions, but also how these decisions can be changed. We frame the problem of finding counterfactual explanations as a gradient-based optimization task and extend previous work that could only be applied to differentiable models. In order to accommodate non-differentiable models such as tree ensembles, we use probabilistic model approximations in the optimization framework. We introduce an approximation technique that is effective for finding counterfactual explanations for predictions of the original model and show that our counterfactual examples are significantly closer to the original instances than those produced by other methods specifically designed for tree ensembles.",[],[],"['Ana Lucic', 'Harrie Oosterhuis', 'Hinda Haned', 'Maarten de Rijke']","['', '', '', '']",[]
