link,category,title,abstract,keywords,ccs_concepts,author_names,author_affiliations,author_countries
https://arxiv.org/abs/2109.07193,Security,FCA: Learning a 3D Full-Coverage Vehicle Camouflage for Multi-View Physical Adversarial Attack.,"Physical adversarial attacks in object detection have attracted increasing attention. However, most previous works focus on hiding the objects from the detector by generating an individual adversarial patch, which only covers the planar part of the vehicle's surface and fails to attack the detector in physical scenarios for multi-view, long-distance and partially occluded objects. To bridge the gap between digital attacks and physical attacks, we exploit the full 3D vehicle surface to propose a robust Full-coverage Camouflage Attack (FCA) to fool detectors. Specifically, we first try rendering the nonplanar camouflage texture over the full vehicle surface. To mimic the real-world environment conditions, we then introduce a transformation function to transfer the rendered camouflaged vehicle into a photo realistic scenario. Finally, we design an efficient loss function to optimize the camouflage texture. Experiments show that the full-coverage camouflage attack can not only outperform state-of-the-art methods under various test cases but also generalize to different environments, vehicles, and object detectors. The code of FCA will be available at: this https URL.",[],[],"['Donghua Wang', 'Tingsong Jiang', 'Jialiang Sun', 'Weien Zhou', 'Xiaoya Zhang', 'Zhiqiang Gong', 'Wen Yao', 'Xiaoqian Chen']","['', '', '', '', '', '', '', '']",[]
https://arxiv.org/abs/2110.09075,Security,Boosting the Transferability of Video Adversarial Examples via Temporal Translation.,"Although deep-learning based video recognition models have achieved remarkable success, they are vulnerable to adversarial examples that are generated by adding human-imperceptible perturbations on clean video samples. As indicated in recent studies, adversarial examples are transferable, which makes it feasible for black-box attacks in real-world applications. Nevertheless, most existing adversarial attack methods have poor transferability when attacking other video models and transfer-based attacks on video models are still unexplored. To this end, we propose to boost the transferability of video adversarial examples for black-box attacks on video recognition models. Through extensive analysis, we discover that different video recognition models rely on different discriminative temporal patterns, leading to the poor transferability of video adversarial examples. This motivates us to introduce a temporal translation attack method, which optimizes the adversarial perturbations over a set of temporal translated video clips. By generating adversarial examples over translated videos, the resulting adversarial examples are less sensitive to temporal patterns existed in the white-box model being attacked and thus can be better transferred. Extensive experiments on the Kinetics-400 dataset and the UCF-101 dataset demonstrate that our method can significantly boost the transferability of video adversarial examples. For transfer-based attack against video recognition models, it achieves a 61.56% average attack success rate on the Kinetics-400 and 48.60% on the UCF-101. Code is available at this https URL.",[],[],"['Zhipeng Wei', 'Jingjing Chen', 'Zuxuan Wu', 'Yu-Gang Jiang']","['', '', '', '']",[]
https://arxiv.org/abs/2109.04176,Security,Towards Transferable Adversarial Attacks on Vision Transformers.,"Vision transformers (ViTs) have demonstrated impressive performance on a series of computer vision tasks, yet they still suffer from adversarial examples. % crafted in a similar fashion as CNNs. In this paper, we posit that adversarial attacks on transformers should be specially tailored for their architecture, jointly considering both patches and self-attention, in order to achieve high transferability. More specifically, we introduce a dual attack framework, which contains a Pay No Attention (PNA) attack and a PatchOut attack, to improve the transferability of adversarial samples across different ViTs. We show that skipping the gradients of attention during backpropagation can generate adversarial examples with high transferability. In addition, adversarial perturbations generated by optimizing randomly sampled subsets of patches at each iteration achieve higher attack success rates than attacks using all patches. We evaluate the transferability of attacks on state-of-the-art ViTs, CNNs and robustly trained CNNs. The results of these experiments demonstrate that the proposed dual attack can greatly boost transferability between ViTs and from ViTs to CNNs. In addition, the proposed method can easily be combined with existing transfer methods to boost performance. Code is available at this https URL.",[],[],"['Zhipeng Wei', 'Jingjing Chen', 'Micah Goldblum', 'Zuxuan Wu', 'Tom Goldstein', 'Yu-Gang Jiang']","['', '', 'University of Maryland', '', 'University of Maryland', '']",[]
https://arxiv.org/abs/2007.03838,Security,Making Adversarial Examples More Transferable and Indistinguishable.,"Fast gradient sign attack series are popular methods that are used to generate adversarial examples. However, most of the approaches based on fast gradient sign attack series cannot balance the indistinguishability and transferability due to the limitations of the basic sign structure. To address this problem, we propose a method, called Adam Iterative Fast Gradient Tanh Method (AI-FGTM), to generate indistinguishable adversarial examples with high transferability. Besides, smaller kernels and dynamic step size are also applied to generate adversarial examples for further increasing the attack success rates. Extensive experiments on an ImageNet-compatible dataset show that our method generates more indistinguishable adversarial examples and achieves higher attack success rates without extra running time and resource. Our best transfer-based attack NI-TI-DI-AITM can fool six classic defense models with an average success rate of 89.3% and three advanced defense models with an average success rate of 82.7%, which are higher than the state-of-the-art gradient-based attacks. Additionally, our method can also reduce nearly 20% mean perturbation. We expect that our method will serve as a new baseline for generating adversarial examples with better transferability and indistinguishability.",[],[],"['Junhua Zou', 'Yexin Duan', 'Boyu Li', 'Wu Zhang', 'Yu Pan', 'Zhisong Pan']","['', '', '', '', '', '']",[]
https://arxiv.org/abs/2109.06332,Security,Achieving Zero Constraint Violation for Constrained Reinforcement Learning via Primal-Dual Approach.,"Reinforcement learning is widely used in applications where one needs to perform sequential decisions while interacting with the environment. The problem becomes more challenging when the decision requirement includes satisfying some safety constraints. The problem is mathematically formulated as constrained Markov decision process (CMDP). In the literature, various algorithms are available to solve CMDP problems in a model-free manner to achieve $\epsilon$-optimal cumulative reward with $\epsilon$ feasible policies. An $\epsilon$-feasible policy implies that it suffers from constraint violation. An important question here is whether we can achieve $\epsilon$-optimal cumulative reward with zero constraint violations or not. To achieve that, we advocate the use of randomized primal-dual approach to solve the CMDP problems and propose a conservative stochastic primal-dual algorithm (CSPDA) which is shown to exhibit $\tilde{\mathcal{O}}\left(1/\epsilon^2\right)$ sample complexity to achieve $\epsilon$-optimal cumulative reward with zero constraint violations. In the prior works, the best available sample complexity for the $\epsilon$-optimal policy with zero constraint violation is $\tilde{\mathcal{O}}\left(1/\epsilon^5\right)$. Hence, the proposed algorithm provides a significant improvement as compared to the state of the art.",[],[],"['Qinbo Bai', 'Amrit Singh Bedi', 'Mridul Agarwal', 'Alec Koppel', 'Vaneet Aggarwal']","['', '', '', '', '']",[]
https://arxiv.org/abs/2109.12846,Security,HAGEN: Homophily-Aware Graph Convolutional Recurrent Network for Crime Forecasting.,"The crime forecasting is an important problem as it greatly contributes to urban safety. Typically, the goal of the problem is to predict different types of crimes for each geographical region (like a neighborhood or censor tract) in the near future. Since nearby regions usually have similar socioeconomic characteristics which indicate similar crime patterns, recent state-of-the-art solutions constructed a distance-based region graph and utilized Graph Neural Network (GNN) techniques for crime forecasting, because the GNN techniques could effectively exploit the latent relationships between neighboring region nodes in the graph. However, this distance-based pre-defined graph cannot fully capture crime correlation between regions that are far from each other but share similar crime patterns. Hence, to make an accurate crime prediction, the main challenge is to learn a better graph that reveals the dependencies between regions in crime occurrences and meanwhile captures the temporal patterns from historical crime records. To address these challenges, we propose an end-to-end graph convolutional recurrent network called HAGEN with several novel designs for crime prediction. Specifically, our framework could jointly capture the crime correlation between regions and the temporal crime dynamics by combining an adaptive region graph learning module with the Diffusion Convolution Gated Recurrent Unit (DCGRU). Based on the homophily assumption of GNN, we propose a homophily-aware constraint to regularize the optimization of the region graph so that neighboring region nodes on the learned graph share similar crime patterns, thus fitting the mechanism of diffusion convolution. It also incorporates crime embedding to model the interdependencies between regions and crime categories. Empirical experiments and comprehensive analysis on two real-world datasets showcase the effectiveness of HAGEN.",[],[],"['Chenyu Wang', 'Zongyu Lin', 'Xiaochen Yang', 'Jiao Sun', 'Mingxuan Yue', 'Cyrus Shahabi']","['', '', '', '', '', '']",[]
https://arxiv.org/abs/2012.06757,Security,Blindfolded Attackers Still Threatening: Strict Black-Box Adversarial Attacks on Graphs.,"Adversarial attacks on graphs have attracted considerable research interests. Existing works assume the attacker is either (partly) aware of the victim model, or able to send queries to it. These assumptions are, however, unrealistic. To bridge the gap between theoretical graph attacks and real-world scenarios, in this work, we propose a novel and more realistic setting: strict black-box graph attack, in which the attacker has no knowledge about the victim model at all and is not allowed to send any queries. To design such an attack strategy, we first propose a generic graph filter to unify different families of graph-based models. The strength of attacks can then be quantified by the change in the graph filter before and after attack. By maximizing this change, we are able to find an effective attack strategy, regardless of the underlying model. To solve this optimization problem, we also propose a relaxation technique and approximation theories to reduce the difficulty as well as the computational expense. Experiments demonstrate that, even with no exposure to the model, the Macro-F1 drops 6.4% in node classification and 29.5% in graph classification, which is a significant result compared with existent works.",[],[],"['Jiarong Xu', 'Yizhou Sun', 'Xin Jiang', 'Yanhao Wang', 'Yang Yang', 'Chunping Wang', 'Jiangang Lu']","['', '', '', '', '', '', '']",[]
https://arxiv.org/abs/2203.03762,Security,Defending Graph Convolutional Networks against Dynamic Graph Perturbations via Bayesian Self-Supervision.,"In recent years, plentiful evidence illustrates that Graph Convolutional Networks (GCNs) achieve extraordinary accomplishments on the node classification task. However, GCNs may be vulnerable to adversarial attacks on label-scarce dynamic graphs. Many existing works aim to strengthen the robustness of GCNs; for instance, adversarial training is used to shield GCNs against malicious perturbations. However, these works fail on dynamic graphs for which label scarcity is a pressing issue. To overcome label scarcity, self-training attempts to iteratively assign pseudo-labels to highly confident unlabeled nodes but such attempts may suffer serious degradation under dynamic graph perturbations. In this paper, we generalize noisy supervision as a kind of self-supervised learning method and then propose a novel Bayesian self-supervision model, namely GraphSS, to address the issue. Extensive experiments demonstrate that GraphSS can not only affirmatively alert the perturbations on dynamic graphs but also effectively recover the prediction of a node classifier when the graph is under such perturbations. These two advantages prove to be generalized over three classic GCNs across five public graph datasets.",[],[],"['Jun Zhuang', 'Mohammad Al Hasan']","['', '']",[]
https://arxiv.org/abs/2201.07224,Security,NSGZero: Efficiently Learning Non-exploitable Policy in Large-Scale Network Security Games with Neural Monte Carlo Tree Search.,"How resources are deployed to secure critical targets in networks can be modelled by Network Security Games (NSGs). While recent advances in deep learning (DL) provide a powerful approach to dealing with large-scale NSGs, DL methods such as NSG-NFSP suffer from the problem of data inefficiency. Furthermore, due to centralized control, they cannot scale to scenarios with a large number of resources. In this paper, we propose a novel DL-based method, NSGZero, to learn a non-exploitable policy in NSGs. NSGZero improves data efficiency by performing planning with neural Monte Carlo Tree Search (MCTS). Our main contributions are threefold. First, we design deep neural networks (DNNs) to perform neural MCTS in NSGs. Second, we enable neural MCTS with decentralized control, making NSGZero applicable to NSGs with many resources. Third, we provide an efficient learning paradigm, to achieve joint training of the DNNs in NSGZero. Compared to state-of-the-art algorithms, our method achieves significantly better data efficiency and scalability.",[],[],"['Wanqi Xue', 'Bo An', 'Chai Kiat Yeo']","['', 'Nanyang Technological University', '']",[]
https://arxiv.org/abs/2112.07435,Security,Multi-Leader Congestion Games with an Adversary.,"We study a multi-leader single-follower congestion game where multiple users (leaders) choose one resource out of a set of resources and, after observing the realized loads, an adversary (single-follower) attacks the resources with maximum loads, causing additional costs for the leaders. For the resulting strategic game among the leaders, we show that pure Nash equilibria may fail to exist and therefore, we consider approximate equilibria instead. As our first main result, we show that the existence of a $K$-approximate equilibrium can always be guaranteed, where $K \approx 1.1974$ is the unique solution of a cubic polynomial equation. To this end, we give a polynomial time combinatorial algorithm which computes a $K$-approximate equilibrium. The factor $K$ is tight, meaning that there is an instance that does not admit an $\alpha$-approximate equilibrium for any $\alpha<K$. Thus $\alpha=K$ is the smallest possible value of $\alpha$ such that the existence of an $\alpha$-approximate equilibrium can be guaranteed for any instance of the considered game. Secondly, we focus on approximate equilibria of a given fixed instance. We show how to compute efficiently a best approximate equilibrium, that is, with smallest possible $\alpha$ among all $\alpha$-approximate equilibria of the given instance.",[],[],"['Tobias Harks', 'Mona Henle', 'Max Klimm', 'Jannik Matuschke', 'Anja Schedel']","['', '', '', '', '']",[]
https://arxiv.org/abs/2212.14317,Security,Safe Subgame Resolving for Extensive Form Correlated Equilibrium.,"Correlated Equilibrium is a solution concept that is more general than Nash Equilibrium (NE) and can lead to outcomes with better social welfare. However, its natural extension to the sequential setting, the \textit{Extensive Form Correlated Equilibrium} (EFCE), requires a quadratic amount of space to solve, even in restricted settings without randomness in nature. To alleviate these concerns, we apply \textit{subgame resolving}, a technique extremely successful in finding NE in zero-sum games to solving general-sum EFCEs. Subgame resolving refines a correlation plan in an \textit{online} manner: instead of solving for the full game upfront, it only solves for strategies in subgames that are reached in actual play, resulting in significant computational gains. In this paper, we (i) lay out the foundations to quantify the quality of a refined strategy, in terms of the \textit{social welfare} and \textit{exploitability} of correlation plans, (ii) show that EFCEs possess a sufficient amount of independence between subgames to perform resolving efficiently, and (iii) provide two algorithms for resolving, one using linear programming and the other based on regret minimization. Both methods guarantee \textit{safety}, i.e., they will never be counterproductive. Our methods are the first time an online method has been applied to the correlated, general-sum setting.",[],[],"['Chun Kai Ling', 'Fei Fang']","['', '']",[]
https://arxiv.org/abs/2109.09861,Security,Generalized Dynamic Cognitive Hierarchy Models for Strategic Driving Behavior.,"While there has been an increasing focus on the use of game theoretic models for autonomous driving, empirical evidence shows that there are still open questions around dealing with the challenges of common knowledge assumptions as well as modeling bounded rationality. To address some of these practical challenges, we develop a framework of generalized dynamic cognitive hierarchy for both modelling naturalistic human driving behavior as well as behavior planning for autonomous vehicles (AV). This framework is built upon a rich model of level-0 behavior through the use of automata strategies, an interpretable notion of bounded rationality through safety and maneuver satisficing, and a robust response for planning. Based on evaluation on two large naturalistic datasets as well as simulation of critical traffic scenarios, we show that i) automata strategies are well suited for level-0 behavior in a dynamic level-k framework, and ii) the proposed robust response to a heterogeneous population of strategic and non-strategic reasoners can be an effective approach for game theoretic planning in AV.",[],[],"['Atrisha Sarkar', 'Kate Larson', 'Krzysztof Czarnecki']","['', '', '']",[]
https://arxiv.org/abs/2109.03861,Security,Recurrent Neural Network Controllers Synthesis with Stability Guarantees for Partially Observed Systems.,"Neural network controllers have become popular in control tasks thanks to their flexibility and expressivity. Stability is a crucial property for safety-critical dynamical systems, while stabilization of partially observed systems, in many cases, requires controllers to retain and process long-term memories of the past. We consider the important class of recurrent neural networks (RNN) as dynamic controllers for nonlinear uncertain partially-observed systems, and derive convex stability conditions based on integral quadratic constraints, S-lemma and sequential convexification. To ensure stability during the learning and control process, we propose a projected policy gradient method that iteratively enforces the stability conditions in the reparametrized space taking advantage of mild additional information on system dynamics. Numerical experiments show that our method learns stabilizing controllers while using fewer samples and achieving higher final performance compared with policy gradient.",[],[],"['Fangda Gu', 'He Yin', 'Laurent El Ghaoui', 'Murat Arcak', 'Peter Seiler', 'Ming Jin']","['', '', '', '', '', '']",[]
https://arxiv.org/abs/2112.07701,Security,Conservative and Adaptive Penalty for Model-Based Safe Reinforcement Learning.,"Reinforcement Learning (RL) agents in the real world must satisfy safety constraints in addition to maximizing a reward objective. Model-based RL algorithms hold promise for reducing unsafe real-world actions: they may synthesize policies that obey all constraints using simulated samples from a learned model. However, imperfect models can result in real-world constraint violations even for actions that are predicted to satisfy all constraints. We propose Conservative and Adaptive Penalty (CAP), a model-based safe RL framework that accounts for potential modeling errors by capturing model uncertainty and adaptively exploiting it to balance the reward and the cost objectives. First, CAP inflates predicted costs using an uncertainty-based penalty. Theoretically, we show that policies that satisfy this conservative cost constraint are guaranteed to also be feasible in the true environment. We further show that this guarantees the safety of all intermediate solutions during RL training. Further, CAP adaptively tunes this penalty during training using true cost feedback from the environment. We evaluate this conservative and adaptive penalty-based approach for model-based safe RL extensively on state and image-based environments. Our results demonstrate substantial gains in sample-efficiency while incurring fewer violations than prior safe RL algorithms. Code is available at: this https URL",[],[],"['Yecheng Jason Ma', 'Andrew Shen', 'Osbert Bastani', 'Dinesh Jayaraman']","['', '', '', '']",[]
https://arxiv.org/abs/2103.14347,Security,Combating Adversaries with Anti-adversaries.,"Deep neural networks are vulnerable to small input perturbations known as adversarial attacks. Inspired by the fact that these adversaries are constructed by iteratively minimizing the confidence of a network for the true class label, we propose the anti-adversary layer, aimed at countering this effect. In particular, our layer generates an input perturbation in the opposite direction of the adversarial one and feeds the classifier a perturbed version of the input. Our approach is training-free and theoretically supported. We verify the effectiveness of our approach by combining our layer with both nominally and robustly trained models and conduct large-scale experiments from black-box to adaptive attacks on CIFAR10, CIFAR100, and ImageNet. Our layer significantly enhances model robustness while coming at no cost on clean accuracy.",[],[],"['Motasem Alfarra', 'Juan C. Pérez', 'Ali Thabet', 'Adel Bibi', 'Philip H. S. Torr', 'Bernard Ghanem']","['', '', '', '', '', '']",[]
https://arxiv.org/abs/2201.02185,Security,Admissible Policy Teaching through Reward Design.,"We study reward design strategies for incentivizing a reinforcement learning agent to adopt a policy from a set of admissible policies. The goal of the reward designer is to modify the underlying reward function cost-efficiently while ensuring that any approximately optimal deterministic policy under the new reward function is admissible and performs well under the original reward function. This problem can be viewed as a dual to the problem of optimal reward poisoning attacks: instead of forcing an agent to adopt a specific policy, the reward designer incentivizes an agent to avoid taking actions that are inadmissible in certain states. Perhaps surprisingly, and in contrast to the problem of optimal reward poisoning attacks, we first show that the reward design problem for admissible policy teaching is computationally challenging, and it is NP-hard to find an approximately optimal reward modification. We then proceed by formulating a surrogate problem whose optimal solution approximates the optimal solution to the reward design problem in our setting, but is more amenable to optimization techniques and analysis. For this surrogate problem, we present characterization results that provide bounds on the value of the optimal solution. Finally, we design a local search algorithm to solve the surrogate problem and showcase its utility using simulation-based experiments.",[],[],"['Kiarash Banihashem', 'Adish Singla', 'Jiarui Gan', 'Goran Radanovic']","['', 'Max Planck Institute for Software Systems', 'University of California, Los Angeles', '']",[]
