link,category,title,abstract,keywords,ccs_concepts,author_names,author_affiliations,author_countries
https://arxiv.org/abs/2104.08219,Transparency & Explainability,Flexible Instance-Specific Rationalization of NLP Models.,"Recent research on model interpretability in natural language processing extensively uses feature scoring methods for identifying which parts of the input are the most important for a model to make a prediction (i.e. explanation or rationale). However, previous research has shown that there is no clear best scoring method across various text classification tasks while practitioners typically have to make several other ad-hoc choices regarding the length and the type of the rationale (e.g. short or long, contiguous or not). Inspired by this, we propose a simple yet effective and flexible method that allows selecting optimally for each data instance: (1) a feature scoring method; (2) the length; and (3) the type of the rationale. Our method is inspired by input erasure approaches to interpretability which assume that the most faithful rationale for a prediction should be the one with the highest difference between the model's output distribution using the full text and the text after removing the rationale as input respectively. Evaluation on four standard text classification datasets shows that our proposed method provides more faithful, comprehensive and highly sufficient explanations compared to using a fixed feature scoring method, rationale length and type. More importantly, we demonstrate that a practitioner is not required to make any ad-hoc choices in order to extract faithful rationales using our approach.",[],[],"['George Chrysostomou', 'Nikolaos Aletras']","['', '']",[]
https://arxiv.org/abs/2112.10424,Transparency & Explainability,Unifying Model Explainability and Robustness for Joint Text Classification and Rationale Extraction.,"Recent works have shown explainability and robustness are two crucial ingredients of trustworthy and reliable text classification. However, previous works usually address one of two aspects: i) how to extract accurate rationales for explainability while being beneficial to prediction; ii) how to make the predictive model robust to different types of adversarial attacks. Intuitively, a model that produces helpful explanations should be more robust against adversarial attacks, because we cannot trust the model that outputs explanations but changes its prediction under small perturbations. To this end, we propose a joint classification and rationale extraction model named AT-BMC. It includes two key mechanisms: mixed Adversarial Training (AT) is designed to use various perturbations in discrete and embedding space to improve the model's robustness, and Boundary Match Constraint (BMC) helps to locate rationales more precisely with the guidance of boundary information. Performances on benchmark datasets demonstrate that the proposed AT-BMC outperforms baselines on both classification and rationale extraction by a large margin. Robustness analysis shows that the proposed AT-BMC decreases the attack success rate effectively by up to 69%. The empirical results indicate that there are connections between robust models and better explanations.",[],[],"['Dongfang Li', 'Baotian Hu', 'Qingcai Chen', 'Tujie Xu', 'Jingcong Tao', 'Yunan Zhang']","['', '', '', '', '', '']",[]
https://arxiv.org/abs/2201.01164,Transparency & Explainability,Interpretable Low-Resource Legal Decision Making.,"Over the past several years, legal applications of deep learning have been on the rise. However, as with other high-stakes decision making areas, the requirement for interpretability is of crucial importance. Current models utilized by legal practitioners are more of the conventional machine learning type, wherein they are inherently interpretable, yet unable to harness the performance capabilities of data-driven deep learning models. In this work, we utilize deep learning models in the area of trademark law to shed light on the issue of likelihood of confusion between trademarks. Specifically, we introduce a model-agnostic interpretable intermediate layer, a technique which proves to be effective for legal documents. Furthermore, we utilize weakly supervised learning by means of a curriculum learning strategy, effectively demonstrating the improved performance of a deep learning model. This is in contrast to the conventional models which are only able to utilize the limited number of expensive manually-annotated samples by legal experts. Although the methods presented in this work tackles the task of risk of confusion for trademarks, it is straightforward to extend them to other fields of law, or more generally, to other similar high-stakes application scenarios.",[],[],"['Rohan Bhambhoria', 'Hui Liu', 'Samuel Dahan', 'Xiaodan Zhu']","['', '', '', '']",[]
https://arxiv.org/abs/2203.06487,Transparency & Explainability,Evaluating Explainable AI on a Multi-Modal Medical Imaging Task: Can Existing Algorithms Fulfill Clinical Requirements?,"Being able to explain the prediction to clinical end-users is a necessity to leverage the power of artificial intelligence (AI) models for clinical decision support. For medical images, a feature attribution map, or heatmap, is the most common form of explanation that highlights important features for AI models' prediction. However, it is unknown how well heatmaps perform on explaining decisions on multi-modal medical images, where each image modality or channel visualizes distinct clinical information of the same underlying biomedical phenomenon. Understanding such modality-dependent features is essential for clinical users' interpretation of AI decisions. To tackle this clinically important but technically ignored problem, we propose the modality-specific feature importance (MSFI) metric. It encodes clinical image and explanation interpretation patterns of modality prioritization and modality-specific feature localization. We conduct a clinical requirement-grounded, systematic evaluation using computational methods and a clinician user study. Results show that the examined 16 heatmap algorithms failed to fulfill clinical requirements to correctly indicate AI model decision process or decision quality. The evaluation and MSFI metric can guide the design and selection of XAI algorithms to meet clinical requirements on multi-modal explanation.",[],[],"['Weina Jin', 'Xiaoxiao Li', 'Ghassan Hamarneh']","['', '', '']",[]
https://arxiv.org/abs/2109.04392,Transparency & Explainability,Fair Conformal Predictors for Applications in Medical Imaging.,"Deep learning has the potential to automate many clinically useful tasks in medical imaging. However translation of deep learning into clinical practice has been hindered by issues such as lack of the transparency and interpretability in these ""black box"" algorithms compared to traditional statistical methods. Specifically, many clinical deep learning models lack rigorous and robust techniques for conveying certainty (or lack thereof) in their predictions -- ultimately limiting their appeal for extensive use in medical decision-making. Furthermore, numerous demonstrations of algorithmic bias have increased hesitancy towards deployment of deep learning for clinical applications. To this end, we explore how conformal predictions can complement existing deep learning approaches by providing an intuitive way of expressing uncertainty while facilitating greater transparency to clinical users. In this paper, we conduct field interviews with radiologists to assess possible use-cases for conformal predictors. Using insights gathered from these interviews, we devise two clinical use-cases and empirically evaluate several methods of conformal predictions on a dermatology photography dataset for skin lesion classification. We show how to modify conformal predictions to be more adaptive to subgroup differences in patient skin tones through equalized coverage. Finally, we compare conformal prediction against measures of epistemic uncertainty.",[],[],"['Charles Lu', 'Andreanne Lemay', 'Ken Chang', 'Katharina Hoebel', 'Jayashree Kalpathy-Cramer']","['', '', '', '', '']",[]
https://arxiv.org/abs/2202.07766,Transparency & Explainability,"LIMREF: Local Interpretable Model Agnostic Rule-Based Explanations for Forecasting, with an Application to Electricity Smart Meter Data.","Accurate electricity demand forecasts play a crucial role in sustainable power systems. To enable better decision-making especially for demand flexibility of the end-user, it is necessary to provide not only accurate but also understandable and actionable forecasts. To provide accurate forecasts Global Forecasting Models (GFM) trained across time series have shown superior results in many demand forecasting competitions and real-world applications recently, compared with univariate forecasting approaches. We aim to fill the gap between the accuracy and the interpretability in global forecasting approaches. In order to explain the global model forecasts, we propose Local Interpretable Model-agnostic Rule-based Explanations for Forecasting (LIMREF), a local explainer framework that produces k-optimal impact rules for a particular forecast, considering the global forecasting model as a black-box model, in a model-agnostic way. It provides different types of rules that explain the forecast of the global model and the counterfactual rules, which provide actionable insights for potential changes to obtain different outputs for given instances. We conduct experiments using a large-scale electricity demand dataset with exogenous features such as temperature and calendar effects. Here, we evaluate the quality of the explanations produced by the LIMREF framework in terms of both qualitative and quantitative aspects such as accuracy, fidelity, and comprehensibility and benchmark those against other local explainers.",[],[],"['Dilini Rajapaksha', 'Christoph Bergmeir']","['', '']",[]
https://arxiv.org/abs/2201.11192,Transparency & Explainability,ReforesTree: A Dataset for Estimating Tropical Forest Carbon Stock with Deep Learning and Aerial Imagery.,"Forest biomass is a key influence for future climate, and the world urgently needs highly scalable financing schemes, such as carbon offsetting certifications, to protect and restore forests. Current manual forest carbon stock inventory methods of measuring single trees by hand are time, labour, and cost-intensive and have been shown to be subjective. They can lead to substantial overestimation of the carbon stock and ultimately distrust in forest financing. The potential for impact and scale of leveraging advancements in machine learning and remote sensing technologies is promising but needs to be of high quality in order to replace the current forest stock protocols for certifications. In this paper, we present ReforesTree, a benchmark dataset of forest carbon stock in six agro-forestry carbon offsetting sites in Ecuador. Furthermore, we show that a deep learning-based end-to-end model using individual tree detection from low cost RGB-only drone imagery is accurately estimating forest carbon stock within official carbon offsetting certification standards. Additionally, our baseline CNN model outperforms state-of-the-art satellite-based forest biomass and carbon stock estimates for this type of small-scale, tropical agro-forestry sites. We present this dataset to encourage machine learning research in this area to increase accountability and transparency of monitoring, verification and reporting (MVR) in carbon offsetting projects, as well as scaling global reforestation financing through accurate remote sensing.",[],[],"['Gyri Reiersen', 'David Dao', 'Björn Lütjens', 'Konstantin Klemmer', 'Kenza Amara', 'Attila Steinegger', 'Ce Zhang', 'Xiaoxiang Zhu']","['', '', '', '', '', '', '', '']",[]
https://arxiv.org/abs/2203.09181,Transparency & Explainability,An Interactive Explanatory AI System for Industrial Quality Control.,"Machine learning based image classification algorithms, such as deep neural network approaches, will be increasingly employed in critical settings such as quality control in industry, where transparency and comprehensibility of decisions are crucial. Therefore, we aim to extend the defect detection task towards an interactive human-in-the-loop approach that allows us to integrate rich background knowledge and the inference of complex relationships going beyond traditional purely data-driven approaches. We propose an approach for an interactive support system for classifications in an industrial quality control setting that combines the advantages of both (explainable) knowledge-driven and data-driven machine learning methods, in particular inductive logic programming and convolutional neural networks, with human expertise and control. The resulting system can assist domain experts with decisions, provide transparent explanations for results, and integrate feedback from users; thus reducing workload for humans while both respecting their expertise and without removing their agency or accountability.",[],[],"['Dennis Müller', 'Michael März', 'Stephan Scheele', 'Ute Schmid']","['', '', '', '']",[]
https://arxiv.org/abs/2109.12151,Transparency & Explainability,AI Explainability 360: Impact and Design.,"As artificial intelligence and machine learning algorithms become increasingly prevalent in society, multiple stakeholders are calling for these algorithms to provide explanations. At the same time, these stakeholders, whether they be affected citizens, government regulators, domain experts, or system developers, have different explanation needs. To address these needs, in 2019, we created AI Explainability 360 (Arya et al. 2020), an open source software toolkit featuring ten diverse and state-of-the-art explainability methods and two evaluation metrics. This paper examines the impact of the toolkit with several case studies, statistics, and community feedback. The different ways in which users have experienced AI Explainability 360 have resulted in multiple types of impact and improvements in multiple metrics, highlighted by the adoption of the toolkit by the independent LF AI & Data Foundation. The paper also describes the flexible design of the toolkit, examples of its use, and the significant educational material and documentation available to its users.",[],[],"['Vijay Arya', 'Rachel K. E. Bellamy', 'Pin-Yu Chen', 'Amit Dhurandhar', 'Michael Hind', 'Samuel C. Hoffman', 'Stephanie Houde', 'Q. Vera Liao', 'Ronny Luss', 'Aleksandra Mojsilovic', 'Sami Mourad', 'Pablo Pedemonte', 'Ramya Raghavendra', 'John Richards', 'Prasanna Sattigeri', 'Karthikeyan Shanmugam', 'Moninder Singh', 'Kush R. Varshney', 'Dennis Wei', 'Yunfeng Zhang']","['', '', 'IBM Research', '', '', '', '', '', '', '', '', '', '', '', '', '', '', '', '', '']",[]
https://arxiv.org/abs/2111.00826,Transparency & Explainability,"Reproducibility as a Mechanism for Teaching Fairness, Accountability, Confidentiality, and Transparency in Artificial Intelligence.","In this work, we explain the setup for a technical, graduate-level course on Fairness, Accountability, Confidentiality, and Transparency in Artificial Intelligence (FACT-AI) at the University of Amsterdam, which teaches FACT-AI concepts through the lens of reproducibility. The focal point of the course is a group project based on reproducing existing FACT-AI algorithms from top AI conferences and writing a corresponding report. In the first iteration of the course, we created an open source repository with the code implementations from the group projects. In the second iteration, we encouraged students to submit their group projects to the Machine Learning Reproducibility Challenge, resulting in 9 reports from our course being accepted for publication in the ReScience journal. We reflect on our experience teaching the course over two years, where one year coincided with a global pandemic, and propose guidelines for teaching FACT-AI through reproducibility in graduate-level AI study programs. We hope this can be a useful resource for instructors who want to set up similar courses in the future.",[],[],"['Ana Lucic', 'Maurits Bleeker', 'Sami Jullien', 'Samarth Bhargav', 'Maarten de Rijke']","['', '', '', '', '']",[]
https://arxiv.org/abs/2112.11209,Transparency & Explainability,Interpretable Knowledge Tracing: Simple and Efficient Student Modeling with Causal Relations.,"Intelligent Tutoring Systems have become critically important in future learning environments. Knowledge Tracing (KT) is a crucial part of that system. It is about inferring the skill mastery of students and predicting their performance to adjust the curriculum accordingly. Deep Learning-based KT models have shown significant predictive performance compared with traditional models. However, it is difficult to extract psychologically meaningful explanations from the tens of thousands of parameters in neural networks, that would relate to cognitive theory. There are several ways to achieve high accuracy in student performance prediction but diagnostic and prognostic reasoning is more critical in learning sciences. Since KT problem has few observable features (problem ID and student's correctness at each practice), we extract meaningful latent features from students' response data by using machine learning and data mining techniques. In this work, we present Interpretable Knowledge Tracing (IKT), a simple model that relies on three meaningful latent features: individual skill mastery, ability profile (learning transfer across skills), and problem difficulty. IKT's prediction of future student performance is made using a Tree-Augmented Naive Bayes Classifier (TAN), therefore its predictions are easier to explain than deep learning-based student models. IKT also shows better student performance prediction than deep learning-based student models without requiring a huge amount of parameters. We conduct ablation studies on each feature to examine their contribution to student performance prediction. Thus, IKT has great potential for providing adaptive and personalized instructions with causal reasoning in real-world educational systems.",[],[],"['Sein Minn', 'Jill-Jenn Vie', 'Koh Takeuchi', 'Hisashi Kashima', 'Feida Zhu']","['', '', '', '', '']",[]
https://arxiv.org/abs/2112.02557,Transparency & Explainability,Interpretable Privacy Preservation of Text Representations Using Vector Steganography.,"Contextual word representations generated by language models (LMs) learn spurious associations present in the training corpora. Recent findings reveal that adversaries can exploit these associations to reverse-engineer the private attributes of entities mentioned within the corpora. These findings have led to efforts towards minimizing the privacy risks of language models. However, existing approaches lack interpretability, compromise on data utility and fail to provide privacy guarantees. Thus, the goal of my doctoral research is to develop interpretable approaches towards privacy preservation of text representations that retain data utility while guaranteeing privacy. To this end, I aim to study and develop methods to incorporate steganographic modifications within the vector geometry to obfuscate underlying spurious associations and preserve the distributional semantic properties learnt during training.",[],[],['Geetanjali Bihani'],[''],[]
https://arxiv.org/abs/2109.06486,Fairness & Bias,Conditional Synthetic Data Generation for Robust Machine Learning Applications with Limited Pandemic Data.,"$\textbf{Background:}$ At the onset of a pandemic, such as COVID-19, data with proper labeling/attributes corresponding to the new disease might be unavailable or sparse. Machine Learning (ML) models trained with the available data, which is limited in quantity and poor in diversity, will often be biased and inaccurate. At the same time, ML algorithms designed to fight pandemics must have good performance and be developed in a time-sensitive manner. To tackle the challenges of limited data, and label scarcity in the available data, we propose generating conditional synthetic data, to be used alongside real data for developing robust ML models. $\textbf{Methods:}$ We present a hybrid model consisting of a conditional generative flow and a classifier for conditional synthetic data generation. The classifier decouples the feature representation for the condition, which is fed to the flow to extract the local noise. We generate synthetic data by manipulating the local noise with fixed conditional feature representation. We also propose a semi-supervised approach to generate synthetic samples in the absence of labels for a majority of the available data.  $\textbf{Results:}$ We performed conditional synthetic generation for chest computed tomography (CT) scans corresponding to normal, COVID-19, and pneumonia afflicted patients. We show that our method significantly outperforms existing models both on qualitative and quantitative performance, and our semi-supervised approach can efficiently synthesize conditional samples under label scarcity. As an example of downstream use of synthetic data, we show improvement in COVID-19 detection from CT scans with conditional synthetic data augmentation.",[],[],"['Hari Prasanna Das', 'Ryan Tran', 'Japjot Singh', 'Xiangyu Yue', 'Geoff Tison', 'Alberto Sangiovanni-Vincentelli', 'Costas J. Spanos']","['', '', '', '', '', '', '']",[]
https://arxiv.org/abs/2106.03278,Fairness & Bias,Coordinating Followers to Reach Better Equilibria: End-to-End Gradient Descent for Stackelberg Games.,"A growing body of work in game theory extends the traditional Stackelberg game to settings with one leader and multiple followers who play a Nash equilibrium. Standard approaches for computing equilibria in these games reformulate the followers' best response as constraints in the leader's optimization problem. These reformulation approaches can sometimes be effective, but often get trapped in low-quality solutions when followers' objectives are non-linear or non-quadratic. Moreover, these approaches assume a unique equilibrium or a specific equilibrium concept, e.g., optimistic or pessimistic, which is a limiting assumption in many situations. To overcome these limitations, we propose a stochastic gradient descent--based approach, where the leader's strategy is updated by differentiating through the followers' best responses. We frame the leader's optimization as a learning problem against followers' equilibrium, which allows us to decouple the followers' equilibrium constraints from the leader's problem. This approach also addresses cases with multiple equilibria and arbitrary equilibrium selection procedures by back-propagating through a sampled Nash equilibrium. To this end, this paper introduces a novel concept called equilibrium flow to formally characterize the set of equilibrium selection processes where the gradient with respect to a sampled equilibrium is an unbiased estimate of the true gradient. We evaluate our approach experimentally against existing baselines in three Stackelberg problems with multiple followers and find that in each case, our approach is able to achieve higher utility for the leader.",[],[],"['Kai Wang', 'Lily Xu', 'Andrew Perrault', 'Michael K. Reiter', 'Milind Tambe']","['University of Southern California', '', '', '', '']",[]
https://arxiv.org/abs/2109.11087,Fairness & Bias,BiRdQA: A Bilingual Dataset for Question Answering on Tricky Riddles.,"A riddle is a question or statement with double or veiled meanings, followed by an unexpected answer. Solving riddle is a challenging task for both machine and human, testing the capability of understanding figurative, creative natural language and reasoning with commonsense knowledge. We introduce BiRdQA, a bilingual multiple-choice question answering dataset with 6614 English riddles and 8751 Chinese riddles. For each riddle-answer pair, we provide four distractors with additional information from Wikipedia. The distractors are automatically generated at scale with minimal bias. Existing monolingual and multilingual QA models fail to perform well on our dataset, indicating that there is a long way to go before machine can beat human on solving tricky riddles. The dataset has been released to the community.",[],[],"['Yunxiang Zhang', 'Xiaojun Wan']","['', '']",[]
https://arxiv.org/abs/2010.06529,Fairness & Bias,On the Fairness of Causal Algorithmic Recourse.,"Algorithmic fairness is typically studied from the perspective of predictions. Instead, here we investigate fairness from the perspective of recourse actions suggested to individuals to remedy an unfavourable classification. We propose two new fairness criteria at the group and individual level, which -- unlike prior work on equalising the average group-wise distance from the decision boundary -- explicitly account for causal relationships between features, thereby capturing downstream effects of recourse actions performed in the physical world. We explore how our criteria relate to others, such as counterfactual fairness, and show that fairness of recourse is complementary to fairness of prediction. We study theoretically and empirically how to enforce fair causal recourse by altering the classifier and perform a case study on the Adult dataset. Finally, we discuss whether fairness violations in the data generating process revealed by our criteria may be better addressed by societal interventions as opposed to constraints on the classifier.",[],[],"['Julius von Kügelgen', 'Amir-Hossein Karimi', 'Umang Bhatt', 'Isabel Valera', 'Adrian Weller', 'Bernhard Schölkopf']","['', '', '', '', 'The Alan Turing Institute, NW1 2DB, London, United Kingdom, University of Cambridge, CB2 1PZ, Cambridge, United Kingdom', 'Max Planck Institute for Intelligent Systems']",[]
