link,category,title,abstract,keywords,ccs_concepts,author_names,author_affiliations,author_countries
https://arxiv.org/abs/2105.02725,Fairness & Bias,CrossWalk: Fairness-Enhanced Node Representation Learning.,"The potential for machine learning systems to amplify social inequities and unfairness is receiving increasing popular and academic attention. Much recent work has focused on developing algorithmic tools to assess and mitigate such unfairness. However, there is little work on enhancing fairness in graph algorithms. Here, we develop a simple, effective and general method, CrossWalk, that enhances fairness of various graph algorithms, including influence maximization, link prediction and node classification, applied to node embeddings. CrossWalk is applicable to any random walk based node representation learning algorithm, such as DeepWalk and Node2Vec. The key idea is to bias random walks to cross group boundaries, by upweighting edges which (1) are closer to the groups' peripheries or (2) connect different groups in the network. CrossWalk pulls nodes that are near groups' peripheries towards their neighbors from other groups in the embedding space, while preserving the necessary structural properties of the graph. Extensive experiments show the effectiveness of our algorithm to enhance fairness in various graph algorithms, including influence maximization, link prediction and node classification in synthetic and real networks, with only a very small decrease in performance.",[],[],"['Ahmad Khajehnejad', 'Moein Khajehnejad', 'Mahmoudreza Babaei', 'Krishna P. Gummadi', 'Adrian Weller', 'Baharan Mirzasoleiman']","['', '', 'Alan Turing Institute', 'Max Planck Institute for Software Systems', 'The Alan Turing Institute, NW1 2DB, London, United Kingdom, University of Cambridge, CB2 1PZ, Cambridge, United Kingdom', '']",[]
https://arxiv.org/abs/2112.04895,Fairness & Bias,Latent Space Explanation by Intervention.,"The success of deep neural nets heavily relies on their ability to encode complex relations between their input and their output. While this property serves to fit the training data well, it also obscures the mechanism that drives prediction. This study aims to reveal hidden concepts by employing an intervention mechanism that shifts the predicted class based on discrete variational autoencoders. An explanatory model then visualizes the encoded information from any hidden layer and its corresponding intervened representation. By the assessment of differences between the original representation and the intervened representation, one can determine the concepts that can alter the class, hence providing interpretability. We demonstrate the effectiveness of our approach on CelebA, where we show various visualizations for bias in the data and suggest different interventions to reveal and change bias.",[],[],"['Itai Gat', 'Guy Lorberbom', 'Idan Schwartz', 'Tamir Hazan']","['', '', '', '']",[]
https://arxiv.org/abs/2112.07605,Fairness & Bias,The King Is Naked: On the Notion of Robustness for Natural Language Processing.,"There is growing evidence that the classical notion of adversarial robustness originally introduced for images has been adopted as a de facto standard by a large part of the NLP research community. We show that this notion is problematic in the context of NLP as it considers a narrow spectrum of linguistic phenomena. In this paper, we argue for semantic robustness, which is better aligned with the human concept of linguistic fidelity. We characterize semantic robustness in terms of biases that it is expected to induce in a model. We study semantic robustness of a range of vanilla and robustly trained architectures using a template-based generative test bed. We complement the analysis with empirical evidence that, despite being harder to implement, semantic robustness can improve performance %gives guarantees for on complex linguistic phenomena where models robust in the classical sense fail.",[],[],"['Emanuele La Malfa', 'Marta Kwiatkowska']","['', '']",[]
https://arxiv.org/abs/2110.07700,Fairness & Bias,Hindsight Network Credit Assignment: Efficient Credit Assignment in Networks of Discrete Stochastic Units.,"Training neural networks with discrete stochastic variables presents a unique challenge. Backpropagation is not directly applicable, nor are the reparameterization tricks used in networks with continuous stochastic variables. To address this challenge, we present Hindsight Network Credit Assignment (HNCA), a novel gradient estimation algorithm for networks of discrete stochastic units. HNCA works by assigning credit to each unit based on the degree to which its output influences its immediate children in the network. We prove that HNCA produces unbiased gradient estimates with reduced variance compared to the REINFORCE estimator, while the computational cost is similar to that of backpropagation. We first apply HNCA in a contextual bandit setting to optimize a reward function that is unknown to the agent. In this setting, we empirically demonstrate that HNCA significantly outperforms REINFORCE, indicating that the variance reduction implied by our theoretical analysis is significant and impactful. We then show how HNCA can be extended to optimize a more general function of the outputs of a network of stochastic units, where the function is known to the agent. We apply this extended version of HNCA to train a discrete variational auto-encoder and empirically show it compares favourably to other strong methods. We believe that the ideas underlying HNCA can help stimulate new ways of thinking about efficient credit assignment in stochastic compute graphs.",[],[],['Kenny Young'],[''],[]
https://arxiv.org/abs/2109.05178,Fairness & Bias,College Student Retention Risk Analysis from Educational Database Using Multi-Task Multi-Modal Neural Fusion.,"We develop a Multimodal Spatiotemporal Neural Fusion network for Multi-Task Learning (MSNF-MTCL) to predict 5 important students' retention risks: future dropout, next semester dropout, type of dropout, duration of dropout and cause of dropout. First, we develop a general purpose multi-modal neural fusion network model MSNF for learning students' academic information representation by fusing spatial and temporal unstructured advising notes with spatiotemporal structured data. MSNF combines a Bidirectional Encoder Representations from Transformers (BERT)-based document embedding framework to represent each advising note, Long-Short Term Memory (LSTM) network to model temporal advising note embeddings, LSTM network to model students' temporal performance variables and students' static demographics altogether. The final fused representation from MSNF has been utilized on a Multi-Task Cascade Learning (MTCL) model towards building MSNF-MTCL for predicting 5 student retention risks. We evaluate MSNFMTCL on a large educational database consists of 36,445 college students over 18 years period of time that provides promising performances comparing with the nearest state-of-art models. Additionally, we test the fairness of such model given the existence of biases.",[],[],['Mohammad Arif Ul Alam'],[''],[]
https://arxiv.org/abs/2109.10431,Fairness & Bias,Fairness without Imputation: A Decision Tree Approach for Fair Prediction with Missing Values.,"We investigate the fairness concerns of training a machine learning model using data with missing values. Even though there are a number of fairness intervention methods in the literature, most of them require a complete training set as input. In practice, data can have missing values, and data missing patterns can depend on group attributes (e.g. gender or race). Simply applying off-the-shelf fair learning algorithms to an imputed dataset may lead to an unfair model. In this paper, we first theoretically analyze different sources of discrimination risks when training with an imputed dataset. Then, we propose an integrated approach based on decision trees that does not require a separate process of imputation and learning. Instead, we train a tree with missing incorporated as attribute (MIA), which does not require explicit imputation, and we optimize a fairness-regularized objective function. We demonstrate that our approach outperforms existing fairness intervention methods applied to an imputed dataset, through several experiments on real-world datasets.",[],[],"['Haewon Jeong', 'Hao Wang', 'Flavio P. Calmon']","['', 'Purdue University', '']",[]
https://arxiv.org/abs/2106.05727,Fairness & Bias,Cooperative Multi-Agent Fairness and Equivariant Policies.,"We study fairness through the lens of cooperative multi-agent learning. Our work is motivated by empirical evidence that naive maximization of team reward yields unfair outcomes for individual team members. To address fairness in multi-agent contexts, we introduce team fairness, a group-based fairness measure for multi-agent learning. We then prove that it is possible to enforce team fairness during policy optimization by transforming the team's joint policy into an equivariant map. We refer to our multi-agent learning strategy as Fairness through Equivariance (Fair-E) and demonstrate its effectiveness empirically. We then introduce Fairness through Equivariance Regularization (Fair-ER) as a soft-constraint version of Fair-E and show that it reaches higher levels of utility than Fair-E and fairer outcomes than non-equivariant policies. Finally, we present novel findings regarding the fairness-utility trade-off in multi-agent settings; showing that the magnitude of the trade-off is dependent on agent skill.",[],[],"['Niko A. Grupen', 'Bart Selman', 'Daniel D. Lee']","['', '', '']",[]
https://arxiv.org/abs/2112.05194,Fairness & Bias,Word Embeddings via Causal Inference: Gender Bias Reducing and Semantic Information Preserving.,"With widening deployments of natural language processing (NLP) in daily life, inherited social biases from NLP models have become more severe and problematic. Previous studies have shown that word embeddings trained on human-generated corpora have strong gender biases that can produce discriminative results in downstream tasks. Previous debiasing methods focus mainly on modeling bias and only implicitly consider semantic information while completely overlooking the complex underlying causal structure among bias and semantic components. To address these issues, we propose a novel methodology that leverages a causal inference framework to effectively remove gender bias. The proposed method allows us to construct and analyze the complex causal mechanisms facilitating gender information flow while retaining oracle semantic information within word embeddings. Our comprehensive experiments show that the proposed method achieves state-of-the-art results in gender-debiasing tasks. In addition, our methods yield better performance in word similarity evaluation and various extrinsic downstream NLP tasks.",[],[],"['Lei Ding', 'Dengdeng Yu', 'Jinhan Xie', 'Wenxing Guo', 'Shenggang Hu', 'Meichen Liu', 'Linglong Kong', 'Hongsheng Dai', 'Yanchun Bao', 'Bei Jiang']","['', '', '', '', '', '', '', '', '', '']",[]
https://arxiv.org/abs/2104.03414,Privacy & Data Governance,PrivateSNN: Privacy-Preserving Spiking Neural Networks.,"How can we bring both privacy and energy-efficiency to a neural system? In this paper, we propose PrivateSNN, which aims to build low-power Spiking Neural Networks (SNNs) from a pre-trained ANN model without leaking sensitive information contained in a dataset. Here, we tackle two types of leakage problems: 1) Data leakage is caused when the networks access real training data during an ANN-SNN conversion process. 2) Class leakage is caused when class-related features can be reconstructed from network parameters. In order to address the data leakage issue, we generate synthetic images from the pre-trained ANNs and convert ANNs to SNNs using the generated images. However, converted SNNs remain vulnerable to class leakage since the weight parameters have the same (or scaled) value with respect to ANN parameters. Therefore, we encrypt SNN weights by training SNNs with a temporal spike-based learning rule. Updating weight parameters with temporal data makes SNNs difficult to be interpreted in the spatial domain. We observe that the encrypted PrivateSNN eliminates data and class leakage issues with a slight performance drop (less than ~2) and significant energy-efficiency gain (about 55x) compared to the standard ANN. We conduct extensive experiments on various datasets including CIFAR10, CIFAR100, and TinyImageNet, highlighting the importance of privacy-preserving SNN training.",[],[],"['Youngeun Kim', 'Yeshwanth Venkatesha', 'Priyadarshini Panda']","['', '', '']",[]
https://arxiv.org/abs/2108.11527,Privacy & Data Governance,Subspace Differential Privacy.,"Many data applications have certain invariant constraints due to practical needs. Data curators who employ differential privacy need to respect such constraints on the sanitized data product as a primary utility requirement. Invariants challenge the formulation, implementation, and interpretation of privacy guarantees. We propose subspace differential privacy, to honestly characterize the dependence of the sanitized output on confidential aspects of the data. We discuss two design frameworks that convert well-known differentially private mechanisms, such as the Gaussian and the Laplace mechanisms, to subspace differentially private ones that respect the invariants specified by the curator. For linear queries, we discuss the design of near-optimal mechanisms that minimize the mean squared error. Subspace differentially private mechanisms rid the need for post-processing due to invariants, preserve transparency and statistical intelligibility of the output, and can be suitable for distributed implementation. We showcase the proposed mechanisms on the 2020 Census Disclosure Avoidance demonstration data, and a spatio-temporal dataset of mobile access point connections on a large university campus.",[],[],"['Jie Gao', 'Ruobin Gong', 'Fang-Yi Yu']","['', '', '']",[]
https://arxiv.org/abs/2112.14652,Privacy & Data Governance,Private Rank Aggregation in Central and Local Models.,"In social choice theory, (Kemeny) rank aggregation is a well-studied problem where the goal is to combine rankings from multiple voters into a single ranking on the same set of items. Since rankings can reveal preferences of voters (which a voter might like to keep private), it is important to aggregate preferences in such a way to preserve privacy. In this work, we present differentially private algorithms for rank aggregation in the pure and approximate settings along with distribution-independent utility upper and lower bounds. In addition to bounds in the central model, we also present utility bounds for the local model of differential privacy.",[],[],"['Daniel Alabi', 'Badih Ghazi', 'Ravi Kumar', 'Pasin Manurangsi']","['', '', '', '']",[]
https://arxiv.org/abs/2110.08557,Privacy & Data Governance,DPNAS: Neural Architecture Search for Deep Learning with Differential Privacy.,"Training deep neural networks (DNNs) for meaningful differential privacy (DP) guarantees severely degrades model utility. In this paper, we demonstrate that the architecture of DNNs has a significant impact on model utility in the context of private deep learning, whereas its effect is largely unexplored in previous studies. In light of this missing, we propose the very first framework that employs neural architecture search to automatic model design for private deep learning, dubbed as DPNAS. To integrate private learning with architecture search, we delicately design a novel search space and propose a DP-aware method for training candidate models. We empirically certify the effectiveness of the proposed framework. The searched model DPNASNet achieves state-of-the-art privacy/utility trade-offs, e.g., for the privacy budget of $(\epsilon, \delta)=(3, 1\times10^{-5})$, our model obtains test accuracy of $98.57\%$ on MNIST, $88.09\%$ on FashionMNIST, and $68.33\%$ on CIFAR-10. Furthermore, by studying the generated architectures, we provide several intriguing findings of designing private-learning-friendly DNNs, which can shed new light on model design for deep learning with differential privacy.",[],[],"['Anda Cheng', 'Jiaxing Wang', 'Xi Sheryl Zhang', 'Qiang Chen', 'Peisong Wang', 'Jian Cheng']","['', '', '', '', '', 'Institute of Automation, Chinese Academy of Sciences, Beijing, China']",[]
https://arxiv.org/abs/2112.10599,Privacy & Data Governance,Differentially Private Regret Minimization in Episodic Markov Decision Processes.,"We study regret minimization in finite horizon tabular Markov decision processes (MDPs) under the constraints of differential privacy (DP). This is motivated by the widespread applications of reinforcement learning (RL) in real-world sequential decision making problems, where protecting users' sensitive and private information is becoming paramount. We consider two variants of DP -- joint DP (JDP), where a centralized agent is responsible for protecting users' sensitive data and local DP (LDP), where information needs to be protected directly on the user side. We first propose two general frameworks -- one for policy optimization and another for value iteration -- for designing private, optimistic RL algorithms. We then instantiate these frameworks with suitable privacy mechanisms to satisfy JDP and LDP requirements, and simultaneously obtain sublinear regret guarantees. The regret bounds show that under JDP, the cost of privacy is only a lower order additive term, while for a stronger privacy protection under LDP, the cost suffered is multiplicative. Finally, the regret bounds are obtained by a unified analysis, which, we believe, can be extended beyond tabular MDPs.",[],[],"['Sayak Ray Chowdhury', 'Xingyu Zhou']","['', '']",[]
https://arxiv.org/abs/2109.08266,Privacy & Data Governance,Hard to Forget: Poisoning Attacks on Certified Machine Unlearning.,"The right to erasure requires removal of a user's information from data held by organizations, with rigorous interpretations extending to downstream products such as learned models. Retraining from scratch with the particular user's data omitted fully removes its influence on the resulting model, but comes with a high computational cost. Machine ""unlearning"" mitigates the cost incurred by full retraining: instead, models are updated incrementally, possibly only requiring retraining when approximation errors accumulate. Rapid progress has been made towards privacy guarantees on the indistinguishability of unlearned and retrained models, but current formalisms do not place practical bounds on computation. In this paper we demonstrate how an attacker can exploit this oversight, highlighting a novel attack surface introduced by machine unlearning. We consider an attacker aiming to increase the computational cost of data removal. We derive and empirically investigate a poisoning attack on certified machine unlearning where strategically designed training data triggers complete retraining when removed.",[],[],"['Neil G. Marchant', 'Benjamin I. P. Rubinstein', 'Scott Alfeld']","['', '', '']",[]
https://arxiv.org/abs/2111.04906,Privacy & Data Governance,The Role of Adaptive Optimizers for Honest Private Hyperparameter Selection.,"Hyperparameter optimization is a ubiquitous challenge in machine learning, and the performance of a trained model depends crucially upon their effective selection. While a rich set of tools exist for this purpose, there are currently no practical hyperparameter selection methods under the constraint of differential privacy (DP). We study honest hyperparameter selection for differentially private machine learning, in which the process of hyperparameter tuning is accounted for in the overall privacy budget. To this end, we i) show that standard composition tools outperform more advanced techniques in many settings, ii) empirically and theoretically demonstrate an intrinsic connection between the learning rate and clipping norm hyperparameters, iii) show that adaptive optimizers like DPAdam enjoy a significant advantage in the process of honest hyperparameter tuning, and iv) draw upon novel limiting behaviour of Adam in the DP setting to design a new and more efficient optimizer.",[],[],"['Shubhankar Mohapatra', 'Sajin Sasy', 'Xi He', 'Gautam Kamath', 'Om Thakkar']","['', '', '', '', '']",[]
https://arxiv.org/abs/2112.05495,Privacy & Data Governance,How Private Is Your RL Policy? An Inverse RL Based Analysis Framework.,"Reinforcement Learning (RL) enables agents to learn how to perform various tasks from scratch. In domains like autonomous driving, recommendation systems, and more, optimal RL policies learned could cause a privacy breach if the policies memorize any part of the private reward. We study the set of existing differentially-private RL policies derived from various RL algorithms such as Value Iteration, Deep Q Networks, and Vanilla Proximal Policy Optimization. We propose a new Privacy-Aware Inverse RL (PRIL) analysis framework, that performs reward reconstruction as an adversarial attack on private policies that the agents may deploy. For this, we introduce the reward reconstruction attack, wherein we seek to reconstruct the original reward from a privacy-preserving policy using an Inverse RL algorithm. An adversary must do poorly at reconstructing the original reward function if the agent uses a tightly private policy. Using this framework, we empirically test the effectiveness of the privacy guarantee offered by the private algorithms on multiple instances of the FrozenLake domain of varying complexities. Based on the analysis performed, we infer a gap between the current standard of privacy offered and the standard of privacy needed to protect reward functions in RL. We do so by quantifying the extent to which each private policy protects the reward function by measuring distances between the original and reconstructed rewards.",[],[],"['Kritika Prakash', 'Fiza Husain', 'Praveen Paruchuri', 'Sujit P. Gujar']","['', '', '', '']",[]
https://arxiv.org/abs/2004.12088,Privacy & Data Governance,SplitFed: When Federated Learning Meets Split Learning.,"Federated learning (FL) and split learning (SL) are two popular distributed machine learning approaches. Both follow a model-to-data scenario; clients train and test machine learning models without sharing raw data. SL provides better model privacy than FL due to the machine learning model architecture split between clients and the server. Moreover, the split model makes SL a better option for resource-constrained environments. However, SL performs slower than FL due to the relay-based training across multiple clients. In this regard, this paper presents a novel approach, named splitfed learning (SFL), that amalgamates the two approaches eliminating their inherent drawbacks, along with a refined architectural configuration incorporating differential privacy and PixelDP to enhance data privacy and model robustness. Our analysis and empirical results demonstrate that (pure) SFL provides similar test accuracy and communication efficiency as SL while significantly decreasing its computation time per global epoch than in SL for multiple clients. Furthermore, as in SL, its communication efficiency over FL improves with the number of clients. Besides, the performance of SFL with privacy and robustness measures is further evaluated under extended experimental settings.",[],[],"['Chandra Thapa', 'M.A.P. Chamikara', 'Seyit Camtepe', 'Lichao Sun']","['', '', '', '']",[]
https://arxiv.org/abs/2112.09327,Privacy & Data Governance,Incentivizing Collaboration in Machine Learning via Synthetic Data Rewards.,"This paper presents a novel collaborative generative modeling (CGM) framework that incentivizes collaboration among self-interested parties to contribute data to a pool for training a generative model (e.g., GAN), from which synthetic data are drawn and distributed to the parties as rewards commensurate to their contributions. Distributing synthetic data as rewards (instead of trained models or money) offers task- and model-agnostic benefits for downstream learning tasks and is less likely to violate data privacy regulation. To realize the framework, we firstly propose a data valuation function using maximum mean discrepancy (MMD) that values data based on its quantity and quality in terms of its closeness to the true data distribution and provide theoretical results guiding the kernel choice in our MMD-based data valuation function. Then, we formulate the reward scheme as a linear optimization problem that when solved, guarantees certain incentives such as fairness in the CGM framework. We devise a weighted sampling algorithm for generating synthetic data to be distributed to each party as reward such that the value of its data and the synthetic data combined matches its assigned reward value by the reward scheme. We empirically show using simulated and real-world datasets that the parties' synthetic data rewards are commensurate to their contributions.",[],[],"['Sebastian Shenghong Tay', 'Xinyi Xu', 'Chuan Sheng Foo', 'Bryan Kian Hsiang Low']","['', '', '', '']",[]
