link,category,title,abstract,keywords,ccs_concepts,author_names,author_affiliations,author_countries
https://doi.org/10.1145/3531146.3534629,Fairness & Bias,The Effects of Crowd Worker Biases in Fact-Checking Tasks,"Due to the increasing amount of information shared online every day, the need for sound and reliable ways of distinguishing between trustworthy and non-trustworthy information is as present as ever. One technique for performing fact-checking at scale is to employ human intelligence in the form of crowd workers. Although earlier work has suggested that crowd workers can reliably identify misinformation, cognitive biases of crowd workers may reduce the quality of truthfulness judgments in this context. We performed a systematic exploratory analysis of publicly available crowdsourced data to identify a set of potential systematic biases that may occur when crowd workers perform fact-checking tasks. Following this exploratory study, we collected a novel data set of crowdsourced truthfulness judgments to validate our hypotheses. Our findings suggest that workers generally overestimate the truthfulness of statements and that different individual characteristics (i.e., their belief in science) and cognitive biases (i.e., the affect heuristic and overconfidence) can affect their annotations. Interestingly, we find that, depending on the general judgment tendencies of workers, their biases may sometimes lead to more accurate judgments.","['Truthfulness', 'Crowdsourcing', 'Misinformation', 'Explainability', 'Bias']","['Information systems _ Crowdsourcing', 'General and reference _ Estimation']","['Tim Draws', 'David La Barbera', 'Michael Soprano', 'Kevin Roitero', 'Davide Ceolin', 'Alessandro Checco', 'Stefano Mizzaro']","['Delft University of Technology', 'University of Udine', 'University of Udine', 'University of Udine', 'CWI', 'University of Rome La Sapienza', 'University of Udine']","['Netherlands', 'Italy', 'Italy', 'Italy', 'Netherlands', 'Italy', 'Italy']"
https://doi.org/10.1145/3531146.3533157,Fairness & Bias,The Forgotten Margins of AI Ethics,"How has recent AI Ethics literature addressed topics such as fairness and justice in the context of continued social and structural power asymmetries? We trace both the historical roots and current landmark work that have been shaping the field and categorize these works under three broad umbrellas: (i) those grounded in Western canonical philosophy, (ii) mathematical and statistical methods, and (iii) those emerging from critical data/algorithm/information studies. We also survey the field and explore emerging trends by examining the rapidly growing body of literature that falls under the broad umbrella of AI Ethics. To that end, we read and annotated peer-reviewed papers published over the past four years in two premier conferences: FAccT and AIES. We organize the literature based on an annotation scheme we developed according to three main dimensions: whether the paper deals with concrete applications, use-cases, and/or people’s lived experience; to what extent it addresses harmed, threatened, or otherwise marginalized groups; and if so, whether it explicitly names such groups. We note that although the goals of the majority of FAccT and AIES papers were often commendable, their consideration of the negative impacts of AI on traditionally marginalized groups remained shallow. Taken together, our conceptual analysis and the data from annotated papers indicate that the field would benefit from an increased focus on ethical analysis grounded in concrete use-cases, people’s experiences, and applications as well as from approaches that are sensitive to structural and historical power asymmetries.","['AI Ethics', 'Trends', 'Justice', 'FAccT', 'AIES']","['Social and professional topics', 'Computing methodologies _ Artificial intelligence']","['Abeba Birhane', 'Elayne Ruane', 'Thomas Laurent', 'Matthew S. Brown', 'Johnathan Flowers', 'Anthony Ventresque', 'Christopher L. Dancy']","['Mozilla Foundation, USA and School of Computer Science, University College Dublin', 'School of Computer Science, University College Dublin', 'School of Computer Science, University College Dublin', 'School of Computer Science, Bucknell University', 'Worcester State University', 'School of Computer Science, University College Dublin', 'Dept of Industrial and Manufacturing Engineering & Dept of Computer Science and Engineering, Pennsylvania State University']","['Ireland', 'Ireland', 'Ireland', 'USA', 'USA', 'Ireland', 'USA']"
https://doi.org/10.1145/3531146.3533179,Fairness & Bias,The Road to Explainability is Paved with Bias: Measuring the Fairness of Explanations,"Machine learning models in safety-critical settings like healthcare are often “blackboxes”: they contain a large number of parameters which are not transparent to users. Post-hoc explainability methods where a simple, human-interpretable model imitates the behavior of these blackbox models are often proposed to help users trust model predictions. In this work, we audit the quality of such explanations for different protected subgroups using real data from four settings in finance, healthcare, college admissions, and the US justice system. Across two different blackbox model architectures and four popular explainability methods, we find that the approximation quality of explanation models, also known as the fidelity, differs significantly between subgroups. We also demonstrate that pairing explainability methods with recent advances in robust machine learning can improve explanation fairness in some settings. However, we highlight the importance of communicating details of non-zero fidelity gaps to users, since a single solution might not exist across all settings. Finally, we discuss the implications of unfair explanation models as a challenging and understudied problem facing the machine learning community.","['explainability', 'machine learning', 'fairness']","['Computing methodologies _ Machine learning', 'Human-centred computing _ explanations']","['Aparna Balagopalan', 'Haoran Zhang', 'Kimia Hamidieh', 'Thomas Hartvigsen', 'Frank Rudzicz', 'Marzyeh Ghassemi']","['Massachusetts Institute of Technology', 'Massachusetts Institute of Technology', 'University of Toronto/Vector Institute', 'Massachusetts Institute of Technology', 'University of Toronto/Vector Institute, Canada and Unity Health Toronto', 'Massachusetts Institute of Technology, USA and Vector Institute']","['USA', 'USA', 'Canada', 'USA', 'Canada', 'Canada']"
https://doi.org/10.1145/3531146.3534627,Fairness & Bias,Theories of �Gender� in NLP Bias Research,"The rise of concern around Natural Language Processing (NLP) technologies containing and perpetuating social biases has led to a rich and rapidly growing area of research. Gender bias is one of the central biases being analyzed, but to date there is no comprehensive analysis of how “gender” is theorized in the field. We survey nearly 200 articles concerning gender bias in NLP to discover how the field conceptualizes gender both explicitly (e.g. through definitions of terms) and implicitly (e.g. through how gender is operationalized in practice). In order to get a better idea of emerging trajectories of thought, we split these articles into two sections by time.  We find that the majority of the articles do not make their theorization of gender explicit, even if they clearly define “bias.” Almost none use a model of gender that is intersectional or inclusive of nonbinary genders; and many conflate sex characteristics, social gender, and linguistic gender in ways that disregard the existence and experience of trans, nonbinary, and intersex people. There is an increase between the two time-sections in statements acknowledging that gender is a complicated reality, however, very few articles manage to put this acknowledgment into practice. In addition to analyzing these findings, we provide specific recommendations to facilitate interdisciplinary work, and to incorporate theory and methodology from Gender Studies. Our hope is that this will produce more inclusive gender bias research in NLP.","['natural language processing', 'gender bias', 'gender studies']",[],"['Hannah Devinney', 'Jenny Björklund', 'Henrik Björklund']","['Umeå University', 'Uppsala University', 'Umeå University']","['Sweden', 'Sweden', 'Sweden']"
https://doi.org/10.1145/3531146.3533118,Fairness & Bias,Towards a multi-stakeholder value-based assessment framework for algorithmic systems,"In an effort to regulate Machine Learning-driven (ML) systems, current auditing processes mostly focus on detecting harmful algorithmic biases. While these strategies have proven to be impactful, some values outlined in documents dealing with ethics in ML-driven systems are still underrepresented in auditing processes. Such unaddressed values mainly deal with contextual factors that cannot be easily quantified. In this paper, we develop a value-based assessment framework that is not limited to bias auditing and that covers prominent ethical principles for algorithmic systems. Our framework presents a circular arrangement of values with two bipolar dimensions that make common motivations and potential tensions explicit. In order to operationalize these high-level principles, values are then broken down into specific criteria and their manifestations. However, some of these value-specific criteria are mutually exclusive and require negotiation. As opposed to some other auditing frameworks that merely rely on ML researchers’ and practitioners’ input, we argue that it is necessary to include stakeholders that present diverse standpoints to systematically negotiate and consolidate value and criteria tensions. To that end, we map stakeholders with different insight needs, and assign tailored means for communicating value manifestations to them. We, therefore, contribute to current ML auditing practices with an assessment framework that visualizes closeness and tensions between values and we give guidelines on how to operationalize them, while opening up the evaluation and deliberation process to a wide range of stakeholders.","['values', 'ML development and deployment pipeline', 'algorithm assessment', 'multi-stakeholder']","['General and reference _ Evaluation', 'Human-centered computing _ Human computer interaction (HCI)', 'Social and professional topics _ User characteristics']","['Mireia Yurrita', 'Dave Murray-Rust', 'Agathe Balayn', 'Alessandro Bozzon']","['Human Information Communication Design, TU Delft', 'Human Information Communication Design, TU Delft', 'Web Information Systems, TU Delft', 'Knowledge and Intelligence Design, TU Delft']","['Netherlands', 'Netherlands', 'Netherlands', 'Netherlands']"
https://doi.org/10.1145/3531146.3533197,Fairness & Bias,Towards Fair Unsupervised Learning,"Bias-mitigating techniques are now well established in the supervised learning literature and have shown their ability to tackle fairness-accuracy, as well as fairness-fairness trade-offs. These are usually predicated on different conceptions of fairness, such as demographic parity or equal odds that depend on the available labels in the dataset. However, it is often the case in practice that unsupervised learning is used as part of a machine learning pipeline (for instance, to perform dimensionality reduction or representation learning via SVD) or as a standalone model (for example, to derive a customer segmentation via k-means). It is thus crucial to develop approaches towards fair unsupervised learning. This work investigates fair unsupervised learning within the broad framework of generalised low-rank models (GLRM). Importantly, we introduce the concept of fairness functional that encompasses both traditional unsupervised learning techniques and min-max algorithms (whereby one minimises the maximum group loss). To do so, we design straightforward alternate convex search or biconvex gradient descent algorithms that also provide partial debiasing techniques. Finally, we show on benchmark datasets that our fair generalised low-rank models (“fGLRM”) perform well and help reduce disparity amongst groups while only incurring small runtime overheads.","['Unsupervised Learning', 'PCA', 'Clustering', 'Fairness']","['Theory of computation _ Unsupervised learning and clustering', 'Social and professional topics _ User characteristics']","['Francois Buet-Golfouse', 'Islam Utyagulov']","['University College London', 'Independent']","['United Kingdom', 'United Kingdom']"
https://doi.org/10.1145/3531146.3533132,Fairness & Bias,Towards Intersectional Feminist and Participatory ML: A Case Study in Supporting Feminicide Counterdata Collection,"Data ethics and fairness have emerged as important areas of research in recent years. However, much work in this area focuses on retroactively auditing and “mitigating bias” in existing, potentially flawed systems, without interrogating the deeper structural inequalities underlying them. There are not yet examples of how to apply feminist and participatory methodologies from the start, to conceptualize and design machine learning-based tools that center and aim to challenge power inequalities. Our work targets this more prospective goal. Guided by the framework of data feminism, we co-design datasets and machine learning models to support the efforts of activists who collect and monitor data about feminicide — gender-based killings of women and girls. We describe how intersectional feminist goals and participatory processes shaped each stage of our approach, from problem conceptualization to data collection to model evaluation. We highlight several methodological contributions, including 1) an iterative data collection and annotation process that targets model weaknesses and interrogates framing concepts (such as who is included/excluded in “feminicide”), 2) models that explicitly focus on intersectional identities rather than statistical majorities, and 3) a multi-step evaluation process — with quantitative, qualitative and participatory steps — focused on context-specific relevance. We also distill insights and tensions that arise from bridging intersectional feminist goals with ML. These include reflections on how ML may challenge power, embrace pluralism, rethink binaries and consider context, as well as the inherent limitations of any technology-based solution to address durable structural inequalities.",[],[],"['Harini Suresh', 'Rajiv Movva', 'Amelia Lee Dogan', 'Rahul Bhargava', 'Isadora Cruxen', 'Angeles Martinez Cuba', 'Guilia Taurino', 'Wonyoung So', ""Catherine D'Ignazio""]","['Data + Feminism Lab, Massachusetts Institute of Technology, USA and CSAIL, Massachusetts Institute of Technology', 'Data + Feminism Lab, Massachusetts Institute of Technology', 'Data + Feminism Lab, Massachusetts Institute of Technology', 'School of Journalism, Northeastern University', 'School of Business and Management, Queen Mary University of London', 'Data + Feminism Lab, Massachusetts Institute of Technology', 'Khoury College of Computer Sciences, Northeastern University', 'Data + Feminism Lab, Massachusetts Institute of Technology', 'Data + Feminism Lab, Massachusetts Institute of Technology']","['USA', 'USA', 'USA', 'USA', 'United Kingdom', 'USA', 'USA', 'USA', 'USA']"
https://doi.org/10.1145/3531146.3533087,Fairness & Bias,Treatment Effect Risk: Bounds and Inference,"Since the average treatment effect (ATE) measures the change in social welfare, even if positive, there is a risk of negative effect on, say, some 10% of the population. Assessing such risk is difficult, however, because any one individual treatment effect (ITE) is never observed so the 10% worst-affected cannot be identified, while distributional treatment effects only compare the first deciles within each treatment group, which does not correspond to any 10%-subpopulation. In this paper we consider how to nonetheless assess this important risk measure, formalized as the conditional value at risk (CVaR) of the ITE-distribution. We leverage the availability of pre-treatment covariates and characterize the tightest-possible upper and lower bounds on ITE-CVaR given by the covariate-conditional average treatment effect (CATE) function. We then proceed to study how to estimate these bounds efficiently from data and construct confidence intervals. This is challenging even in randomized experiments as it requires understanding the distribution of the unknown CATE function, which can be very complex if we use rich covariates so as to best control for heterogeneity. We develop a debiasing method that overcomes this and prove it enjoys favorable statistical properties even when CATE and other nuisances are estimated by black-box machine learning or even inconsistently. Studying a hypothetical change to French job-search counseling services, our bounds and inference demonstrate a small social benefit entails a negative impact on a substantial subpopulation.","['Program evaluation', 'Individual treatment effect', 'Conditional average treatment effect', 'Conditional value at risk', 'Partial identification', 'Debiased machine learning']",[],['Nathan Kallus'],"['Cornell University, USA and Netflix']",['USA']
https://doi.org/10.1145/3531146.3533145,Fairness & Bias,Trucks Don�t Mean Trump: Diagnosing Human Error in Image Analysis,"Algorithms provide powerful tools for detecting and dissecting human bias and error. Here, we develop machine learning methods to to analyze how humans err in a particular high-stakes task: image interpretation. We leverage a unique dataset of 16,135,392 human predictions of whether a neighborhood voted for Donald Trump or Joe Biden in the 2020 US election, based on a Google Street View image. We show that by training a machine learning estimator of the Bayes optimal decision for each image, we can provide an actionable decomposition of human error into bias, variance, and noise terms, and further identify specific features (like pickup trucks) which lead humans astray. Our methods can be applied to ensure that human-in-the-loop decision-making is accurate and fair and are also applicable to black-box algorithmic systems.","['image analysis', 'human error', 'diagnosing bias']","['Human-centered computing _ HCI design and evaluation methods', 'Computing methodologies _ Machine learning approaches']","['J.D. Zamfirescu-Pereira', 'Jerry Chen', 'Emily Wen', 'Allison Koenecke', 'Nikhil Garg', 'Emma Pierson']","['UC Berkeley', 'Stanford University', 'Stanford University', 'Cornell University', 'Cornell Tech', 'Cornell University']","['USA', 'USA', 'USA', 'USA', 'USA', 'USA']"
https://doi.org/10.1145/3531146.3533243,Fairness & Bias,Uncertainty and the Social Planner�s Problem: Why Sample Complexity Matters,"Welfare measures overall utility across a population, whereas malfare measures overall disutility, and the social planner’s problem can be cast either as maximizing the former or minimizing the latter. We show novel bounds on the expectations and tail probabilities of estimators of welfare, malfare, and regret of per-group (dis)utility values, where estimates are made from a finite sample drawn from each group. In particular, we consider estimating these quantities for individual functions (e.g., allocations or classifiers) with standard probabilistic bounds, and optimizing and bounding generalization error over hypothesis classes (i.e., we quantify overfitting) using Rademacher averages. We then study algorithmic fairness through the lens of sample complexity, finding that because marginalized or minority groups are often understudied, and fewer data are therefore available, the social planner is more likely to overfit to these groups, thus even models that seem fair in training can be systematically biased against such groups. We argue that this effect can be mitigated by ensuring sufficient sample sizes for each group, and our sample complexity analysis characterizes these sample sizes. Motivated by these conclusions, we present progressive sampling algorithms to efficiently optimize various fairness objectives.",[],[],['Cyrus Cousins'],"['Department of Computer Science, Brown University']",['USA']
https://doi.org/10.1145/3531146.3533242,Fairness & Bias,What is Proxy Discrimination?,"The near universal condemnation of proxy discrimination hides a disagreement over what it is. This work surveys various notions of proxy and proxy discrimination found in prior work and represents them in a common framework. These notions variously turn on statistical dependencies, causal effects, and intentions. It discusses the limitations and uses of each notation and of the concept as a whole.","['proxy', 'discrimination', 'conceptual analysis']",['Social and professional topics _ Computing / technology policy'],['Michael Carl Tschantz'],['International Computer Science Institute'],['USA']
https://doi.org/10.1145/3531146.3533080,Fairness & Bias,What People Think AI Should Infer From Faces,"Faces play an indispensable role in human social life. At present, computer vision artificial intelligence (AI) captures and interprets human faces for a variety of digital applications and services. The ambiguity of facial information has recently led to a debate among scholars in different fields about the types of inferences AI should make about people based on their facial looks. AI research often justifies facial AI inference-making by referring to how people form impressions in first-encounter scenarios. Critics raise concerns about bias and discrimination and warn that facial analysis AI resembles an automated version of physiognomy. What has been missing from this debate, however, is an understanding of how “non-experts” in AI ethically evaluate facial AI inference-making. In a two-scenario vignette study with 24 treatment groups, we show that non-experts (N = 3745) reject facial AI inferences such as trustworthiness and likability from portrait images in a low-stake advertising and a high-stake hiring context. In contrast, non-experts agree with facial AI inferences such as skin color or gender in the advertising but not the hiring decision context. For each AI inference, we ask non-experts to justify their evaluation in a written response. Analyzing 29,760 written justifications, we find that non-experts are either “evidentialists” or “pragmatists”: they assess the ethical status of a facial AI inference based on whether they think faces warrant sufficient or insufficient evidence for an inference (evidentialist justification) or whether making the inference results in beneficial or detrimental outcomes (pragmatist justification). Non-experts’ justifications underscore the normative complexity behind facial AI inference-making. AI inferences with insufficient evidence can be rationalized by considerations of relevance while irrelevant inferences can be justified by reference to sufficient evidence. We argue that participatory approaches contribute valuable insights for the development of ethical AI in an increasingly visual data culture.","['artificial intelligence', 'computer vision', 'human faces', 'participatory AI ethics']","['Computing methodologies _ Computer vision tasks', 'Social and professional topics _ User characteristics', 'Security and privacy _ Social aspects of security and privacy']","['Severin Engelmann', 'Chiara Ullstein', 'Orestis Papakyriakopoulos', 'Jens Grossklags']","['Chair of Cyber Trust, Department of Informatics, Technical University Munich', 'Chair of Cyber Trust, Department of Informatics, Technical University Munich', 'Princeton University', 'Chair of Cyber Trust, Department of Informatics, Technical University Munich']","['Germany', 'Germany', 'USA', 'Germany']"
https://doi.org/10.1145/3531146.3533078,Fairness & Bias,When learning becomes impossible,"We formally analyze an epistemic bias we call interpretive blindness (IB), in which under certain conditions a learner will be incapable of learning. IB is now common in our society, but it is a natural consequence of Bayesian inference and what we argue are mild assumptions about the relation between belief and evidence. IB a special problem for learning from testimony, in which one acquires information only from text or conversation. We show that IB follows from a codependence between background beliefs and interpretation in a Bayesian setting and the nature of contemporary testimony. We argue that a particular characteristic of contemporary testimony, argumentative completeness, can preclude learning in hierarchical Bayesian settings, even in the presence of constraints that are designed to promote good epistemic practices.","['learning', 'bias', 'agent modeling', 'echo chambers', 'Bayesian learning', 'philosophical foundations']",[],"['Nicholas Asher', 'Julie Hunter']","['Institut de Recherche en Informatique de Toulouse, Centre Nationale de Recherche Scientifique', 'LINAGORA Labs']","['France', 'France']"
