link,category,title,abstract,keywords,ccs_concepts,author_names,author_affiliations,author_countries
https://doi.org/10.1145/3531146.3534628,Transparency & Explainability,The Conflict Between Explainable and Accountable Decision-Making Algorithms,"Decision-making algorithms are being used in important decisions, such as who should be enrolled in health care programs and be hired. Even though these systems are currently deployed in high-stakes scenarios, many of them cannot explain their decisions. This limitation has prompted the Explainable Artificial Intelligence (XAI) initiative, which aims to make algorithms explainable to comply with legal requirements, promote trust, and maintain accountability. This paper questions whether and to what extent explainability can help solve the responsibility issues posed by autonomous AI systems. We suggest that XAI systems that provide post-hoc explanations could be seen as blameworthy agents, obscuring the responsibility of developers in the decision-making process. Furthermore, we argue that XAI could result in incorrect attributions of responsibility to vulnerable stakeholders, such as those who are subjected to algorithmic decisions (i.e., patients), due to a misguided perception that they have control over explainable algorithms. This conflict between explainability and accountability can be exacerbated if designers choose to use algorithms and patients as moral and legal scapegoats. We conclude with a set of recommendations for how to approach this tension in the socio-technical process of algorithmic decision-making and a defense of hard regulation to prevent designers from escaping responsibility.","['Responsibility', 'Accountability', 'Explainability', 'Artificial Intelligence', 'AI', 'Decision-Making', 'Algorithms', 'Blame', 'Designers', 'Patients', 'Users']","['Applied computing _ Law', 'Applied computing _ Psychology', 'Social and professional topics _ Governmental regulations', 'Computing methodologies _ Philosophical/theoretical foundations of artificial intelligence']","['Gabriel Lima', 'Nina Grgić-Hlača', 'Jin Keun Jeong', 'Meeyoung Cha']","['School of Computing, KAIST, Republic of Korea and Data Science Group, Institute for Basic Science', 'Max Planck Institute for Software Systems, Germany and Max Planck Institute for Research on Collective Goods', 'School of Law, Kangwon National University', 'Data Science Group, Institute for Basic Science, Republic of Korea and School of Computing, KAIST']","['Republic of Korea', 'Germany', 'Republic of Korea', 'Republic of Korea']"
https://doi.org/10.1145/3531146.3533179,Transparency & Explainability,The Road to Explainability is Paved with Bias: Measuring the Fairness of Explanations,"Machine learning models in safety-critical settings like healthcare are often “blackboxes”: they contain a large number of parameters which are not transparent to users. Post-hoc explainability methods where a simple, human-interpretable model imitates the behavior of these blackbox models are often proposed to help users trust model predictions. In this work, we audit the quality of such explanations for different protected subgroups using real data from four settings in finance, healthcare, college admissions, and the US justice system. Across two different blackbox model architectures and four popular explainability methods, we find that the approximation quality of explanation models, also known as the fidelity, differs significantly between subgroups. We also demonstrate that pairing explainability methods with recent advances in robust machine learning can improve explanation fairness in some settings. However, we highlight the importance of communicating details of non-zero fidelity gaps to users, since a single solution might not exist across all settings. Finally, we discuss the implications of unfair explanation models as a challenging and understudied problem facing the machine learning community.","['explainability', 'machine learning', 'fairness']","['Computing methodologies _ Machine learning', 'Human-centred computing _ explanations']","['Aparna Balagopalan', 'Haoran Zhang', 'Kimia Hamidieh', 'Thomas Hartvigsen', 'Frank Rudzicz', 'Marzyeh Ghassemi']","['Massachusetts Institute of Technology', 'Massachusetts Institute of Technology', 'University of Toronto/Vector Institute', 'Massachusetts Institute of Technology', 'University of Toronto/Vector Institute, Canada and Unity Health Toronto', 'Massachusetts Institute of Technology, USA and Vector Institute']","['USA', 'USA', 'Canada', 'USA', 'Canada', 'Canada']"
https://doi.org/10.1145/3531146.3533118,Transparency & Explainability,Towards a multi-stakeholder value-based assessment framework for algorithmic systems,"In an effort to regulate Machine Learning-driven (ML) systems, current auditing processes mostly focus on detecting harmful algorithmic biases. While these strategies have proven to be impactful, some values outlined in documents dealing with ethics in ML-driven systems are still underrepresented in auditing processes. Such unaddressed values mainly deal with contextual factors that cannot be easily quantified. In this paper, we develop a value-based assessment framework that is not limited to bias auditing and that covers prominent ethical principles for algorithmic systems. Our framework presents a circular arrangement of values with two bipolar dimensions that make common motivations and potential tensions explicit. In order to operationalize these high-level principles, values are then broken down into specific criteria and their manifestations. However, some of these value-specific criteria are mutually exclusive and require negotiation. As opposed to some other auditing frameworks that merely rely on ML researchers’ and practitioners’ input, we argue that it is necessary to include stakeholders that present diverse standpoints to systematically negotiate and consolidate value and criteria tensions. To that end, we map stakeholders with different insight needs, and assign tailored means for communicating value manifestations to them. We, therefore, contribute to current ML auditing practices with an assessment framework that visualizes closeness and tensions between values and we give guidelines on how to operationalize them, while opening up the evaluation and deliberation process to a wide range of stakeholders.","['values', 'ML development and deployment pipeline', 'algorithm assessment', 'multi-stakeholder']","['General and reference _ Evaluation', 'Human-centered computing _ Human computer interaction (HCI)', 'Social and professional topics _ User characteristics']","['Mireia Yurrita', 'Dave Murray-Rust', 'Agathe Balayn', 'Alessandro Bozzon']","['Human Information Communication Design, TU Delft', 'Human Information Communication Design, TU Delft', 'Web Information Systems, TU Delft', 'Knowledge and Intelligence Design, TU Delft']","['Netherlands', 'Netherlands', 'Netherlands', 'Netherlands']"
https://doi.org/10.1145/3531146.3533182,Transparency & Explainability,Designing for Responsible Trust in AI Systems: A Communication Perspective,"Current literature and public discourse on “trust in AI” are often focused on the principles underlying trustworthy AI, with insufficient attention paid to how people develop trust. Given that AI systems differ in their level of trustworthiness, two open questions come to the fore: how should AI trustworthiness be responsibly communicated to ensure appropriate and equitable trust judgments by different users, and how can we protect users from deceptive attempts to earn their trust? We draw from communication theories and literature on trust in technologies to develop a conceptual model called MATCH, which describes how trustworthiness is communicated in AI systems through trustworthiness cues and how those cues are processed by people to make trust judgments. Besides AI-generated content, we highlight transparency and interaction as AI systems’ affordances that present a wide range of trustworthiness cues to users. By bringing to light the variety of users’ cognitive processes to make trust judgments and their potential limitations, we urge technology creators to make conscious decisions in choosing reliable trustworthiness cues for target users and, as an industry, to regulate this space and prevent malicious use. Towards these goals, we define the concepts of warranted trustworthiness cues and expensive trustworthiness cues, and propose a checklist of requirements to help technology creators identify appropriate cues to use. We present a hypothetical use case to illustrate how practitioners can use MATCH to design AI systems responsibly, and discuss future directions for research and industry efforts aimed at promoting responsible trust in AI.","['Trust in AI', 'human-AI interaction', 'human-centered AI', 'AI design']",[],"['Q.Vera Liao', 'S. Shyam Sundar']","['Microsoft Research', 'Pennsylvania State University']","['Canada', 'USA']"
https://doi.org/10.1145/3531146.3533132,Transparency & Explainability,Towards Intersectional Feminist and Participatory ML: A Case Study in Supporting Feminicide Counterdata Collection,"Data ethics and fairness have emerged as important areas of research in recent years. However, much work in this area focuses on retroactively auditing and “mitigating bias” in existing, potentially flawed systems, without interrogating the deeper structural inequalities underlying them. There are not yet examples of how to apply feminist and participatory methodologies from the start, to conceptualize and design machine learning-based tools that center and aim to challenge power inequalities. Our work targets this more prospective goal. Guided by the framework of data feminism, we co-design datasets and machine learning models to support the efforts of activists who collect and monitor data about feminicide — gender-based killings of women and girls. We describe how intersectional feminist goals and participatory processes shaped each stage of our approach, from problem conceptualization to data collection to model evaluation. We highlight several methodological contributions, including 1) an iterative data collection and annotation process that targets model weaknesses and interrogates framing concepts (such as who is included/excluded in “feminicide”), 2) models that explicitly focus on intersectional identities rather than statistical majorities, and 3) a multi-step evaluation process — with quantitative, qualitative and participatory steps — focused on context-specific relevance. We also distill insights and tensions that arise from bridging intersectional feminist goals with ML. These include reflections on how ML may challenge power, embrace pluralism, rethink binaries and consider context, as well as the inherent limitations of any technology-based solution to address durable structural inequalities.",[],[],"['Harini Suresh', 'Rajiv Movva', 'Amelia Lee Dogan', 'Rahul Bhargava', 'Isadora Cruxen', 'Angeles Martinez Cuba', 'Guilia Taurino', 'Wonyoung So', ""Catherine D'Ignazio""]","['Data + Feminism Lab, Massachusetts Institute of Technology, USA and CSAIL, Massachusetts Institute of Technology', 'Data + Feminism Lab, Massachusetts Institute of Technology', 'Data + Feminism Lab, Massachusetts Institute of Technology', 'School of Journalism, Northeastern University', 'School of Business and Management, Queen Mary University of London', 'Data + Feminism Lab, Massachusetts Institute of Technology', 'Khoury College of Computer Sciences, Northeastern University', 'Data + Feminism Lab, Massachusetts Institute of Technology', 'Data + Feminism Lab, Massachusetts Institute of Technology']","['USA', 'USA', 'USA', 'USA', 'United Kingdom', 'USA', 'USA', 'USA', 'USA']"
https://doi.org/10.1145/3531146.3534638,Transparency & Explainability,Understanding and Being Understood: User Strategies for Identifying and Recovering From Mistranslations in Machine Translation-Mediated Chat,"Machine translation (MT) is now widely and freely available, and has the potential to greatly improve cross-lingual communication. In order to use MT reliably and safely, end users must be able to assess the quality of system outputs and determine how much they can rely on them to guide their decisions and actions. However, it can be difficult for users to detect and recover from mistranslations due to limited language skills. In this work we collected 19 MT-mediated role-play conversations in housing and employment scenarios, and conducted in-depth interviews to understand how users identify and recover from translation errors. Participants communicated using four language pairs: English, and one of Spanish, Farsi, Igbo, or Tagalog. We conducted qualitative analysis to understand user challenges in light of limited system transparency, strategies for recovery, and the kinds of translation errors that proved more or less difficult for users to overcome. We found that users broadly lacked relevant and helpful information to guide their assessments of translation quality. Instances where a user erroneously thought they had understood a translation correctly were rare but held the potential for serious consequences in the real world. Finally, inaccurate and disfluent translations had social consequences for participants, because it was difficult to discern when a disfluent message was reflective of the other person’s intentions, or an artifact of imperfect MT. We draw on theories of grounding and repair in communication to contextualize these findings, and propose design implications for explainable AI (XAI) researchers, MT researchers, as well as collaboration among them to support transparency and explainability in MT. These directions include handling typos and non-standard grammar common in interpersonal communication, making MT in interfaces more visible to help users evaluate errors, supporting collaborative repair of conversation breakdowns, and communicating model strengths and weaknesses to users.","['machine translation', 'human-AI interaction', 'computer-mediated communication', 'explainable machine learning']",[],"['Samantha Robertson', 'Mark Díaz']","['University of California, Berkeley', 'Google']","['USA', 'USA']"
https://doi.org/10.1145/3531146.3533189,Transparency & Explainability,Why Am I Not Seeing It? Understanding Users� Needs for Counterfactual Explanations in Everyday Recommendations,"Intelligent everyday applications typically rely on automated Recommender Systems (RS) to generate recommendations that help users make decisions among a large number of options. Due to the increasing complexity of RS and the lack of transparency in its algorithmic decision-making, researchers have recognized the need to support users with explanations. While many traditional Explainable AI methods fall short in disclosing the internal intricacy of recommender systems, counterfactual explanations provide many desirable explainable features by offering human-like explanations that contrast an existing recommendation with alternatives. However, there is a lack of empirical research in understanding users’ needs of counterfactual explanations in their usage of everyday intelligent applications. In this paper, we investigate whether and when to provide counterfactual explanations to support people’s decision-making with everyday recommendations through a question-driven approach. We conducted a preliminary survey study and an interview study to understand how existing explanations might be insufficient to support users and elicit the triggers that prompt them to ask why not questions and seek additional explanations. The findings reveal that the utility of decision is a primary factor that may affect their counterfactual information needs. We then conducted an online scenario-based survey to quantify the correlation between utility and explanation needs and found significant correlations between the measured variables.",['Explainable recommender system; Counterfactual explanations; User studies'],['Information systems _ Recommender systems'],"['Ruoxi Shang', 'K. J. Kevin Feng', 'Chirag Shah']","['University of Washington', 'University of Washington', 'University of Washington']","['USA', 'USA', 'USA']"
https://doi.org/10.1145/3531146.3533213,Transparency & Explainability,Who Audits the Auditors? Recommendations from a field scan of the algorithmic auditing ecosystem,"Algorithmic audits (or ‘AI audits’) are an increasingly popular mechanism for algorithmic accountability; however, they remain poorly defined. Without a clear understanding of audit practices, let alone widely used standards or regulatory guidance, claims that an AI product or system has been audited, whether by first-, second-, or third-party auditors, are difficult to verify and may potentially exacerbate, rather than mitigate, bias and harm. To address this knowledge gap, we provide the first comprehensive field scan of the AI audit ecosystem. We share a catalog of individuals (N=438) and organizations (N=189) who engage in algorithmic audits or whose work is directly relevant to algorithmic audits; conduct an anonymous survey of the group (N=152); and interview industry leaders (N=10). We identify emerging best practices as well as methods and tools that are becoming commonplace, and enumerate common barriers to leveraging algorithmic audits as effective accountability mechanisms. We outline policy recommendations to improve the quality and impact of these audits, and highlight proposals with wide support from algorithmic auditors as well as areas of debate. Our recommendations have implications for lawmakers, regulators, internal company policymakers, and standards-setting bodies, as well as for auditors. They are: 1) require the owners and operators of AI systems to engage in independent algorithmic audits against clearly defined standards; 2) notify individuals when they are subject to algorithmic decision-making systems; 3) mandate disclosure of key components of audit findings for peer review; 4) consider real-world harm in the audit process, including through standardized harm incident reporting and response mechanisms; 5) directly involve the stakeholders most likely to be harmed by AI systems in the algorithmic audit process; and 6) formalize evaluation and, potentially, accreditation of algorithmic auditors.","['AI audit', 'algorithm audit', 'audit', 'ethical AI', 'AI bias', 'AI harm', 'AI policy', 'algorithmic accountability']","['Social and professional topics _ Computing / technology policy', 'Human-centered computing']","['Sasha Costanza-Chock', 'Inioluwa Deborah Raji', 'Joy Buolamwini']","['Algorithmic Justice League', 'Algorithmic Justice League', 'Algorithmic Justice League']","['USA', 'USA', 'USA']"
https://doi.org/10.1145/3531146.3533237,Fairness & Bias,How Platform-User Power Relations Shape Algorithmic Accountability: A Case Study of Instant Loan Platforms and Financially Stressed Users in India,"Accountability, a requisite for responsible AI, can be facilitated through transparency mechanisms such as audits and explainability. However, prior work suggests that the success of these mechanisms may be limited to Global North contexts; understanding the limitations of current interventions in varied socio-political conditions is crucial to help policymakers facilitate wider accountability. To do so, we examined the mediation of accountability in the existing interactions between vulnerable users and a ‘high-risk’ AI system in a Global South setting. We report on a qualitative study with 29 financially-stressed users of instant loan platforms in India. We found that users experienced intense feelings of indebtedness for the ‘boon’ of instant loans, and perceived huge obligations towards loan platforms. Users fulfilled obligations by accepting harsh terms and conditions, over-sharing sensitive data, and paying high fees to unknown and unverified lenders. Users demonstrated a dependence on loan platforms by persisting with such behaviors despite risks of harms such as abuse, recurring debts, discrimination, privacy harms, and self-harm to them. Instead of being enraged with loan platforms, users assumed responsibility for their negative experiences, thus releasing the high-powered loan platforms from accountability obligations. We argue that accountability is shaped by platform-user power relations, and urge caution to policymakers in adopting a purely technical approach to fostering algorithmic accountability. Instead, we call for situated interventions that enhance agency of users, enable meaningful transparency, reconfigure designer-user relations, and prompt a critical reflection in practitioners towards wider accountability. We conclude with implications for responsibly deploying AI in FinTech applications in India and beyond.","['algorithmic accountability', 'algorithmic fairness', 'human-ai interaction', 'instant loans', 'socio-technical systems']","['Computer systems organization _ Embedded systems', 'Computer systems organization~Robotics', 'Networks~Network reliability']","['Divya Ramesh', 'Vaishnav Kameswaran', 'Ding Wang', 'Nithya Sambasivan']","['Computer Science and Engineering, University of Michigan, Ann Arbor', 'School of Information, University of Michigan, Ann Arbor', 'Google Research', 'Unaffiliated']","['USA', 'USA', 'India', 'USA']"
https://doi.org/10.1145/3531146.3533072,Fairness & Bias,#FuckTheAlgorithm: algorithmic imaginaries and political resistance,"This paper applies and extends the concept of algorithmic imaginaries in the context of political resistance to sociotechnical injustice. Focusing on the 2020 UK OfQual protests, the role of the ”fuck the algorithm” chant is examined as an imaginary of resistance to confront power in sociotechnical systems. The protest is analysed as a shift in algorithmic imaginaries amidst evolving uses of #FuckTheAlgorithm on social media as part of everyday practices of resistance.",[],[],['Garfield Benjamin'],"['Sociology, Solent University']",['United Kingdom']
https://doi.org/10.1145/3531146.3533071,Fairness & Bias,A Data-driven analysis of the interplay between Criminological theory and predictive policing algorithms,"Previous studies have focused on the biases and feedback loops that occur in predictive policing algorithms. These studies show how systemically and institutionally biased data leads to these feedback loops when predictive policing algorithms are applied in real life. We take a step back, and show that the choice in algorithm can be embedded in a specific criminological theory, and that the choice of a model on its own even without biased data can create biased feedback loops. By synthesizing “historical” data, in which we control the relationships between crimes, location and time, we show that the current predictive policing algorithms create biased feedback loops even with completely random data. We then review the process of creation and deployment of these predictive systems, and highlight when good practices, such as fitting a model to data, “go bad” within the context of larger system development and deployment. Using best practices from previous work on assessing and mitigating the impact of new technologies, we highlight where the design of these algorithms has broken down. The study also found that multidisciplinary analysis of such systems is vital for uncovering these issues and shows that any study of equitable AI should involve a systematic and holistic analysis of their design rationalities.","['model design', 'impact of data on algorithms']","['Applied computing _ Law', 'social and behavioral sciences', 'Software and its engineering _ Designing software', 'Theory of computation _ Models of computation']","['Adriane Chapman', 'Philip Grylls', 'Pamela Ugwudike', 'David Gammack', 'Jacqui Ayling']","['University of Southampton', 'University of Southampton', 'University of Southampton', 'University of Southampton', 'University of Southampton']","['United Kingdom', 'United Kingdom', 'United Kingdom', 'United Kingdom', 'United Kingdom']"
https://doi.org/10.1145/3531146.3533211,Fairness & Bias,ABCinML: Anticipatory Bias Correction in Machine Learning Applications,"The idealization of a static machine-learned model, trained once and deployed forever, is not practical. As input distributions change over time, the model will not only lose accuracy, any constraints to reduce bias against a protected class may fail to work as intended. Thus, researchers have begun to explore ways to maintain algorithmic fairness over time. One line of work focuses on dynamic learning: retraining after each batch, and the other on robust learning which tries to make algorithms robust against all possible future changes. Dynamic learning seeks to reduce biases soon after they have occurred and robust learning often yields (overly) conservative models. We propose an anticipatory dynamic learning approach for correcting the algorithm to mitigate bias before it occurs. Specifically, we make use of anticipations regarding the relative distributions of population subgroups (e.g., relative ratios of male and female applicants) in the next cycle to identify the right parameters for an importance weighing fairness approach. Results from experiments over multiple real-world datasets suggest that this approach has promise for anticipatory bias correction.","['classification', 'fairness', 'algorithmic bias']",['Computing methodologies _ Batch learning'],"['Abdulaziz A. Almuzaini', 'Chidansh A. Bhatt', 'David M. Pennock', 'Vivek K. Singh']","['Rutgers University', 'IBM', 'Rutgers University', 'Rutgers University']","['USA', 'USA', 'USA', 'USA']"
