link,category,title,abstract,keywords,ccs_concepts,author_names,author_affiliations,author_countries
https://doi.org/10.1145/3531146.3533225,Fairness & Bias,Fairness-aware Model-agnostic Positive and Unlabeled Learning,"With the increasing application of machine learning in high-stake decision-making problems, potential algorithmic bias towards people from certain social groups poses negative impacts on individuals and our society at large. In the real-world scenario, many such problems involve positive and unlabeled data such as medical diagnosis, criminal risk assessment and recommender systems. For instance, in medical diagnosis, only the diagnosed diseases will be recorded (positive) while others will not (unlabeled). Despite the large amount of existing work on fairness-aware machine learning in the (semi-)supervised and unsupervised settings, the fairness issue is largely under-explored in the aforementioned Positive and Unlabeled Learning (PUL) context, where it is usually more severe. In this paper, to alleviate this tension, we propose a fairness-aware PUL method named FairPUL. In particular, for binary classification over individuals from two populations, we aim to achieve similar true positive rates and false positive rates in both populations as our fairness metric. Based on the analysis of the optimal fair classifier for PUL, we design a model-agnostic post-processing framework, leveraging both the positive examples and unlabeled ones. Our framework is proven to be statistically consistent in terms of both the classification error and the fairness metric. Experiments on the synthetic and real-world data sets demonstrate that our framework outperforms state-of-the-art in both PUL and fair classification.","['Fairness', 'Machine Learning', 'Positive and Unlabeled Learning']",[],"['Ziwei Wu', 'Jingrui He']","['School of Information Sciences, University of Illinois at Urbana-Champaign', 'School of Information Sciences, University of Illinois at Urbana-Champaign']","['USA', 'USA']"
https://doi.org/10.1145/3531146.3533159,Fairness & Bias,"Female, white, 27? Bias Evaluation on Data and Algorithms for Affect Recognition in Faces","Nowadays, Artificial Intelligence (AI) algorithms show a strong performance for many use cases, making them desirable for real-world scenarios where the algorithms provide high-impact decisions. However, one major drawback of AI algorithms is their susceptibility to bias and resulting unfairness. This has a huge influence for their application, as they have a higher failure rate for certain subgroups. In this paper, we focus on the field of affective computing and particularly on the detection of bias for facial expressions. Depending on the deployment scenario, bias in facial expression models can have a disadvantageous impact and it is therefore essential to evaluate the bias and limitations of the model. In order to analyze the metadata distribution in affective computing datasets, we annotate several benchmark training datasets, containing both Action Units and categorical emotions, with age, gender, ethnicity, glasses, and beards. We show that there is a significantly skewed distribution, particularly for ethnicity and age. Based on this metadata annotation, we evaluate two trained state-of-the-art affective computing algorithms. Our evaluation shows that the strongest bias is in age, with the best performance for persons under 34 and a sharp decrease for older persons. Furthermore, we see an ethnicity bias with varying direction depending on the algorithm, a slight gender bias and worse performance for facial parts occluded by glasses.","['affective computing', 'action units', 'categorical emotions', 'metadata post-annotation', 'bias', 'fairness', 'data evaluation', 'algorithm evaluation']","['Computing methodologies _ Computer vision', 'Computing methodologies _ Machine learning', 'Social and professional topics _ Age', 'Social and professional topics _ Race and ethnicity', 'Social and professional topics~Gender']","['Jaspar Pahl', 'Ines Rieger', 'Anna Möller', 'Thomas Wittenberg', 'Ute Schmid']","['Multimodal Human Sensing, Fraunhofer-Institute for Integrated Circuits IIS, Germany and Cognitive Systems Group, University of Bamberg', 'Fraunhofer-Institute for Integrated Circuits IIS, Germany and Cognitive Systems Group, University of Bamberg', 'Fraunhofer-Institute for Integrated Circuits IIS, Germany and Chair for Visual Computing, Friedrich-Alexander-Universität Erlangen-Nürnberg', 'Fraunhofer-Institute for Integrated Circuits IIS, Germany and Chair for Visual Computing, Friedrich-Alexander-Universität Erlangen-Nürnberg', 'Cognitive Systems Group, University of Bamberg, Germany and Project Group Comprehensible AI, Fraunhofer-Institute for Integrated Circuits IIS']","['Germany', 'Germany', 'Germany', 'Germany', 'Germany']"
https://doi.org/10.1145/3531146.3533104,Fairness & Bias,Flipping the Script on Criminal Justice Risk Assessment: An actuarial model for assessing the risk the federal sentencing system poses to defendants,"In the criminal justice system, algorithmic risk assessment instruments are used to predict the risk a defendant poses to society; examples include the risk of recidivating or the risk of failing to appear at future court dates. However, defendants are also at risk of harm from the criminal justice system. To date, there exists no risk assessment instrument that considers the risk the system poses to the individual. We develop a risk assessment instrument that “flips the script.” Using data about U.S. federal sentencing decisions, we build a risk assessment instrument that predicts the likelihood an individual will receive an especially lengthy sentence given factors that should be legally irrelevant to the sentencing decision. To do this, we develop a two-stage modeling approach. Our first-stage model is used to determine which sentences were “especially lengthy.” We then use a second-stage model to predict the defendant’s risk of receiving a sentence that is flagged as especially lengthy given factors that should be legally irrelevant. The factors that should be legally irrelevant include, for example, race, court location, and other socio-demographic information about the defendant. Our instrument achieves comparable predictive accuracy to risk assessment instruments used in pretrial and parole contexts. We discuss the limitations of our modeling approach and use the opportunity to highlight how traditional risk assessment instruments in various criminal justice settings also suffer from many of the same limitations and embedded value systems of their creators.","['risk assessment', 'criminal justice', 'heteroscedastic Bayesian additive regression trees', 'LASSO', 'two-stage model', 'perspective reversal']",['Applied computing _ Law'],"['Mikaela Meyer', 'Aaron Horowitz', 'Erica Marshall', 'Kristian Lum']","['Department of Statistics & Data Science and Heinz College, Carnegie Mellon University', 'American Civil Liberties Union', 'Idaho Justice Project', 'Department of Computer and Information Science, University of Pennsylvania']","['USA', 'USA', 'USA', 'USA']"
https://doi.org/10.1145/3531146.3533184,Fairness & Bias,Gender and Racial Bias in Visual Question Answering Datasets,"Vision-and-language tasks have increasingly drawn more attention as a means to evaluate human-like reasoning in machine learning models. A popular task in the field is visual question answering (VQA), which aims to answer questions about images. However, VQA models have been shown to exploit language bias by learning the statistical correlations between questions and answers without looking into the image content: e.g., questions about the color of a banana are answered with yellow, even if the banana in the image is green. If societal bias (e.g., sexism, racism, ableism, etc.) is present in the training data, this problem may be causing VQA models to learn harmful stereotypes. For this reason, we investigate gender and racial bias in five VQA datasets. In our analysis, we find that the distribution of answers is highly different between questions about women and men, as well as the existence of detrimental gender-stereotypical samples. Likewise, we identify that specific race-related attributes are underrepresented, whereas potentially discriminatory samples appear in the analyzed datasets. Our findings suggest that there are dangers associated to using VQA datasets without considering and dealing with the potentially harmful stereotypes. We conclude the paper by proposing solutions to alleviate the problem before, during, and after the dataset collection process.","['visual question answering', 'gender stereotype', 'racial stereotype', 'datasets']","['Social and professional topics _ Gender', 'Social and professional topics _ Race and ethnicity', 'Computing methodologies _ Computer vision', 'Computing methodologies _ Natural language processing']","['Yusuke Hirota', 'Yuta Nakashima', 'Noa Garcia']","['Osaka University', 'Osaka University', 'Osaka University']","['Japan', 'Japan', 'Japan']"
https://doi.org/10.1145/3531146.3533094,Fairness & Bias,GetFair: Generalized Fairness Tuning of Classification Models,"We present GetFair, a novel framework for tuning fairness of classification models. The fair classification problem deals with training models for a given classification task where data points have sensitive attributes. The goal of fair classification models is to not only generate accurate classification results but also to prevent discrimination against subpopulations (i.e., individuals with a specific value for the sensitive attribute). Existing methods for enhancing fairness of classification models, however, are often specifically designed for a particular fairness metric or a classifier model. They may also not be suitable for scenarios with incomplete training data or where optimizing for multiple fairness metrics is important. GetFair represents a general solution to this problem.  The GetFair approach works in the following way: First, a given classifier is trained on training data without any fairness objective. This is followed by a reinforcement learning inspired tuning procedure which updates the parameters of the learned model on a given fairness objective. This disentangles classifier training from fairness tuning, making our framework more general and allowing for the adoption of any parameterized classifier model. Because fairness metrics are designed as reward functions during tuning, GetFair generalizes across any fairness metric.  We demonstrate the generalizability of GetFair via evaluation over a benchmark suite of datasets, classification models, and fairness metrics. In addition, GetFair can also be deployed in settings where the training data is incomplete or the classifier needs to be tuned on multiple fairness metrics. GetFair not only contributes a flexible method to the repertoire of tools available to improve the fairness of classification models, it also seamlessly adapts to settings where existing fair classification methods may not be suitable or applicable.","['Fair classification', 'fairness metrics', 'sensitive attribute', 'classifier models']","['Computing methodologies _ Machine learning', 'Social and professional topics _ User characteristics']","['Sandipan Sikdar', 'Florian Lemmerich', 'Markus Strohmaier']","['RWTH Aachen University', 'University of Passau', 'University of Mannheim, Germany and GESIS - Leibniz Institute for the Social Sciences']","['Germany', 'Germany', 'Germany']"
https://doi.org/10.1145/3531146.3533097,Fairness & Bias,How Different Groups Prioritize Ethical Values for Responsible AI,"Private companies, public sector organizations, and academic groups have outlined ethical values they consider important for responsible artificial intelligence technologies. While their recommendations converge on a set of central values, little is known about the values a more representative public would find important for the AI technologies they interact with and might be affected by. We conducted a survey examining how individuals perceive and prioritize responsible AI values across three groups: a representative sample of the US population (N=743), a sample of crowdworkers (N=755), and a sample of AI practitioners (N=175). Our results empirically confirm a common concern: AI practitioners’ value priorities differ from those of the general public. Compared to the US-representative sample, AI practitioners appear to consider responsible AI values as less important and emphasize a different set of values. In contrast, self-identified women and black respondents found responsible AI values more important than other groups. Surprisingly, more liberal-leaning participants, rather than participants reporting experiences with discrimination, were more likely to prioritize fairness than other groups. Our findings highlight the importance of paying attention to who gets to define “responsible AI.”","['Responsible AI', 'value-sensitive design', 'empirical ethics']","['Human-centered computing _ Empirical studies in HCI', 'Social and professional topics _ Cultural characteristics', 'Social and professional topics _ Codes of ethics']","['Maurice Jakesch', 'Zana Buçinca', 'Saleema Amershi', 'Alexandra Olteanu']","['Cornell University', 'Harvard University', 'Microsoft Research', 'Microsoft Research']","['USA', 'USA', 'USA', 'Canada']"
https://doi.org/10.1145/3531146.3533140,Fairness & Bias,Imperfect Inferences: A Practical Assessment,"Measuring racial disparities is challenging, especially when demographic labels are unavailable. Recently, some researchers and advocates have argued that companies should infer race and other demographic factors to help them understand and address discrimination. Others have been more skeptical, emphasizing the inaccuracy of racial inferences, critiquing the conceptualization of demographic categories themselves, and arguing that the use of demographic data might encourage algorithmic tweaks where more radical interventions are needed.  We conduct a novel empirical analysis that informs this debate, using a dataset of self-reported demographic information provided by users of the ride-hailing service Uber who consented to share this information for research purposes. As a threshold matter, we show how this data reflects the enduring power of racism in society. We find differences by race across a range of outcomes. For example, among self-reported African-American riders, we see racial differences on factors from iOS use to local pollution levels.  We then turn to a practical assessment of racial inference methodologies and offer two key findings. First, every inference method we tested has significant errors, miscategorizing people relative to their self-reports (even as the self-reports themselves suffer from selection bias). Second, and most importantly, we found that the inference methods worked: they reliably confirmed directional racial disparities that we knew were reflected in our dataset.  Our analysis also suggests that the choice of inference methods should be informed by the measurement task. For example, disparities that are geographic in nature might be best captured by inferences that rely on geography; discrimination based on a person’s name might be best detected by inferences that rely on names.  In conclusion, our analysis shows that common racial inference methods have real and practical utility in shedding light on aggregate, directional disparities, despite their imperfections. While the recent literature has identified notable challenges regarding the collection and use of this data, these challenges should not be seen as dispositive.","['inference', 'demographics', 'race', 'discrimination', 'civil rights', 'fairness']",['Social and professional topics _ Race and ethnicity'],"['Aaron Rieke', 'Vincent Southerland', 'Dan Svirsky', 'Mingwei Hsu']","['Upturn', 'New York University School of Law', 'Uber Technologies, Inc', 'Upturn']","['USA', 'USA', 'USA', 'USA']"
https://doi.org/10.1145/3531146.3533245,Fairness & Bias,Is calibration a fairness requirement?: An argument from the point of view of moral philosophy and decision theory,"In this paper, we provide a moral analysis of two criteria of statistical fairness debated in the machine learning literature: 1) calibration between groups and 2) equality of false positive and false negative rates between groups. In our paper, we focus on moral arguments in support of either measure. The conflict between group calibration vs. false positive and false negative rate equality is one of the core issues in the debate about group fairness definitions among practitioners. For any thorough moral analysis, the meaning of the term “fairness” has to be made explicit and defined properly. For our paper, we equate fairness with (non-)discrimination, which is a legitimate understanding in the discussion about group fairness. More specifically, we equate it with “prima facie wrongful discrimination” in the sense this is used in Prof. Lippert-Rasmussen's treatment of this definition. In this paper, we argue that a violation of group calibration may be unfair in some cases, but not unfair in others. Our argument analyzes in great detail two specific hypothetical examples of usage of predictions in decision making. The most important practical implication is that between-group calibration is defensible as a bias standard in some cases but not others; we show this by referring to examples in which the violation of between-group calibration is discriminatory, and others in which it is not. This is in line with claims already advanced in the literature, that algorithmic fairness should be defined in a way that is sensitive to context. The most important practical implication is that arguments based on examples in which fairness requires between-group calibration, or equality in the false-positive/false-negative rates, do no generalize. For it may be that group calibration is a fairness requirement in one case, but not in another.","['calibration', 'fairness', 'equalized odds', 'opportunity', 'prediction']",['Computing methodologies _ Philosophical/theoretical foundations of artificial intelligence'],"['Michele Loi', 'Christoph Heitz']","['Department of Mathematics, Politecnico di Milano', 'Institute of Data Analysis and Process, Zurich University of Applied Sciences']","['Italy', 'Switzerland']"
https://doi.org/10.1145/3531146.3533205,Fairness & Bias,"Justice in Misinformation Detection Systems: An Analysis of Algorithms, Stakeholders, and Potential Harms","Faced with the scale and surge of misinformation on social media, many platforms and fact-checking organizations have turned to algorithms for automating key parts of misinformation detection pipelines. While offering a promising solution to the challenge of scale, the ethical and societal risks associated with algorithmic misinformation detection are not well-understood. In this paper, we employ and extend upon the notion of informational justice to develop a framework for explicating issues of justice relating to representation, participation, distribution of benefits and burdens, and credibility in the misinformation detection pipeline. Drawing on the framework: (1) we show how injustices materialize for stakeholders across three algorithmic stages in the pipeline; (2) we suggest empirical measures for assessing these injustices; and (3) we identify potential sources of these harms. This framework should help researchers, policymakers, and practitioners reason about potential harms or risks associated with these algorithms and provide conceptual guidance for the design of algorithmic fairness audits in this domain.","['algorithmic fairness', 'justice', 'misinformation detection', 'machine learning', 'informational justice']",[],"['Terrence Neumann', 'Maria De-Arteaga', 'Sina Fazelpour']","['University of Texas at Austin', 'University of Texas at Austin', 'Northeastern University']","['USA', 'USA', 'USA']"
https://doi.org/10.1145/3531146.3533117,Fairness & Bias,Language variation and algorithmic bias: understanding algorithmic bias in British English automatic speech recognition,"All language is characterised by variation which language users employ to construct complex social identities and express social meaning. Like other machine learning technologies, speech and language technologies (re)produce structural oppression when they perform worse for marginalised language communities. Using knowledge and theories from sociolinguistics, I explore why commercial automatic speech recognition systems and other language technologies perform significantly worse for already marginalised populations, such as second-language speakers and speakers of stigmatised varieties of English in the British Isles. Situating language technologies within the broader scholarship around algorithmic bias, consider the allocative and representational harms they can cause even (and perhaps especially) in systems which do not exhibit predictive bias, narrowly defined as differential performance between groups. This raises the question whether addressing or “fixing” this “bias” is actually always equivalent to mitigating the harms algorithmic systems can cause, in particular to marginalised communities.","['algorithmic bias', 'speech and language technologies', 'language variation', 'speech recognition']","['Computing methodologies _ Natural language processing', 'Computing methodologies _ Speech recognition']",['Nina Markl'],['University of Edinburgh'],['United Kingdom']
https://doi.org/10.1145/3531146.3534646,Fairness & Bias,Locality of Technical Objects and the Role of Structural Interventions for Systemic Change,"Technical objects, like algorithms, exhibit causal capacities both in terms of their internal makeup and the position they occupy in relation to other objects and processes within a system. At the same time, systems encompassing technical objects interact with other systems themselves, producing a multi-scale structural composition. In the framework of fair artificial intelligence, typical causal inference interventions focus on the internal workings of technical objects (fairness constraints), and often forsake structural properties of the system. However, these interventions are often not sufficient to capture forms of discrimination and harm at a systemic level. To complement this approach we introduce the notion of locality and define structural interventions. We compare the effect of structural interventions on a system compared to local, structure-preserving interventions on technical objects. We focus on comparing interventions on generating mechanisms (representing social dynamics giving rise to discrimination) with constraining algorithms to satisfy some measure of fairness. This framework allows us to identify bias outside the algorithmic stage and propose joint interventions on social dynamics and algorithm design. We show how, for a model of financial lending, structural interventions can drive the system towards equality even when algorithmic interventions are unable to do so. This suggests that the responsibility of decision makers extends beyond ensuring that local fairness metrics are satisfied to an ecosystem that fosters equity for all.","['sociotechnical systems', 'ethics', 'fairness', 'system dynamics', 'interventions', 'lending']","['Social and professional topics _ User characteristics', 'Computing methodologies _ Causal reasoning and diagnostics', 'Human-centered computing', 'Applied computing _ Sociology']","['Efrén Cruz Cortés', 'Sarah Rajtmajer', 'Debashis Ghosh']","['Michigan Institute of Data Science, Center for the Study of Complex Systems, University of Michigan', 'College of Information Sciences and Technology, Pennsylvania State University', 'Department of Biostatistics and Informatics, University of Colorado School of Public Health']","['USA', 'USA', 'USA']"
